job_title,company,job_location,post_date,salary,job_url,job_description
Prospect Researcher/Data Analyst,Sanford Burnham Prebys Medical Discovery Institute,"San Diego, CA 92122",Posted 20 days ago,$24.79 an hour,https://www.indeed.com/rc/clk?jk=2334e5a24300bcb3&fccid=fdb926660fbd2860&vjs=3,"Sanford Burnham Prebys is a preeminent, independent biomedical research institute dedicated to understanding human biology and disease, and advancing scientific discoveries to profoundly impact human health.
Summary:
Reporting to the Senior Director, Development Services, the Prospect Researcher/Data Analyst is a key member of the Development Services team. This position will provide expert analytics and satisfy the information needs of the development team by providing proactive research, preparing profiles and reports, verifying research data, and analyzing data on individual constituents of interest to Sanford Burnham Prebys. 

Duties and Responsibilities:

Performs prospect identification and research; meets with development staff to support activities, initiatives and programs. 
Works with major gifts officers, faculty, CEO’s office, and others as appropriate to assist in compiling briefing materials on individual prospects/donors.
Monitors prospect research trends and resources. 
Develops and maintains internal guidelines for all prospect research activities
Provides a broad range of database maintenance support including, but not limited to updating records, uploading information, and ensuring the integrity of data.
Collaborates with development staff to develop prospect identification, cultivation, solicitation, and overall fundraising strategies.
Advises development staff regarding new prospect possibilities; consults on the feasibility of research requests and special projects.
Creates profile reports tailored to specific goals and/or objectives; maintains, tracks and stores profile data. 
Maintains and updates policies and procedures for the prospect research program; proposes changes and modifications. 
Reviews local and national news, business publications, economic trends and business development keeping abreast of prospect information; provides relevant information to development staff.
Conducts periodic data updates of our CRM, proposal tracking, moves management, pulling lists, queries, and reports, managing gift processing, and plans and executes other projects as assigned within the scope of responsibility.
Recommends upgrades in hardware and software to stay on the cutting edge of strategic philanthropy database management.
Secures database by developing and monitoring the implementation of policies, procedures, and controls
Maintains a user-friendly, standardized reporting system.
Develops and maintains internal guidelines for all prospect research activities.
Updates and uploads constituent information and create new individual and organizational constituent records, and proactively audit data and work to ensure correct entry of data changes and updates to help assure data integrity.
Uses a variety of reliable sources to gather, develop and analyze research data and prepare basic and comprehensive research profiles on individuals, corporations, and foundations, including background, career, financial capacity, philanthropic interests and nature of the relationship to Sanford Burnham Prebys.
Ensures the confidentiality and integrity of all donor and prospect research-related materials.


Education and/or Experience:

Bachelor’s degree
At least 3-5 years of experience in prospect research and data collection/analysis.
Experience providing staff training in software skills, prospect research and/or database use.
Experience in training and/or presenting technical information to co-workers, leaders and/or others.


Knowledge, Skills and/or Abilities:

Technical knowledge of CRM software. Raiser’s Edge/NXT experience preferred.
Advanced technical knowledge of prospect research systems such as Lexus Nexus, WealthX, Research Point or similar. 
Must be detail-oriented, data-minded, and possess strong analytical skill. 


Must have a demonstrated track record of obtaining/uncovering funding opportunities from research.
Possess strong attention to detail, analytical, time management, organizational, communication, and interpersonal skills.
Professional proficiency in Microsoft Office.


Supervisory Responsibilities:
This position does not have any supervisory responsibilities. 

Compensation:
Anticipated Hourly pay rate: $24.79/hour - $37.20/hour
Factors in determining the appropriate compensation for a role include experience, skills, knowledge, abilities, education, licensure and certifications, and other business and organizational needs. The Hiring Pay Scale referenced in the job posting is the budgeted salary or hourly range that the Institute reasonably expects to pay for this position. The Full Pay Range may be broader than what the Institute anticipates to pay for this position, based on internal equity, budget, and collective bargaining agreements (when applicable).
Sanford Burnham Prebys Medical Discovery Institute is an Equal Opportunity employer – M/F/Veteran/Disability – committed to the hiring, advancement and fair treatment of all individuals. All qualified applicants will receive consideration for employment without regard to race, color, religion, sex, sexual orientation, gender identity, national origin, age, disability, protected veteran status, or any other protected status as designated by federal, state or local law. For additional information about your rights as an applicant, click HERE.
If you need an accommodation seeking employment with Sanford Burnham Prebys, please email accommodations@sbpdiscovery.org. Accommodations are made on a case-by-case basis.

Sanford Burnham Prebys Medical Discovery Institute is an Equal Opportunity Employer – M/F/Veteran/Disability – committed to the hiring, advancement and fair treatment of all individuals."
Tactical Data Link (TDL) Analyst,Data Intelligence LLC,"San Diego, CA",Posted 30+ days ago,Full-time,https://www.indeed.com/rc/clk?jk=726757c90e9d64a7&fccid=95ff5b63d9f06588&vjs=3,"Data Intelligence, LLC (DI) is searching for a full time Tactical Data Link (TDL) Analyst. This position is onsite in Point Loma, CA. 

 In this this position, the candidate will conduct Joint Message Standards analysis that include review, analysis and development of message standards (TDL, VMF, and USMTF), related to interoperability and system documentation. They will provide support with technical documentation review, attend interoperability meetings, and participate in the discussions, providing input for the proposal of new and revised interoperability requirements. 


Job Responsibilities:

Specific support activities will include:


Review, analyze, and provide written evaluations on system specifications, message standards, Interface Change Proposals (ICPs), and related interoperability documentation as required.
Execute evaluations and prepare reports in adherence to the applicable military and government standards, specifications, and formats.
Attend and provide technical subject matter expertise during joint interoperability technical meetings in support of the Marine Corps representative at Joint or Combined Standards meetings; report on the findings and decisions following meetings.
Provide technical and engineering support for the review, analysis and development of Marine Corps documents that provide Marine Corps users (tactical systems operators, planners, commanders, interoperability specialists, and tactical system acquisition personnel) with information that assists them in the performance of their duties.
review and analyze assigned documentation to determine technical accuracy of content, impact on command-and-control operations systems, compliance with existing standardized rules and procedures, the viability of joint interfaces, and the interoperability of Marine Corps C4I systems.
produce the Marine Corps Tactical Data Systems Reference Guide (TDSRG) and provide updates and improvements to the document.
Support in the review, analysis and development of tactical data standards that support the tenants of DOD and Marine Corps Net Centric Data Strategies; provide technical expertise supporting the migration of tactical C2 data to adopt the best approach toward net centric operations; produce analytical reports of technical studies/data modeling efforts conducted in support of the Net Centric migration of tactical C2 data as required.
Support the development and evaluation of native schemas and TDL information exchanges.
investigate various technologies, such as JAVA Script Object Notation (JSON) application schemas, to enhance TDL net centric capabilities.

Required Skills/Experience:


3+ years of experience with tactical operations, research, analysis, planning, designing, developing, or evaluating systems.
Familiarity with Joint Message Standards Analyses
Understanding of TDL, Variable Message Format (VMF), and USMTF and experience with Interface Change Proposals (ICPs)
Familiarity with iSmart/eSmart
Secret Security Clearance required

Desired:


BS in a technical field
Military Operational experience
 Data Intelligence, DI is an established small business that has supported the critical missions of our government clients since 2005. We provide full life cycle system development, systems engineering, cybersecurity, and supporting analytical and logistics support to C4ISR and other complex systems. We are an equal opportunity employer that offers competitive salaries, comprehensive benefits, a team-oriented environment, and opportunities for advancement. Our excellent employee retention record reflects our employee focus. We work with Veteran's organization to proactively hire those who have served our country. We offer medical, dental and vision insurance, 401k, PTO and 11 paid holidays. 

 Data Intelligence is an Equal Opportunity/Affirmative Action employer. All qualified applicants will receive consideration for employment without regard to race, age, color, religion, creed, sex, sexual orientation, gender identity, national origin, disability, or protected Veteran status."
C5 ISR Data Scientist Analyst II w/ TS Clearance /SCI preferred,Deloitte,"San Diego, CA",Posted 30+ days ago,Full-time,https://www.indeed.com/rc/clk?jk=e1a91704cf1dcf46&fccid=9e215d88a6b33622&vjs=3,"In this age of disruption, organizations need to navigate the future with confidence by tapping into the power of data analytics, robotics, and cognitive technologies such as Artificial Intelligence (AI). Our Strategy & Analytics portfolio helps clients leverage rigorous analytical capabilities and a pragmatic mindset to solve the most complex of problems. By joining our team, you will play a key role in helping to our clients uncover hidden relationships from vast troves of data and transforming the Government and Public Services marketplace.  Work you'll do   Design and implement statistical models to analyze complex data sets and generate insights for business stakeholders  Collaborate with cross-functional teams to identify data-driven insights and opportunities to optimize business operations  Develop predictive models to forecast future trends and outcomes  Apply machine learning techniques to build predictive models and identify patterns in data  Develop data visualizations and dashboards to communicate insights to stakeholders  Collaborate with data engineers to design and implement data pipelines and ETL processes  The team   Deloitte's Government and Public Services (GPS) practice - our people, ideas, technology and outcomes-is designed for impact. Serving federal, state, & local government clients as well as public higher education institutions, our team of over 15,000+ professionals brings fresh perspective to help clients anticipate disruption, reimagine the possible, and fulfill their mission promise.  The GPS Analytics and Cognitive (A&C) offering is responsible for developing advanced analytics products and applying data visualization and statistical programming tools to enterprise data in order to advance and enable the key mission outcomes for our clients. Our team supports all phases of analytic work product development, from the identification of key business questions through data collection and ETL, and from performing analyses and using a wide range of statistical, machine learning, and applied mathematical techniques to delivery insights to decision-makers. Our practitioners give special attention to the interplay between data and the business processes that produce it and the decision-makers that consume insights.  Qualifications   Required:  Bachelor's Degree in engineering, computer science, or other technical field + 3 years of relevant data science experience  3+ years of experience working as a data scientist in a professional services consulting environment or supporting a US Navy Program Office  Knowledge of Department of the Navy Configuration Management processes and PEO C4I databases including SPIDER, CM Pro, NSERC, and Naval Lift  Strong programming skills in Python, R, or similar languages  Experience with statistical modeling and machine learning techniques, such as linear regression, decision trees, clustering, and neural networks  Active Top Secret Clearance required and /SCI or SCI eligible  Preferred:   Bachelor's or Master's Degree in computer science, statistics, mathematics or a related field  Familiarity with SQL and database systems  Knowledge of data visualization tools such as Tableau, Power BI, or D3.js  Active TS/SCI US Government Clearance"
Enterprise Business Analyst,Roche,"Carlsbad, CA 92008 (North Beach area)",Posted 30+ days ago,Full-time,https://www.indeed.com/rc/clk?jk=4fc4ae4faf25ca10&fccid=bca1c8ed48c3b338&vjs=3,"The Position
 
 Note: This is not a remote role and relocation assistantance is not being offered. All candidates must be locale and open to working onsite a minimum of 3 days per week.

 POSITION SUMMARY
 Analyze complex business problems to be solved with automated systems, including, but not limited to the ERP system implementation. Conducts analysis, design, evaluation, modification, testing and implementation of enterprise-wide process improvement initiatives in coordination with the site owner. Evaluates information gathered from multiple sources, reconciles conflicts, disseminates high-level concepts into details, distinguishes needs, identifies root cause of gaps and creates logical and innovative solutions. Organizes and facilities cross-functional project teams to address business or systems issues acting as the liaison between the business/site owner and the ERP implementation team as needed.

 ESSENTIAL DUTIES & RESPONSIBILITIES

 Develops a proficient understanding of the business process and needs
 Works closely with assigned groups to assist with defining business requirements and see them through system implementation
 Acts as a liaison between the business/site owners and the technical systems groups
 Works with all parties to ensure proper testing of defined functionality
 Works with all parties to assist with user acceptance testing and training for users
 Other duties as assigned by management
 Uses project management concepts to assist with work plan development and managing of project timelines and milestones.
 Develops and maintains internal and companywide contacts to maintain & nurture technical knowledge.
 Monitors work to ensure quality, and continuously promote Quality First Time.
 Adhere to ISO, GMP, GDP, SOX, and other regulatory requirements and supply chain best practices and guidelines.


 Requirements:

 4 years of related experience with degree or 7 years related experience without degree
 Strong knowledge of ERP/MRP systems (SAP strongly preferred) with concentration on planning/purchasing logic, item master & BOM structure, and MRP ordering parameters
 Demonstrated ability to handle varied and complex inventories with non-traditional units of measure.
 Proven expereince performing with a high level of accuracy
 Proficient with Microsoft Word and Excel
 Effective analytical problem solving, judgment and decision-making skills are required
 Strong time management and organizational skills in a dynamic, constantly changing environment
 Requires strong communication skills, attention to detail and the ability to communicate effectively with vendors, customers and within all levels of the organization.


 CERTIFICATIONS, LICENSES, REGISTRATIONS (if applicable)

 Training in GMP, ISO, and APICS certification desirable


 WORK ENVIRONMENT
 The essential functions of the job are usually performed in an environmentally controlled facility where the noise level in the work environment is usually moderate. This position may involve a combination of office and biotechnology laboratory environments. The employee may be exposed to hazardous chemicals, blood borne pathogens and automated equipment.

 While performing the job duties, the employee is regularly required to sit; reach with hands and arms and talk or hear. The employee is frequently required to stand and walk. The employee may sometimes be required to lift and/or move up to 35 pounds. Specific vision abilities required by this job include close vision, distance vision, color vision and ability to adjust focus.

 Assist with special projects as requested and perform additional duties as required



   Who we are
 
 GenMark is now a proud member of the Roche Group, more than 100,000 people across 100 countries are pushing back the frontiers of healthcare. As a global leader in healthcare, Roche Diagnostics offers a broad portfolio of products, tools and services that help in the prevention, diagnosis and management of diseases like HPV, HIV, hepatitis and diabetes as well as other medical conditions, such as fertility and blood coagulation. With the addition of GenMark to the Roche Group, syndromic infectious disease diagnostics is now added to the long list of disease states and conditions that the Roche Group addresses. GenMark’s ePlex true sample-to-answer system offers unique solutions to address the most significant challenges facing clinical laboratories, while supporting hospital systems to deliver patient-centered, value-based care. ePlex streamlines the diagnostic workflow from physician order entry to the final test report and is the true sample-to-answer solution designed to improve patient care, reduce costs, and increase lab efficiency. GenMark is headquartered in Carlsbad, California.

 GenMark is an equal opportunity employer and strictly prohibits unlawful discrimination based upon an individual’s race, color, religion, gender, sexual orientation, gender identity/expression, national origin/ancestry, age, mental/physical disability, medical condition, marital status, veteran status, or any other characteristic protected by law."
"Solutions Consultant 1 (Finance, Operations, Business Intelligence, EPM)",Lynx Solutions,"San Diego, CA 92109 (Pacific Beach area)",EmployerActive 3 days ago,"$64,480 a year",https://www.indeed.com/company/Lynx-Solutions/jobs/Business-Intelligence-Analyst-de750aae3ce7634e?fccid=002bda375d9c60f2&vjs=3,"Consultant – Lynx Solutions
We are seeking a highly talented, self-motivated, dynamic, and analytical professional. The Consultant works closely on a team under a Project Manager to implement Business Intelligence/Enterprise Performance Management (BI/EPM) software. The Consultant will design, implement and guide clients in the use of the software, while providing insights to improve and enhance current processes within a client organization. The Consultant will participate in projects that range in client type and length, and will develop and maintain working relationships with clients to ensure needs are met.
QUALIFICATIONS
· Bachelors Degree
· Experience with Data Modeling and Data Analytics
· Experience with Excel, SQL, Business Intelligence and/or Performance Management
· Experience with FP&A
Mission
To become an expert in the Enterprise Performance Management (EPM) / Business Intelligence (B/I) software industry by learning and mastering software platforms and successfully implementing these platforms. Provide and maintain 100% client satisfaction across multiple clients.
Job Type: Full-time
Pay: $64,480.00 per year
Benefits:

Dental insurance
Health insurance
Paid time off
Retirement plan
Vision insurance

Compensation package:

Yearly pay

Experience level:

1 year
2 years
No experience needed
Under 1 year

Schedule:

Monday to Friday

Education:

Bachelor's (Required)

Work Location: In person"
