job_title,company,job_location,post_date,salary,job_url,job_description
Sr. Analyst Operations Technology - Data,Republic Services,"Phoenix, AZ 85054",Posted 29 days ago,Full-time,https://www.indeed.com/rc/clk?jk=931d0ca3cb914244&fccid=e048e6229c201697&vjs=3,"POSITION SUMMARY: Sr. Analyst Operations Technology - Data is responsible for driving fleet modernization projects by liaising with the IT team to develop robust solutions to new business processes and, track and report on the key metrics in projects. Sr. Analyst Operations Technology - Data leverages their analytical skills, knowledge of application tools and techniques to drive the development of services and analytical solutions that meet the business requirements. The Sr. Analyst Operations Technology - Data works closely with IT architecture and development teams to ensure product development meets design criteria and deployment timelines. The Sr. Analyst Operations Technology - Data contributes to the overall improvement of business reporting by maintaining the data systems and implementing processes and initiatives that ultimately increase the effectiveness and integrity of data reporting and documentation. This role relies heavily on analytical skills to evaluate complex information, formulate insights, and develop sound recommendations to support implementation, reporting & analytics of new fleet and business technologies.
 PRINCIPAL RESPONSIBILITIES:

 Interfaces with IT management to create sustainable and scalable solutions for business process.
 Partners with the IT leads to ensure implementation of a solution meets the business requirements.
 Creates technical flow diagrams based on standards and process flow diagrams, wireframes and prototypes which are used to collaborate and guide development resources to rapidly develop integration assets.
 Defines and documents reporting metrics and how those metrics are calculated from source system data. Analyzes source data systems for content, writes technical definition specifications, report layouts/mockups and test scripts.
 Uses query languages like SQL to mine data, create reports and uses the latest technology to identify and analyze performance trends. This includes performance and forecast impact on future results. May also make recommendations on use of information to improve results, including recommendations on changes to business processes.
 Report project KPIs to leadership at a regular cadence.
 Performs other job-related duties as assigned or apparent.

 QUALIFICATIONS:

 Experience with business intelligence and Reporting tools like MSFT Power BI, Qlik, Tableau.
 Experience in workflow modeling, data modeling, process engineering.
 Demonstrated ability to extract data from large data warehouse (using SQL/SAS and/or Advanced Excel with Macros, Advanced Excel math Functions, Pivot tables, and Excel dashboards for data analysis)
 Scripting experience in languages like SQL, Python and/or R.
 Familiar with cloud platforms like AWS, Azure and/or GCP

 MINIMUM QUALIFICATIONS:

 Minimum of 5 years of experience in a business or technical analysis role
 Experience with project management techniques (i.e. 3 years experience with Agile, experience using Agile software tools such as Rally or similar tools)





Why choose Republic?
 Joining Republic isn’t just about taking on a new job, it’s about making a commitment to create a more sustainable world together. Our people provide an essential service, serving and impacting customers, neighborhoods, and communities everywhere.
 As a company, we are proud of our values and encourage those who share in our aspirations to join our team: · We protect our colleagues and communities through safe practices everywhere, every day. · We are committed to serving our customers and communities by going above and beyond to exceed expectations. · We take action to improve neighborhoods and communities by being environmentally responsible and creating a more sustainable world. · We are driven to deliver results in the right way. · We encourage a human centered culture that honors the unique potential and dignity of every person.

Republic Services is an equal opportunity employer. All qualified applicants will receive consideration for employment without regard to race, color, religion, gender, sexual orientation, gender identity or expression, national origin, age, disability, protected veteran status, genetic information, or any other characteristic protected by applicable law. 
The statements used herein are intended to describe the general nature and level of the work being performed by an employee in this position, and are not intended to be construed as an exhaustive list of responsibilities, duties and skills required by an incumbent so classified. Furthermore, they do not establish a contract for employment and are subject to change at the discretion of the Company."
"Snr Analyst I, Data Analytics",ASM International,"Phoenix, AZ",Posted 30+ days ago,,https://www.indeed.com/rc/clk?jk=b283e847c38ce4ac&fccid=b29f3a02e1f04995&vjs=3,"We’re not like most. We don’t just overcome obstacles – we don’t see them. Instead, we see the potential in every person, and every situation. We don’t wait for opportunity to appear – we create it. Meet ASM. A company that has been searching for people just like you.


Who is ASM?
ASM is a leading, global supplier of semiconductor wafer processing equipment. Our ambitious team is dedicated to delivering innovative technology solutions to the world’s leading semiconductor manufacturers. We have over 3,800 employees based in 14 countries, including Belgium, Japan, Netherlands, South Korea, Singapore, Taiwan and United States. Together we work to develop Epitaxy, ALD, PEALD, Vertical Furnaces and PECVD thin-film deposition technologies for our customers. Our goal is to remain an industry leader by being ahead of what’s next. We accomplish this by focusing on finding collaborative solutions to make integrated circuits, or chips, smaller, faster and even more powerful. 
ASM, an inclusive workplace
We at ASM are a truly global organization that works diligently with an open-mind in all areas of our business. We strive for a culture and work style that fosters trust and transparency. We put our people first, and that is how we will continue to succeed. We are an equal opportunity employer and value diversity. We recognize and value the differences between individuals, including gender, ethnicity, religious beliefs, sexual orientation, knowledge and experience, work background, age, skills, amongst others. Recruiting and developing a diverse workforce provides a wide range of perspectives. This enables a culture of continuously exploring and adopting new technological ideas and innovations, and it also enables us to deliver excellent products and service to our clients. 
Duties & Responsibilities

Identify risks, opportunities, and strategies to align all aspects of a Global Quality organization
Summarize and present findings through various communication channels (ex. From technician to senior quality executives with LSS backgrounds)
Apply deeper technical skills and knowledge that is shared across the functional area (e.g., deep knowledge of key data sets, modeling capabilities, etc.)
Proactively leverage appropriate information into forecast via a variety of tools and sources
Stay up to date on leading analytic capabilities, both within and outside of our industry, which can be applied within the organization
Lead Six Sigma improvement projects in KPI measurement and QMS improvement 

Financial Modelling

Develop and enhance models for long-term planning and scenario analysis
Continually identify areas of improvement in the financial planning and analysis processes 

External Analysis

Understand competitive environment by utilizing data from multiple sources
Coordinate with key stakeholders to prepare board level metrics
Development experience in creating corporate dashboards using SAP, PLM, and Power Bi programs to align KPI’s to corporate targets and resolution to drive both changes in behavior and results based on a single truth 

Essential Requirements

Bachelor’s Degree in Mechanical Engineering, Physics, or Applied Science 
Proficient in statistical methods, and statistical software e.g., Minitab.
Experience in building, deploying, and embedding capabilities into an organization
Strong understanding of data research, advanced analytics, and the communication skills to solve issues from both the bottom up and the top down
Minimum 5 years-experience in Semi-Conductor, Automotive, Aerospace or similar highly engineered product.
Experience in Global Strategic Planning and alignment of those Key Process Indicators
Experience utilizing a range of analytics involving standard data in the Semiconductor Industry e.g., Excel, SAP, PLM
Good knowledge of Problem-Solving methods. 8D, 5Y or Kepner-Tregoe
Experienced Power Bi dashboard creation
DAX Programming familiarity
Experience with external development of software.


 
Preferences

5 years’ experience in Semi-Conductors.
Lean Six Sigma/ Greenbelt
DFMEA and APQP
5 years SAP backend
Project management experience 
Share point development

From the very start of the semiconductor industry to the present day, we’ve been technology leaders who have pioneered innovation and brought new processes into mainstream manufacturing. We are collaborating, creating, and delivering on our vision – a shared vision to drive innovation with new technologies and delivering excellence with dependable products. By doing this, we’ll create new possibilities for everyone to understand, create and share more of what they love.


Join us on our journey to unleash the Power of An Open Mind. Be part of our exciting future and apply today!
www.asm.com/en/careers"
Business Analyst,"City of Mesa, AZ","Mesa, AZ",Posted 2 days ago,"$62,204 - $92,983 a year",https://www.indeed.com/rc/clk?jk=2a80f6c2d09a946e&fccid=798992f9a19958dc&vjs=3,"Description/Duties



The current assignment supports the Municipal Court. The current vacancy is grant-funded and has been designated as a non-classified, non-merit system, at-will position.
 First review of applications will be Thursday, August 10, 2023.  A Business Analyst is responsible for performing business and systems analysis; identifying design and development of technical specifications and related documentation; identifying areas of efficiencies and insufficiencies; and developing and presenting business process change recommendations and technology recommendations for the department. Employees in this classification also provide direction to internal staff and business partners as it relates to process analysis and requirement gathering for multi-function or highly complex customer solutions. This class performs related duties as required.
 Employees assigned to the Municipal Court may be required to work holidays and/or weekends. This class is supervised by an IT Manager who reviews work through conferences, reports, and overall results achieved. This class is FLSA exempt-administrative.
 Court Assignment: This Business Analyst position reports into the Project Management Office (PMO) within the Department of Innovation and Technology (DoIT) but will be assigned to the Municipal Court department. The position’s primary objective is assisting the Municipal Court with implementing an electronic Case Management solution that meets the requirements specified by the Municipal Court. The position will conduct research, develop business cases, illicit and document functional and technical requirements, analyze current processes, perform gap analysis, recommend process improvements, evaluate potential software solutions, facilitate the testing process, and develop system documentation. This position will act as a bridge between different stakeholders in the City.
 About the Ideal Candidate: The ideal candidate should have prior experience with software applications commonly used in courts. The candidate must have a strong business/systems analysis and documentation background and be able to produce comprehensive business requirements, design documentation, and process workflows. Must have demonstrated ability to communicate concepts clearly, both orally and in writing. Skilled at establishing trusted relationships with team members and building consensus. Must be a self-starter who works independently and efficiently with minimal oversight.
 Please refer to the link below for the full job description and additional information regarding assignments, preferred qualifications, and essential functions.



Qualifications & Requirements



Employee Values: All employees of the City of Mesa are expected to uphold and exhibit the City's shared employee values of Knowledge, Respect, and Integrity.
 Minimum Qualifications Required. Any combination of training, education, and experience equivalent to graduation from an accredited college or university with a Bachelor's Degree in Computer Science, Information Systems, or a technology-related study. Considerable (3 - 5 years) professional experience in business and systems analysis, including research methodologies and business process modeling.
 Special Requirements. For this position, an individual receiving a conditional offer of employment from the City of Mesa must pass a background investigation through the City of Mesa Police Department, the Arizona Department of Public Safety, and Federal Bureau of Investigation prior to commencing employment with the City of Mesa (Court Assignment).  Preferred/Desirable Qualifications. Project Management Institute, Professional in Business Analysis (PMI-PBA), or a Certified Business Analysis Professional (CBAP) certification is preferred. Proficiency with Business Analysis Body of Knowledge (BABOK)."
"Senior Business Analyst, Billing",Cox Communications,"Phoenix, AZ 85003",Posted 5 days ago,"$84,600 - $127,000 a year",https://www.indeed.com/pagead/clk?mo=r&ad=-6NYlbfkN0CcZaG8YkAWXUFBAOgCmstKkcGnU26WsyjpEFgfBAh8svC8OUP6FnHqdRaVGFGybof56D-fq1teOY-z6ELDi87tq0Yh5_p_FAQKClgXRcBGbC6DsFVbMdsSi1LH9AwzuugbfbLyp1oMAKJZOPxea2NaaSuniynBWr4poLjLATnD-qqn7LjoTTtJFOm1mIB9rciUKwOGg7R01cYKFNRM2IKpGvm14ofC4GbOTD64QTXzJkGHbaeNGpBwUcrcqdthI-XDZMS9n84whGcpaFOBnluCR6pNq3Oh5VjJqFni8ZFdxXITAG6OBHuao2-Sk9Bsrq_fxbVTyZQxCWftravLb9Z-hxCkbaJiU6P-cR52O9ijCSu1K9sLisTyrh9vtxou0rL6esqRJbFvS9xxr0OTeEPqfD-XUWe9ViZJPgAJU9_SCkQ1c-ZSUO1mvtqJCfzXhIi_XMqZj52YJA8BFIAI8M9Qwq4cVSZoduLG8UZVOWNcei0Chzdc2LE4DG4MbOZ_a83J4ptNy21Z9ba_M8g3HeZ9WvPeDEbTGLUg-qb5DXXCR7Jx8JNH6PdGnYihVzeZLEc=&xkcb=SoDB-_M3MBqflXwnAR0QbzkdCdPP&p=12&fvj=0&vjs=3,"Cox Communications is the largest private telecom company in America, proudly serving six million homes and business. That may sound like a lot, but we also proudly serve our employees and communities. Our commitment to mindful, meaningful moments of connection isn't limited to just our people, but also covers our products, services, and career opportunities. Come build a better future with us at Cox!
 
 The Senior Business Analyst, Billing will ensure the integrity of the billing system, influence software design and coordinate the successful implementation and utilization of IT applications and business solutions. This role supports the business needs, implements customer rate changes and maintains on-line billing system control parameters. This role will gather the business and technical requirements necessary to define, scope, and model IT development opportunities. This position will also perform application testing and verify user acceptance.
 

PRIMARY RESPONSIBILITIES AND ESSENTIAL FUNCTIONS: 



Ensures the integrity of the Customer Billing Systems by maintaining system parameters, by testing, evaluating, analyzing and by monitoring the overall performance on a daily, weekly, and monthly basis
Achieves optimum use of the billing system by implementing new technologies, developing innovative solutions and by advising, consulting and educating system users
Supports Customer Account integrity by managing and resolving tickets from user/clients. This requires troubleshooting and identification of root cause issues, as well as using access to implement known fixes. Utilize advanced troubleshooting and diagnostic skills for problem resolution.
Supports ongoing marketing programs and other business projects by performing feasibility studies, evaluating alternative implementation plans and providing recommendations based on billing software application. Forecast and plan for current and long-range system requirements in support of proposed solutions
Provides business consultation to clearly define and prioritize business requirements for the client and developer
Engages and Leads I.T. programmers/developers and system user/clients to gather the business and technical requirements necessary to define, scope and model I.T. development opportunities
Provides project management and planning which includes design specifications, project scope, financial analysis, testing, user acceptance, quality assurance, documentation, implementation and utilization
Configures System through updates to parameters, codes, etc, per the design specifications
Ensures a high level of user expertise by working with system users to solve system problems, develop workarounds and explore parameter mode solutions for operational improvements for customer application software systems
Influences Billing Software design by evaluating current and long-range system needs. Identifies and documents software problems, recommends software enhancements, and prioritizes software fixes and enhancements for system implementation
Utilizes knowledge of principles, practices and procedures to complete complex assignments. Advanced knowledge of organizations technologies and practices and correlations between them
Implements new Billing Software releases by analyzing, testing and debugging new applications and providing user communication training
Oversees completion of projects or assignments, through coordination of, planning, assigning, monitoring, reviewing progress and accuracy of work, evaluating results, etc, as the primary Analyst responsible for the delivery of solution in a team based environment




Minimum Qualifications: 



Bachelor's degree in a related discipline and 4 years' experience in a related field (Technology Operations, Business Intelligence, Sales, Customer Care, or Call Center Operations). The right candidate could also have a different combination, such as a master's degree and 2 years' experience; a Ph.D. and up to 1 year of experience; or 8 years' experience in a related field.
Knowledge of ICOMS order processing, including the ability to process all work order types for all Cox Products and Services
SQL skills for data extraction, analysis, manipulation and presentation
Project Management skills for managing project portfolios and reporting project status
Comprehensive knowledge of software testing concepts, including test plans, defect tracking and execution of test cases
Understanding of troubleshooting concepts and techniques




Preferred Qualifications: 



Advanced knowledge of Customer Billing Systems
4 or more years experience with advanced features of MS Office applications including Word and Excel
Analysis and understanding of administrative procedures and departmental systems
Excellent written, verbal, and interpersonal communications skills
Excellent organizational, analytical and problem-solving skills.
Ability to work well under pressure and commit to meeting strict deadlines.
Ability to accommodate a highly flexible and varied work schedule.
Ability to work autonomously on project related tasks or in team situations.



 USD 84,600.00 - 127,000.00 per year
 

About Cox Communications

 Cox Communications is the largest private telecom company in America, serving six million homes and businesses. That's a lot, but we also proudly serve our employees. Our benefits and our award-winning culture are just two of the things that make Cox a coveted place to work. If you're interested in bringing people closer through broadband, smart home tech and more, join Cox Communications today!
 

About Cox

 Cox empowers employees to build a better future and has been doing so for over 120 years. With exciting investments and innovations across transportation, communications, cleantech and healthcare, our family of businesses - which includes Cox Automotive and Cox Communications - is forging a better future for us all. Ready to make your mark? Join us today!
 
 Benefits of working at Cox may include health care insurance (medical, dental, vision), retirement planning (401(k)), and paid days off (sick leave, parental leave, flexible vacation/wellness days, and/or PTO). For more details on what benefits you may be offered, visit our benefits page .
 
 Cox is an Equal Employment Opportunity employer - All qualified applicants/employees will receive consideration for employment without regard to that individual's age, race, color, religion or creed, national origin or ancestry, sex (including pregnancy), sexual orientation, gender, gender identity, physical or mental disability, veteran status, genetic information, ethnicity, citizenship, or any other characteristic protected by law.
 
 Statement to ALL Third-Party Agencies and Similar Organizations: Cox accepts resumes only from agencies with which we formally engage their services. Please do not forward resumes to our applicant tracking system, Cox employees, Cox hiring manager, or send to any Cox facility. Cox is not responsible for any fees or charges associated with unsolicited resumes."
Business Intelligence Analyst,ConnectionsAZ,"Remote in Phoenix, AZ 85007",Posted 26 days ago,Full-time,https://www.indeed.com/rc/clk?jk=aeb41a1dd4786142&fccid=c60ef38dce87db12&vjs=3,"Overview: 
 
 We’re not just behavioral health people—we’re crisis people.


   Connections has built a model that combines medical and recovery-oriented treatment that gets people connected to community-based resources and back to their lives faster. Our aim is for solutions, not just stop-gaps. Real support, not restriction. We have proven that our model improves access, creates hope and makes the behavioral health crisis system work better, and we’re finding better ways to do it every day.
 


 Our story


   Originally founded by two emergency room psychiatrists, Dr. Chris Carson and Dr. Robert Williamson, Connections Health Solutions brings 30 years of experience serving individuals in crisis and operates two of the nation’s largest and most studied crisis response centers in Phoenix and Tucson Arizona. Since opening our doors we have provided care and treatment for hundreds of thousands of individuals in crisis.
  Responsibilities: 
 
 What You'll Do:


   This position will gather, analyze, and compile business intelligence data to identify trends and patterns. This position will then communicate recommendations for business actions based upon Company strategic objectives with executive leadership. 
 

Manages the ETL (Extract Transform Load) process for critical business data. Identify sources, refines, and applies business rules to new data. Maintains data history and integrity.
 Creates, maintains and updates Data Visualizations in Power BI or Tableau.
 Maintains Data Pipeline ensuring data quality and consistency. 
Gathers business intelligence from a variety of sources including company data, industry and field reports, public information, or purchased sources.
 Maintains current knowledge of industry and business trends through communication with professional organizations, suppliers, customers, competitors, and other informed individuals.
 Summarizes financial and economic data reports for review by executives, managers, clients, and stakeholders. 
Adhere to standards and procedures such as naming conventions, security, visualization conventions, testing and report migration.
 Create, review, and adjust standards and procedures with a spirit of continuous improvement.
 Modernize non-standard BI Reports, views, and visualizations.
 Support and mentor other team members.
 Performs other related duties as assigned. 
Qualifications: 
 
 What You'll Bring:


 Bachelor’s Degree in Business Management or related field
 2 years of experience with related duties
 Advanced SQL skills 
Advanced Tableau visualization skills


 It would be great if you had:


 Master’s Degree in Business Management or related field
 4 years or more experience with related duties


 What We Offer:


 Comprehensive health insurance, including Medical, Dental, Vision, Accident, Critical Illness, and Hospital Indemnity
 Company paid Basic Life, Short and Long-Term Disability
 Voluntary Life insurance option
 Health Savings Accounts (with employer contribution)
 Flexible Spending Accounts
 Employee Assistance Program to help with confidential emotional support, work life solutions, financial solutions, legal assistance, or online support
 Online Subscription to Headspace, a digital mindfulness and meditation platform
 401k Plan with company match
 Paid time off and 7 paid Holidays



 The Company has a mandatory vaccination policy. All successful applicants must be fully vaccinated, including showing proper documentation, or otherwise be exempt pursuant to the Company’s exemption process prior to their start date as a condition of employment."
