job_title,company,job_location,post_date,salary,job_url,job_description
Senior Data Analyst,CVS Health,"Scottsdale, AZ",Posted 7 days ago,"$43,700 - $100,000 a year",https://www.indeed.com/rc/clk?jk=a0fedf58e8226bbd&fccid=be3b11aa573faee7&vjs=3,"CVS Health companies have a mission to help people on a path to better health. CVS Caremark is an unparalleled platform to make a significant impact in US healthcare. We are working to minimize the risk of FWA in the healthcare space on behalf of our clients as well as support regulatory requirements. We improve member health and reduce costs using data science and data mining. The data analyst will act as a thought partner for business leaders in determining analytic approaches and data visualizations for reporting both internally and externally. The data analyst will be responsible to wrangle large structured and unstructured datasets from several enterprise databases and present insights to leadership to help drive strategy for the organization. The data analyst will be responsible for the management and enhancement of Clinical Support Team (CST) reporting and databases and the provision of technical support for data collection, collation, and analysis, and evaluation of internal and external metrics. The data analyst is responsible for assisting with the implementation and maintenance of procedures to ensure that all products and services meet minimum internal and external standards and end-user requirements. The data analyst must be a problem-solver with a strong work ethic to be able to make recommendations based on observations and plan process corrections by applying critical thinking for improvements. The data analyst will be part of a team that provides a customer friendly and effective triage system to provide appropriate clinical program information and to track, resolve, and report related issues.
 
 Responsibilities:
 

Create and manage/maintain Tableau dashboards to identify outliers based on prescription claim activity



Accept requests for data pulls based on criteria identified by senior analysts, investigators or leadership. Identifying/sourcing/pulling data, collaborating on the details of outputs, and delivering adhoc and/or recurring reports on a timely basis.



Determine ways to improve data output efficiencies and quality of quarterly analysis as well as documentation to better predict FWA



Assist in outputs of standard client reporting



Maintain proprietary data tool specific for client data, adding users and clients, and modifying to add value


 Pay Range
 The typical pay range for this role is:
  Minimum: 43,700
  Maximum: 100,000
 
 This pay range represents the base hourly rate or base annual full-time salary for all positions in the job grade within which this position falls. The actual base salary offer will depend on a variety of factors including experience, education, geography and other relevant factors. This position is eligible for a CVS Health bonus, commission or short-term incentive program in addition to the base pay range listed above. 
 
 In addition to your compensation, enjoy the rewards of an organization that puts our heart into caring for our colleagues and our communities. The Company offers a full range of medical, dental, and vision benefits. Eligible employees may enroll in the Company's 401(k) retirement savings plan, and an Employee Stock Purchase Plan is also available for eligible employees. The Company provides a fully-paid term life insurance plan to eligible employees, and short-term and long term disability benefits. CVS Health also offers numerous well-being programs, education assistance, free development courses, a CVS store discount, and discount programs with participating partners. As for time off, Company employees enjoy Paid Time Off (PTO) or vacation pay, as well as paid holidays throughout the calendar year. Number of paid holidays, sick time and other time off are provided consistent with relevant state law and Company policies. 
 
 For more detailed information on available benefits, please visit
  jobs.CVSHealth.com/benefits
 Required Qualifications


SQL and Python/R experience



Data Visualization experience using Tableau, Power BI, or similar



Experience with dimension reduction and machine learning algorithms



Computer literacy and proficiency in using MS Office required. Demonstrated proficiency also desired in database analytical software and internal clinical and IT systems.



Excellent attention to detail and critical thinking skills required.



Excellent verbal and written communication skills



Able to work independently, but also able to work with people in a team environment.



Ability to manage specific projects and tasks and must be able to balance multiple time demands to accomplish specific objectives. 



Exercise appropriate latitude in determining objectives of assignments and work under consultative direction toward predetermined long-range goals and objectives.



Demonstrate ability to adjust to different approaches to assignments and is open to feedback and new approaches to assignments.



Act as an advisor to management and coworkers on technical, informational, and operational issues.


 Preferred Qualifications


Experience with Healthcare and PBM data



Client and Stakeholder leadership experience, especially from commercial/clinical partners


 Education
 Bachelor Degree strongly preferred, and/or equivalent work experience required
 

Business Overview
 Bring your heart to CVS Health Every one of us at CVS Health shares a single, clear purpose: Bringing our heart to every moment of your health. This purpose guides our commitment to deliver enhanced human-centric health care for a rapidly changing world. Anchored in our brand — with heart at its center — our purpose sends a personal message that how we deliver our services is just as important as what we deliver. Our Heart At Work Behaviors™ support this purpose. We want everyone who works at CVS Health to feel empowered by the role they play in transforming our culture and accelerating our ability to innovate and deliver solutions to make health care more personal, convenient and affordable. We strive to promote and sustain a culture of diversity, inclusion and belonging every day. CVS Health is an affirmative action employer, and is an equal opportunity employer, as are the physician-owned businesses for which CVS Health provides management services. We do not discriminate in recruiting, hiring, promotion, or any other personnel action based on race, ethnicity, color, national origin, sex/gender, sexual orientation, gender identity or expression, religion, age, disability, protected veteran status, or any other characteristic protected by applicable federal, state, or local law. We proudly support and encourage people with military experience (active, veterans, reservists and National Guard) as well as military spouses to apply for CVS Health job opportunities."
Lead Data Scientist,Circle K,"Tempe, AZ 85284",Posted 30+ days ago,Full-time,https://www.indeed.com/rc/clk?jk=e57bbe53b0b0e1b3&fccid=9cfe635d4940df97&vjs=3,"Lead Data Scientist, Circle K Stores Inc., Tempe, AZ 85284:

 Suggest innovative analytic methods to solve complex business problems. Create analytic datasets in
 collaboration with data engineering teams that involves data querying, cleaning, transformation, and feature engineering. Develop, deploy, and validate advanced analytics/ machine learning models in the areas of retail merchandising and other areas as needed to derive business value. Utilize statistical, data mining and visualization techniques to generate actionable insights for the business. Pursue experimental design approaches to test hypotheses. Clearly and concisely explain analytical findings to technical and non-technical peers and business leaders.

 Telecommuting permitted: up to 2 days/ 40% a week.

 Full time employment, Monday – Friday, 40 hours per week.

 MINIMUM REQUIREMENTS:

 Must have a Master’s degree in Statistics, Data Analytics, Data Science, Applied Economics or a related field and 3 years of work experience in the field of advanced analytics, data mining, statistics.

 Must have 3 years of experience in the following:


 Application of Advanced Analytics (e.g. Statistics, Machine Learning, Artificial Intelligence) in a Non-Academic Environment (e.g. Private Sector or governmental entity)
 Processing query large datasets using SQL or spark
 Machine Learning using techniques such as regression, clustering, optimization etc.
 Data Mining, Data Analysis, Statistical Modeling
 SQL, Python, or R
 Cloud Platforms like AWS/ GCP/ or Azure
 DataViz tools like Tableau/ Power BI

 Telecommuting permitted: up to 2 days/ 40% a week.

 International travel required up to 5%.

 Circle K is an Equal Opportunity Employer. The Company complies with the Americans with Disabilities Act (the ADA) and all state and local disability laws. Applicants with disabilities may be entitled to a reasonable accommodation under the terms of the ADA and certain state or local laws as long as it does not impose an undue hardship on the Company. Please inform the Company’s Human Resources Representative if you need assistance completing any forms or to otherwise participate in the application process.

 Click below to review information about our company's use of the federal E-Verify program to check work eligibility:

 In English

 In Spanish"
AI/Machine Learning Engineer,PayPal,"Scottsdale, AZ",Posted 30+ days ago,Full-time,https://www.indeed.com/rc/clk?jk=ddc1d0cb74ffe015&fccid=978d9fd9799d55a8&vjs=3,"At PayPal (NASDAQ: PYPL), we believe that every person has the right to participate fully in the global economy. Our mission is to democratize financial services to ensure that everyone, regardless of background or economic standing, has access to affordable, convenient, and secure products and services to take control of their financial lives.
Job Description Summary: What you need to know about the role: We are currently seeking an experienced AI/ML engineer who will collaborate closely with cross-functional teams to develop and deploy AI/ML-powered features and tools that optimize employee experiences and drive business outcomes. As part of our team, you'll work with cutting-edge AI/ML technologies and be at the forefront of the latest advancements in the field. Meet our team: At PayPal (NASDAQ: PYPL), we believe that every person has the right to participate fully in the global economy. Our mission is to democratize financial services to ensure that everyone, regardless of background or economic standing, has access to affordable, convenient, and secure products and services to take control of their financial lives.
Job Description: 
Your way to impact:

 As an AI/ML engineer, you will be responsible for designing, developing, and deploying machine learning models and AI applications that solve complex business problems.

 Your day to day:

 In your day to day, you will:

 Develop and deploy machine learning models and AI applications
 Work closely with other members of the team to design and implement solutions, including collaborating with domain SMEs to understand the data and design models, working with software engineers to integrate models into products, and collaborating with product managers to define requirements and prioritize work.
 Responsible for developing and maintaining data pipelines to support machine learning models, which includes data cleaning, feature engineering, and data storage.
 As the field of AI/ML evolves, you will be responsible for staying up to date with new tools and technologies and evaluating their potential impact on the business.
 Design and develop efficient algorithms - you will need to design and develop efficient algorithms for large-scale data processing, as well as optimize existing algorithms for performance.
 Conduct experiments to evaluate model performance, including designing experiments to evaluate the performance of machine learning models, and then analyze and interpret the results to improve model performance.
 Communicate technical concepts to non-technical stakeholders, you will need to be able to communicate complex technical concepts to non-technical stakeholders in a way that is easy to understand.


 What do you need to bring:

 BS / BA degree required
 Strong programming skills in Python, Java, C++, or R, and be able to write clean, efficient, and well-documented code.
 Deep understanding of various machine learning algorithms and techniques, such as supervised and unsupervised learning, neural networks, decision trees, and clustering.
 Prior experience with popular machine learning libraries such as TensorFlow, Keras, PyTorch, or scikit-learn, and familiar with deep learning architectures and techniques, such as convolutional neural networks (CNNs), recurrent neural networks (RNNs), and reinforcement learning.
 Experience with big data processing frameworks such as Hadoop, Spark, or Kafka, and hands-on experience with Azure AI, MS Workflow, integrating REST-based APIs
 Experience with data preparation and data engineering: AI/ML engineers should have experience with data preparation and data engineering tasks such as data cleaning, feature engineering, and data transformation.
 **We know the confidence gap and imposter syndrome can get in the way of meeting spectacular candidates. Please don't hesitate to apply!


Our Benefits:
 At PayPal, we’re committed to building an equitable and inclusive global economy. And we can’t do this without our most important asset—you. That’s why we offer benefits to help you thrive in every stage of life. We champion your financial, physical, and mental health by offering valuable benefits and resources to help you care for the whole you.
 We have great benefits including a flexible work environment, employee shares options, health and life insurance and more. To learn more about our benefits please visit https://www.paypalbenefits.com 

Who We Are:
 To learn more about our culture and community visit https://about.pypl.com/who-we-are/default.aspx 

PayPal has remained at the forefront of the digital payment revolution for more than 20 years. By leveraging technology to make financial services and commerce more convenient, affordable, and secure, the PayPal platform is empowering more than 400 million consumers and merchants in more than 200 markets to join and thrive in the global economy. For more information, visit paypal.com.
PayPal provides equal employment opportunity (EEO) to all persons regardless of age, color, national origin, citizenship status, physical or mental disability, race, religion, creed, gender, sex, pregnancy, sexual orientation, gender identity and/or expression, genetic information, marital status, status with regard to public assistance, veteran status, or any other characteristic protected by federal, state or local law. In addition, PayPal will provide reasonable accommodations for qualified individuals with disabilities. If you are unable to submit an application because of incompatible assistive technology or a disability, please contact us at paypalglobaltalentacquisition@paypal.com.
 As part of PayPal’s commitment to employees’ health and safety, we have established in-office Covid-19 protocols and requirements, based on expert guidance. Depending on location, this might include a Covid-19 vaccination requirement for any employee whose role requires them to work onsite. Employees may request reasonable accommodation based on a medical condition or religious belief that prevents them from being vaccinated."
Machine Learning Expert,Modulus,"Scottsdale, AZ 85260 (North Scottsdale area)",Posted 30+ days ago,,https://www.indeed.com/rc/clk?jk=27889088c115e6bd&fccid=6aa0a46de11f7117&vjs=3,"Requirements 
Drive 
Do you have the drive to excel beyond what's asked of you? We power over obstacles with a whatever-it-takes mindset. We are constantly challenging ourselves to go beyond our comfort zones.

Adaptability 
Working at Modulus requires you to handle uncertainty, ambiguity, and change with confidence, positivity, and poise, rather than self-doubt, worry, and fear.

Humility 
We believe that humility paired with confidence helps build an environment of continuous improvement without any sense of entitlement.


Develop machine learning to actively monitor, classify and identify disparities and suspicious activity, including trading and network anomalies. Detect money laundering activities and automate filing of Suspicious Activity Reports with trade transaction data. Requires extensive experience with TensorFlow or Modulus A.I. components, experience in querying complex schemas and relational databases, and knowledge of Rough Set Theory."
Senior Lead Data Science Consultant,Wells Fargo,"Phoenix, AZ",Posted 7 days ago,Full-time,https://www.indeed.com/rc/clk?jk=86773b9d48f49e20&fccid=78bbcd26e39621f5&vjs=3,"About this role: 

 Wells Fargo is seeking a Senior Lead Data Science Consultant. You will be responsible for recognizing opportunities to improve the customer experience through the use of advanced analytics like machine learning and deep learning. More specifically, you will support data exploration and model development to evaluate and improve the customer experience using unstructured voice of customer data (e.g. speech and written communications), structured operational data (e.g. loan payment behaviors) and customer interaction data (e.g. web events). 
 

In this role, you will: 

Act as an advisor to senior leadership to develop or influence objectives, plans, specifications, resources, and long-term goals for highly complex business and technical needs that can be resolved through utilizing data-driven advanced analytical, statistical techniques, algorithms, or models 
Lead the strategy and resolution of highly complex and unique challenges requiring in-depth hypothesis generation and advanced analytics across multiple areas or the enterprise, delivering solutions that are long-term, large-scale and require vision, creativity, innovation, and advanced inductive thinking, and coordination of highly complex activities and guidance to others 
Provide vision, direction, and expertise to senior leadership on implementing innovative and significant business solutions generated from data driven insights that are large-scale, cross-functional, or companywide strategies 
Strategically engage with all levels of professionals and managers across the company and serve as an expert advisor to leadership to drive recommendations and strategies based on data driven, analytical insights, trends, and patterns 
Execute highly complex analytical experiments and create innovative statistical models to discover solutions for abstract business problems across various domains 
Interpret and analyze data, using advanced analytics modeling methods and programming, to recommend ways to solve problems and influence business decisions and strategies 
Provide consultation on data science best practices, methods, and tools to leverage 
Communicate actionable insights and recommendations using data in a digestible format to a non-technical audience of varying levels, including leadership, across the company 

Required Qualifications, US: 

7+ years of data science experience, or equivalent demonstrated through one or a combination of the following: work experience, training, military experience, education 
Master's degree or higher in a quantitative discipline such as mathematics, statistics, engineering, physics, economics, or computer science 

Desired Qualifications: 

Extensive knowledge and understanding of research and development 
Experience with Natural Language Processing (NLP) and text analytics 
Strong analytical skills with high attention to detail and accuracy 
Excellent verbal, written, and interpersonal communication skills 
Python, PySpark and SQL 
Large Language model (LLM) knowledge is strongly preferred 
Experience working with unstructured data highly preferred 
Ability to think creatively and identify opportunities to leverage machine learning or deep learning in order to improve the Wells Fargo customer experience 
Ability to translate and summarize complex analysis into understandable, actionable insights and recommendations that directly drive effective business strategy 
Ability to retrieve, combine and transform data from numerous information systems 
Develop advanced approaches and modeling techniques to extract useful information from both unstructured and structured data 
Develop robust data quality controls/processes to ensure data alignment, consistency and integrity for model development and implementation 
Work effectively in a team environment, as well as independently, to deliver against key business initiatives 
Take initiatives and drive each project to completion with minimal guidance while effectively managing multiple projects at a time 

We Value Diversity 

 At Wells Fargo, we believe in diversity, equity and inclusion in the workplace; accordingly, we welcome applications for employment from all qualified candidates, regardless of race, color, gender, national origin, religion, age, sexual orientation, gender identity, gender expression, genetic information, individuals with disabilities, pregnancy, marital status, status as a protected veteran or any other status protected by applicable law. 
 
 Employees support our focus on building strong customer relationships balanced with a strong risk mitigating and compliance-driven culture which firmly establishes those disciplines as critical to the success of our customers and company. They are accountable for execution of all applicable risk programs (Credit, Market, Financial Crimes, Operational, Regulatory Compliance), which includes effectively following and adhering to applicable Wells Fargo policies and procedures, appropriately fulfilling risk and compliance obligations, timely and effective escalation and remediation of issues, and making sound risk decisions. There is emphasis on proactive monitoring, governance, risk identification and escalation, as well as making sound risk decisions commensurate with the business unit's risk appetite and all risk and compliance program requirements. 
 
 Candidates applying to job openings posted in US: All qualified applicants will receive consideration for employment without regard to race, color, religion, age, sex, sexual orientation, gender identity, national origin, disability, or status as a protected veteran. 
 
 Candidates applying to job openings posted in Canada: Applications for employment are encouraged from all qualified candidates, including women, persons with disabilities, aboriginal peoples and visible minorities. Accommodation for applicants with disabilities is available upon request in connection with the recruitment process. 
 

Drug and Alcohol Policy 

 Wells Fargo maintains a drug free workplace. Please see our Drug and Alcohol Policy to learn more."
