job_title,company,job_location,post_date,salary,job_url,job_description
Data Analyst II,Upgrade,"Phoenix, AZ",Posted 4 days ago, Health insurance,https://www.indeed.com/pagead/clk?mo=r&ad=-6NYlbfkN0BNts19NzuMkeKqSiN9JVw1ZUBj5163DUDNDvkMIJQvvr0uQ1VqbVlczPIBvhdnSNjUX9McV81XRy7EeOrNYQ9iSFK9NfAMtfcSsQITIN7uYerArnnzwut0S3OnvSlan_iZOYiEDe-xu6iwhKML18b8_P8bAu_3y5uWNVs9Z_TBykJ6NJ_b1JQfcmk10-e9Gux8yBeNprn6fsDLha-c-82t004g6iGqJvu8FzxSia3X775N9p4nyrRFm3GfJZIXTYFw2iWhSPCDg8Ee3JnWBx5ngMdgDFoS0dv36Pj5IxopWcPyZL1wUWT_9Bum7qEH7aukbvd1duvu7w_hj3N04FhRknMnSM3juP5QjN7eduit6tPlweSLdKFwlojpMCTEwKX0SHnfTAHJfbItUDpFUp2rsNqIcRIfG6P9UJel23Xb-oJyK8phbFoTimYso0jL1ZCLA6cFPV6GpiB8qG-Mc2xlH39SbOK62Su5EF8MoHNdQGURhBReZ2rxnkWGDYd5J08iUI5LCx_8RpCqnpw9-OqXa73wzUwHzkW70SRMn5c-ttBpjzJ4fT8lg9jMby4LeYI=&xkcb=SoBi-_M3MBqCp_QgRR0LbzkdCdPP&p=0&fvj=0&vjs=3,"Upgrade is a fintech company that provides affordable and responsible credit, mobile banking, and payment products to everyday consumers. We were the fastest growing company in the Americas last year according to the Financial Times and Upgrade Card was the fastest growing credit card in America. We have delivered over $21 billion in affordable and responsible credit over the last 5 years. The company is backed by some of the most prominent technology investors and was recently valued at $6.3B.  We have built an energizing, collaborative and inclusive culture where team members help each other, learn and innovate to move the company and its customers in the right direction, and own the outcome of their efforts.  Upgrade has been named a ""Best Place to Work in the Bay Area"" three years in a row, ""Top Companies to work for in Arizona"" and one of the ""Best Engineering Department"" awarded annually by Comparably. We've also received recognition for being a best company for Diversity, Women, Culture, and Veterans.  We are looking for new team members who get excited about designing and delivering new and better products to join a team of 1500 talented and dedicated professionals. Come join us if you like to tackle big problems and make a meaningful difference in people's lives.




About the Role:
 Upgrade is looking to grow our Operations Analytics team. This key role will leverage both quantitative and qualitative skills to increase the organizational value of the Phoenix Service Center by influencing insight-driven decision making (Analysis), ensuring improved performance measurement (Visualization) and identifying solutions to help optimize operations (Prediction) As you build relationships across the operation, you will be instrumental in exploring and modeling data in order to identify new opportunities for efficiency and improvement, then visualizing critical insights to improve decision making.


 What You'll Do:

Consult with internal operations leaders to identify problems or opportunities that can leverage data and analytics to identify solutions
Collect, analyze and interpret large data sets from various sources to answer high-impact business questions and identify patterns, trends, and insights
Perform in-depth analyses and then create data models to identify trends and key drivers that inform important decisions across the business
Create professional visualizations and presentations to communicate findings and complex information to stakeholders in a concise and effective manner
 Manage multiple projects, prioritize tasks, meet deadlines and drive successful completion of analytics work while maintaining a high level of accuracy
Ask probing questions to develop data solutions that will not only meet the stakeholders requirements, but also support the goals for the use case
Drive best practices to improve the overall quality of our analytics practices and effectiveness of the integration of insights related to capacity planning, workload forecasting, workforce analytics, business impact analytics, call center analytics and customer analytics
Partnering with operations leaders, develop and support the roll-out of business KPIs and associated Tableau dashboards that simplify decision making and ensure operational success
Pay attention to small details, identify errors, and maintain high levels of accuracy when working with data
Stay up-to-date with industry trends and emerging technologies, and seek out opportunities to develop new skills



 What We Look For:

Bachelor's degree in data analytics, mathematics, statistics, computer science or related field or equivalent experience
Minimum 3+ years proven experience in data analysis and visualization, including business requirements gathering
Advanced knowledge of SQL and data query/mining techniques
Advanced knowledge of data modeling, database management and data warehousing
Strong proficiency with Tableau or related data visualization tools (PowerBI, Qlik, etc.)
Strong problem-solving and analytical skills
Strong communication, active listening and presentation skills
Ability to work independently and as part of a team
Strong proficiency in MS Excel & PowerPoint and/or Google Sheets & Slides
Experience in financial services is preferred



 Nice to Have:

Experience with Contact Center Analytics is a plus
Experience with Python is a plus



 What We Offer You:

Competitive salary and stock option plan
100% paid coverage of medical, dental and vision insurance
Flexible PTO
Opportunities for professional growth and development
Paid parental leave
Health & wellness initiatives



 Notice to California-based Candidates for Employment. This California Candidate Privacy Notice is intended to provide information about how Upgrade collects and uses personal information to California consumers who apply for employment with Upgrade If you are employed by Upgrade, refer to the Employee Handbook for additional information. For any questions about this notice, please contact [email protected].
Personal Information Upgrade Collects:
Identifiers Including name, address, email, telephone number, social security number, driver license number, passport number, and other personal identifying information. Characteristics of protected classifications under California or federal law, including demographic information and other personal information obtained during the application process, such as gender, race, national origin. Professional or employment-related information, such as salary/compensation and benefits packages, other relocation or job preferences, prior background, experience, skills, and other information in support of your application, reference information, other information obtained through background checks, including employment, credit, and criminal history. Education Information. Any other information you provide as a part of recruitment, job application, or interview process.
Purposes for Collecting Personal Information:
To consider qualifications, skills, and interest for employment. To communicate with you during the recruitment and interview process. To conduct background checks and verify your information if you are offered employment. To provide compensation, including payroll, and administer stock options and benefits, including medical, dental, vision, commuter, and retirement benefits. To provide human resources services and conduct performance evaluations. To monitor work eligibility including work-related licenses, credentials, training, and eligibility to work in the United States. To improve recruitment and interview processes and ensure a safe and efficient working environment. To comply with applicable legal or regulatory requirements including state and federal company reporting obligations.


 We are an equal opportunity employer and value diversity at our company. We do not discriminate on the basis of race, religion, color, national origin, gender, sexual orientation, age, marital status, veteran status, or disability status."
Data Analyst - W2 Contract,Biogensys,"Phoenix, AZ",Posted 1 day ago,$35 - $40 an hour,https://www.indeed.com/pagead/clk?mo=r&ad=-6NYlbfkN0ALcONX9zP3vzsQVyXitmxRLy8VCeRuNMOvRPshq8lKaH6v3p3LVJfTTZzCjMRNFpYDcnMqShRYLK3cnW4QYIFw6t1mhqYTsTCXQnYtE89cmSwfl_y8lcqjgkyCYuVQNVOzDPuFaRE5WPvfze4e-AVV-TO3DGvC5Q_VQmwWOx06dgxn1eeBA4nKQZpdAyLU1a4YfyOg1kKk8fQFm5Or77sq-Z773hfr45vCyv0o3Trlyuu5ABQL-DDd-P_zrDX98DA_DPc9PHHs8_0AV2GzyjSOu195cWC7nqZos3qLpcRzJRWS3xC8sWJLCLvqPMkEDQrg56rKl2H5vhMStzS4brD2oAJYAovVmuqxPixBv_Cr0eBSFnLgaZkiNxm4-dLySH4tI3ZaoqYqXHz7riRgFLa2EIpth-KxIrz75y1AGr17KATG8Ar7EjRSOHPIokpLvbIXYJGoFQM4f22PC83ZbMhhWcHksQAL0EQYr3Fmnre85BOsYxHZjk58IYP8UNWdgoMwPqUA97muZmgsWHIqjQexuWxQmHW0v6k=&xkcb=SoDW-_M3MBqCp_QgRR0KbzkdCdPP&p=1&fvj=1&vjs=3,"Title: Data Analyst
Location: Phoenix, AZ
Duration: 12+ Months Contract
Pay Rate: $40/hr on W2
Shift Timing: 40hr/week (8:00 am to 5:00 pm)
Biogensys is currently hiring Data Analyst for one of our client in Phoenix, AZ.
Job Description:

Designs experiments and applies methodologies to generate and collect data for use in the valuation and assessment processes.
Integrate multiple data sources, models, and software tools with business line specific decision support and data analysis.
Works collaboratively with other members of the office to implement greater efficiencies in the operation of the office, public access to records and accuracy of data for final valuations. Manages databases; extracts and imports data into applications for analysis.
Provides feedback on data collection and acquisition; conducts and maintains data mining, predictive analytics, reporting, dashboards, and data visualization projects as needed.
Proficiency using SPSS, R, and/or Python.

Education:

Bachelor’s degree in Economics, Computer Science, Data Analytics, Statistics, Urban Planning, Business Administration or another closely related discipline which includes statistics/quantitative analysis.

Job Types: Full-time, Contract
Pay: $35.00 - $40.00 per hour
Benefits:

Dental insurance
Health insurance
Vision insurance

Experience level:

3 years

Schedule:

8 hour shift
Day shift
Monday to Friday

Education:

Bachelor's (Preferred)

Experience:

Python: 3 years (Preferred)
Regression Modeler: 2 years (Preferred)
R: 3 years (Preferred)
Data Analysis: 3 years (Preferred)

Work Location: In person"
Sr. Data Analyst,Abbott Laboratories,"Scottsdale, AZ 85261",PostedToday,"$71,300 - $142,700 a year",https://www.indeed.com/pagead/clk?mo=r&ad=-6NYlbfkN0C2ZFwvvDqMqUSd2oyW6lCV3jOgG1gOU5u1NExha-d6nF0wf8tb-UVF3GoBhNeIycID5TE9GW3NiEGzuiV_coGE3ihkryNbg5G7Vuk-w5RFtX6DdniAEZ4o_TKBHsUY0C5B_YK-Hw38y0_IOZhoYavuXSZjZU7_P3g4gri9twrs4ZpCS5M6oNJslHFNmljTkoaRtWbD_4olyLviMsEiFFrSqK7qukjm4XguX-GsbaSoROCThKX3eOLCU9sXD7mkoDODlk8YEGRzaJljUURVh7638fDN6qO72M9RB4gU-vHLvdCzieX7yhuUMignqOBrpW1mmG_oqxOkC1HeWDDnsgqPD-Vi81W7jYsoZvLWji-L7NeIaq7N6C-3q1HWjysyIF0A4FHoQTbapRzfm9MpUirtQUpsJyDzfkYbBDeAcSuqO5W6S4DvrdpKJdeY1Tu_6Bfo_vfFKKlOmdw4dW8m8ynd9uASbpAOWoz41j6mf8G2qx1ibWiDpIxXylLqNANR7sU=&xkcb=SoBL-_M3MBqCp_QgRR0JbzkdCdPP&p=2&fvj=0&vjs=3,"Abbott is a global healthcare leader that helps people live more fully at all stages of life. Our portfolio of life-changing technologies spans the spectrum of healthcare, with leading businesses and products in diagnostics, medical devices, nutritionals and branded generic medicines. Our 115,000 colleagues serve people in more than 160 countries.
 Abbott is a global healthcare leader, creating breakthrough science to improve people’s health. We’re always looking towards the future, anticipating changes in medical science and technology.




 Working at Abbott
 At Abbott, you can do work that matters, grow, and learn, care for yourself and family, be your true self and live a full life. You’ll also have access to:

 Career development with an international company where you can grow the career you dream of .
 Free medical coverage for employees* via the Health Investment Plan (HIP) PPO
 An excellent retirement savings plan with high employer contribution
 Tuition reimbursement, the Freedom 2 Save student debt program and FreeU education benefit - an affordable and convenient path to getting a bachelor’s degree.
 A company recognized as a great place to work in dozens of countries around the world and named one of the most admired companies in the world by Fortune.



 The Opportunity 
As a global leader in Cardiac Rhythm Technologies, we focus on innovative technologies that can improve the way doctors treat people with heart arrhythmias, or irregular heartbeats.
 This position works out of our Scottsdale, AZ location in the Cardiac Rhythm Management division.
 We are seeking a high caliber, motivated, self-driven Sr. Data Analyst who will plan and perform data analysis for business process reviews at a department or company level.

 What You’ll Work On

 Identifies opportunities to improve the efficiency and effectiveness of the systems and process being examined (process improvement/reengineering projects).
 Evaluates internal control systems and recommends improvements in controls (control projects).
 Works with the co-sourcing partners to plan the project, draft project reports and conduct the fieldwork, which includes interviews, process flow determination, critical analysis of activities as value added/non-value added, financial analysis, system data analysis and transaction testing.
 Administers the project time, budgeting and reporting and coordination of team schedules.
 Participates in special projects as they arise, including compliance reviews, financial audits, and due diligence reviews.
 Identifies opportunities to improve the efficiency and effectiveness of the systems and process being examined (process improvement/reengineering projects).
 Participates in metric development and associated review structure
 Interfaces with multiple data sources and develops / directs necessary query script with relevant support groups
 Analyzes various types of data sets to produce and present insights to the organization
 Develops / directs automation and visualization of performance data to support various business reviews


 EDUCATION AND EXPERIENCE YOU’LL BRING

 Bachelors Degree OR an equivalent combination of education and work experience
 Minimum 6 years in related work experience with a strong understanding of specified functional area.
 Experience with SAP source data and reporting tools (HANA, Business Objects, Power BI, etc.) preferred
 Demonstrated ability to drive continuous improvement and solve problems by building relationships and collaborating.
 Ability to work in a highly matrixed and geographically diverse business environment.
 Ability to work effectively within a team in a fast-paced Agile development environment.
 Strong verbal and written communication skills.
 Ability to multi-task, prioritize, and meet deadlines in timely manner.
 Solid understanding and application of business concepts, procedures and practices. Will perform this job in a quality system environment. Failure to adequately perform tasks can result in noncompliance with governmental regulations. Works on problems of diverse scope where analysis of data requires evaluation of identifiable factors. Exercises judgment within generally defined practices and policies in selecting methods and techniques for obtaining solutions. Has a sound knowledge of a variety of alternatives and their impact on their business unit.


 Preferred Qualifications

 SAP, Power BI, SQL, R, HTML, Python, JMP, and Minitab.


 WHAT WE OFFER 
At Abbott, you can have a good job that can grow into a great career. We offer:

 A fast-paced work environment where your safety is our priority (Manufacturing roles only)
 Production areas that are clean, well-lit and temperature-controlled (Manufacturing roles only)
 Training and career development, with onboarding programs for new employees and tuition assistance
 Financial security through competitive compensation, incentives and retirement plans
 Health care and well-being programs including medical, dental, vision, wellness and occupational health programs
 Paid time off
 401(k) retirement savings with a generous company match
 The stability of a company with a record of strong financial performance and history of being actively involved in local communities


 Learn more about our benefits that add real value to your life to help you live fully: http://www.abbottbenefits.com/pages/candidate.aspx
 Follow your career aspirations to Abbott for diverse opportunities with a company that provides the growth and strength to build your future. Abbott is an Equal Opportunity Employer, committed to employee diversity.
 Connect with us at www.abbott.com, on Facebook at www.facebook.com/Abbott and on Twitter @AbbottNews and @AbbottGlobal.


 The base pay for this position is $71,300.00 – $142,700.00. In specific locations, the pay range may vary from the range posted."
