job_title,company,job_location,post_date,salary,job_url,job_description
Enterprise Data Security Operations Lead,INTEL,"Hybrid remote in Phoenix, AZ",Posted 30+ days ago,"$136,750 - $232,630 a year",https://www.indeed.com/rc/clk?jk=1710cbdb1bc3863d&fccid=936367796261bd6e&vjs=3,"Job Description
 Join SATG as an Enterprise Data Security Operations Lead! As an Enterprise Data Security Operations Lead, your primary responsibility will be to operationalize and or execute the organization's data security measures. You will be responsible for maintaining effective data security strategies and controls to protect sensitive and confidential information from unauthorized access, disclosure, alteration, or destruction. You will work closely with cross-functional teams, including IT, legal, compliance, and business units, to ensure data security practices align with organizational goals and industry best practices. You will be dealing with various enterprise data domains teams from security point of view and here are few examples of Enterprise Domains of a Manufacturing firm - Master data domains (Customer, Supplier, Product, Material, Person etc.) and Other Domains (Demand, Supply, Inventory, Pricing, Finance etc..)

 Responsibilities:

 Execute data security policies and procedures: Enforce data security policies, standards, and guidelines to safeguard data throughout its lifecycle.
 Risk assessment and mitigation: Identify potential data security risks and vulnerabilities, conduct risk assessments, and develop plans to mitigate and manage these risks effectively.
 Data classification and access control: Execute data classification framework and access control mechanisms to ensure appropriate levels of data protection based on sensitivity and user roles.
 Incident response and management: Develop and maintain an incident response plan to promptly respond to and manage data security incidents, including data breaches, unauthorized access, or data loss.
 Security awareness and training: Promote data security awareness across the organization through training programs, communication campaigns, and regular education sessions to foster a culture of security-conscious employees.
 Compliance and regulatory requirements: Stay updated with relevant data security laws, regulations, and industry standards and ensure the organization's data security practices align with legal and regulatory requirements.
 Data privacy and data protection: Collaborate with the privacy team to ensure compliance with data privacy regulations, such as GDPR or CCPA, and implement appropriate technical and organizational measures to protect personal data.
 Vendor and third-party risk management: Assess and manage data security risks associated with third-party vendors and partners, including conducting due diligence and monitoring compliance with security requirements.
 Incident monitoring and threat intelligence: Operationalize and or Execute monitoring tools and techniques to detect and respond to potential data security incidents promptly.
 Establish the Data Security Operations Forum framework, intake process, review cadence etc.
 Central point of contact for data security to coordinate between business, various stakeholders and internal IT Data groups.
 Accountable to drive the actions closure within the security forum and bring required items to Enterprise Data Council for review or approval or conflict resolutions.
 Advocate stakeholders across various organizations to apply established data governance framework including, data stewardship, metadata management, and data access controls.
 Champion the interdomain dependencies and create a stronger network among various domains.
 Represent the Enterprise Data Management group in corporate programs or data councils and become voice of Data Security Area.
 Simplification of the existing or legacy going to be a major responsibility of this role while establishing foundations for future efforts.
 Ensure issue management processes are in place to capture and resolve data issues in a timely manner.
 Excellent analytical and problem-solving skills.
 Effective communication and collaboration skills to work with cross-functional teams.
 Strong leadership skills and the willingness to drive change and influence stakeholders.

 Qualifications
 You must possess the below minimum qualifications to be initially considered for this position. Preferred qualifications are in addition to the minimum requirements and are considered a plus factor in identifying top candidates.

 Minimum Qualifications

 The candidate must have a Bachelor's Degree in Computer Engineering, Computer Science or Information Security and 9+ years of experience -OR- a Master's Degree in Computer Engineering, Computer Science and Information Security and 6+ years of experience -OR- a PhD in Computer Engineering, Computer Science and Information Security and 4+ years of experience in:

 Data security, information security, or related roles, preferably in a Lead role capacity
 Certified Information Systems Security Professional (CISSP), Certified Information Security Manager (CISM), or Certified Information Privacy Professional (CIPP)
 Data security principles, best practices, and industry standards
 Data protection laws and regulations, such as GDPR, CCPA, or HIPAA
 Network and system security technologies, including firewalls, intrusion detection systems, encryption, and authentication protocols
 Security assessment tools and methodologies

 Inside this Business Group
 Intel Capital invests in innovative startups targeting artificial intelligence, autonomous technology, data center and cloud, 5G, next-generation compute, and a wide range of other disruptive technologies. Since 1991, Intel Capital has invested US$12.6 billion in more than 1,560 companies worldwide, and 677 portfolio companies have gone public or participated in a merger or acquisition. Intel Capital curates thousands of business development introductions each year between its portfolio companies and the Global 2000. For more information on what makes Intel Capital one of the world’s most powerful venture capital firms, visit www.intelcapital.com or follow @Intelcapital.
 
 Other Locations
 US, OR, Hillsboro; US, AZ, Phoenix; US, CA, Santa Clara
 
 Covid Statement
 Intel strongly encourages employees to be vaccinated against COVID-19. Intel aligns to federal, state, and local laws and as a contractor to the U.S. Government is subject to government mandates that may be issued. Intel policies for COVID-19 including guidance about testing and vaccination are subject to change over time.
 
 Posting Statement
 All qualified applicants will receive consideration for employment without regard to race, color, religion, religious creed, sex, national origin, ancestry, age, physical or mental disability, medical condition, genetic information, military and veteran status, marital status, pregnancy, gender, gender expression, gender identity, sexual orientation, or any other characteristic protected by local law, regulation, or ordinance.
 
 Benefits
 We offer a total compensation package that ranks among the best in the industry. It consists of competitive pay, stock, bonuses, as well as, benefit programs which include health, retirement, and vacation. Find more information about all of our Amazing Benefits here: https://www.intel.com/content/www/us/en/jobs/benefits.html
 
 Annual Salary Range for jobs which could be performed in US, California: $136,750.00-$232,630.00
 

Salary range dependent on a number of factors including location and experience

 Working Model
 This role will be eligible for our hybrid work model which allows employees to split their time between working on-site at their assigned Intel site and off-site. 
 In certain circumstances the work model may change to accommodate business needs.
 JobType 
Hybrid"
Artificial Intelligence Engineer,CALLISTOFUSION,"Scottsdale, AZ",EmployerActive 7 days ago,"$90,000 - $120,000 a year",https://www.indeed.com/company/CALLISTOFUSION/jobs/Business-Intelligence-Developer-6ea5ca2d0a6215f5?fccid=24c6d3d6383040f4&vjs=3,"Hi,
We have a Full-Time requirement for Artificial Intelligence Engineer for location Scottsdale, AZ (On-site).
Job Title: Artificial Intelligence Engineer
Location: Scottsdale, AZ (On-site) This role is for an individual who can come into the office regularly.
Duration: Full-Time
Salary: Annual Salary Plus benefits
(This position offers the opportunity to share an equity stake in the business for the right candidate)
Benefits:

401(k)
Dental Insurance
Flexible schedule
Flexible spending account
Health insurance
Health savings account
Life insurance
Paid time off
Vision insurance

Job description
The successful candidate will have strong knowledge of AI methodologies (NLP, Data Modeling, Linear Regression, Classification, etc.), Python, SQL, and Cypher. This individual will be comfortable following a dynamic thought process for utilizing database-driven fields for simple code. The individual is responsible for working directly with the AI development team to create intelligent functionalities utilizing the power of AI, dynamically structured applications, produce new APIs, design database schema, and optimize system performance. The individual will have strong communication skills and will be comfortable working across multiple teams. We need an engineer who can demonstrate above the intermediate level of comfort with Python code, and libraries, someone who is eager to...

go above and beyond their role
be a leader in our organization
share knowledge with other engineers
write amazing, clean code and solutions to complex challenges
perform code review and ad hoc training
improve our process and documentation
consistently strive for excellence

Job Requirements

3+ years of AI experience
3+ years of Python programming
3+ years of database experience
3+ years of API development (RESTful services and creation of high-performing endpoints)
2+ years of working with Git

What we look for

Demonstrated leadership abilities driving results with team
Strong ability to communicate both verbally and in writing, especially with technical analysis
Strong history of delivery competence as shown by increasing responsibilities and complexity
Competency with CI/CD pipelines and Git Flow code management practice
Strong knowledge of Agile, Jira, Confluence, Slack, Google Docs, and similar management tools is a plus

Schedule:

8-hour shift
Monday to Friday

Ability to commute/relocate:

Scottsdale, AZ 85258: Reliably commute or planning to relocate before starting work (Required)

Experience:
AI: 4years (Required)
REST: 2years (Required)
Python: 2 years (Required)
Job Type: Full-time
Salary: $90,000.00 - $120,000.00 per year
Benefits:

401(k)
Dental insurance
Health insurance

Schedule:

8 hour shift

Application Question(s):

Hi,

Please submit the following details with an updated word format resume so that we can submit your profile.
Full Name (As per Passport: - --------------Work Authorization: ----------------------Total Experience: -----------------------AI Experience: -----------------------REST: Experience: -----------------------Python: Experience: -----------------------Expected Annual Salary ------------------Contact Number: -------------------Email Address: -----------------Current City/ State: -------------------
Experience:

AI: 4 years (Preferred)
Python: 2 years (Preferred)
REST: 2 years (Preferred)

Work Location: On the road"
Data and Analytics Consultant,"Systems Evolution, Inc","Phoenix, AZ",Posted 30+ days ago,,https://www.indeed.com/rc/clk?jk=4e47f43a0025fa51&fccid=00b383ab86dea51c&vjs=3,"WHO WE LOOK FOR
 An SEI-er is a master communicator and active listener who understands how to navigate an audience. Self-aware, almost to a fault, SEI-ers keenly understand how to adjust their support and problem solving based on the situation. Following a logical, fact-based approach, SEI-ers possess the superior ability to see correlations others may not, ask the right questions and drive solutions.

    As super-connectors, they connect not only people, but data, trends and experiences. Mature, humble, and genuine, SEI-ers frequently go above and beyond for both their clients and their colleagues. SEI-ers are ethical and trustworthy individuals who consistently and repeatedly follow through, and hold true to their values in difficult situations. SEI-ers have an insatiable curiosity and love to learn. These individuals are commonly tech savvy and early adopters. Their passion for learning is infectious and excites others. As every project is different, an SEI-er must be adaptable and comfortable with unexpected situations. SEI-ers define ambition differently. They are authentic, low-maintenance individuals who truly enjoy one another- they like to hang out with colleagues outside of work, collaborate and hold one another accountable. SEI-ers enjoy working with genuine, thoughtful folks who want to steer clear of the traditional grind and share the joy of day-to-day life and activities with colleagues, friends, and family.
  



 WHAT WE DO
 Our Data and Analytics consultants work with clients at all levels of the organization, from the C-suite to the shop floor, helping them to deliver on their most strategic initiatives. We’re known for making realistic, data-driven decisions that deliver value in tangible ways to our clients. Our clients ask for us on projects that require a superior combination of technical and business capabilities, people and management skills, and a collaborative mindset. We excel in understanding complex programs and strategic initiatives and breaking them into actionable pieces.
 We are actively looking for professionals in the following areas:

Data Strategy
Data Governance
Data Modernization
Advanced Analytics
Data Visualization

The ideal candidate’s experience may include but is not limited to the following:

Have experience understanding and solving real business problems
Have experience with presenting business case and strategy to the C-Suite
Bring industry domain knowledge for custom data and analytics strategies
Experience in designing and implementing data driven products and services
Experience in designing and building high performance collaborative business and technology teams that deliver high value data solutions, data products and data analytics

Ideal candidates may call themselves Data Architects, Data Engineers, Data Scientists, Analysts and Data Governance professionals. Experience may include but not limited to the following:
 Data Strategy and Governance

Intimately familiar with data technologies, data architecture frameworks, cloud platforms and the emerging trends in technological advancements.
Proven experience in transforming our clients from on-prem data platforms to the cloud.
Lead data modernization initiatives that include platform, technology and tools implementation and adoption.
Must have experience in architecting and implementing data architecture, data engineering, reporting and analytical solutions across multiple business functions and domains.
Conduct data management maturity assessments and identify pain points for including data quality, governance, architecture, analytics, metadata management, master data management.
Demonstrate a rigorous and analytical problem-solving approach, leading information-gathering sessions and preparing and delivering client presentations and work products/prototypes.
Identify data governance gaps and assess data governance maturity in a complex data environment. Should also be able to Identify the implications for data governance that arise from the technology, current processes, and skill levels in a complex data environment.

Data Architecture and Engineering

Extensive experience or knowledge of cloud-based data platform technologies such as AWS, Microsoft Azure or Google Cloud Computing.
Experience designing and building data platforms that support data lakes, data stores, data ingestion and transformations and API services for consuming data
Ability to design and build complex data pipelines that either stream data in
Experience and knowledge of programming and scripting languages, such as but not limited to Python, Node.JS and SQL
Experience and knowledge of data integration tools and platforms
Experience and knowledge of relational and dimensional database structures, theories, principles, and practice used in data warehousing and analytics solutions
Ability to design and build data models using the appropriate technics to meet business objectives
In depth knowledge of modern data technologies including Snowflake, RedShift, Azure SQL/Synaspe, Databricks or similar technologies.

Advanced Analytics and Data Visualizations

Extensive experience or knowledge of data visualization technologies such as Tableau, Power BI, Qlik and Spotfire
Experience with statistical and mathematical modeling, artificial intelligence and machine learning software and methods
Experience and knowledge of programming and scripting languages such as, but not limited to, SQL, Python and R
Experience with data modeling, data prep and machine learning tools like Alteryx, RapidMinder, RStudio and Tableau Prep
Experience and knowledge of relational and dimensional database structures, theories, principles, and practice used in data warehousing and analytics solutions
Experience deploying enterprise-wide reporting solutions while leveraging data visualization best practices

A career at SEI extends well beyond providing great service and thought leadership to our clients. Everyone takes an active role in building and managing our business, in an environment that runs counter to traditional consulting firms. Our consultants have a “seat at the table” and contribute to growing our business in ways that align to their interests such as growing business development opportunities, conducting interviews to support our hiring process, managing internal initiatives that build our brand or organizing trainings to share what you know with your colleagues. There is no telling what an SEI Consultant will be asked to do on a day-to-day basis – we do what it takes to get the job done.
 QUALIFICATIONS
 Required- 

Alignment to our core values: Excellence, Participation, Integrity and Collaboration
Hungry, Humble, Smart
Demonstrated business and technology acumen
Strong written and verbal communication skills
Understanding and experience solving real business problems
Proven track record of delivering results
Experience working with and/or leading a team
Ability to work across industries, roles, functions & technologies
Authorization for permanent employment in the United States (this position is not eligible for immigration sponsorship)

Preferred-

Bachelor’s degree
8+ years professional experience
Experience across our service offerings

The Company collects and uses Personal Information for human resources, employment, benefits administration, and business-related purposes. To comply with our regulatory obligations under the California Consumer Privacy Act (“CCPA”), the Company is required to notify you of the Personal Information we collect. To access our CCPA Policy including the categories of Personal Information we collect and the purposes for which we intend to use this information, please visit SEI's Privacy Policy.




 Systems Evolution, Inc. (SEI) is an equal opportunity employer (EOE) and all qualified applicants will receive consideration for employment without regard to race, color, religion, sex, national origin, disability status, protected veteran status, or any other characteristic protected by law"
Business Development Representative- Data Analytics,Altair Engineering,"Phoenix, AZ",Posted 30+ days ago,,https://www.indeed.com/rc/clk?jk=dbb85772406a09c5&fccid=3453268f43beb582&vjs=3,"Transforming the Future with the Convergence of Simulation and Data


 Business Development Representative - Data Anlaytics:
 Do you like a challenge, are you a complex thinker who likes to solve problems? If so, then you might be the new Altairian we are searching for. At Altair, your curiosity matters. We pride ourselves on a business culture that enables open, creative thinking, and we deeply value our employees and their contributions towards our clients' success, as well as our own.
 Job Summary:
 Altair’s Data Analytics Division is looking build our next generation of sales leaders. We are actively looking to hire recent college graduates who have a history of success in school, athletics and in their past work experience to join our BDR Team!
 We are seeking focused, driven professionals looking to start/grow their career in sales. BDRs are responsible for proactive inbound/outbound prospecting, lead/contact management and pipeline building. This position will have a direct impact on our success by providing qualified prospects to AE’s for Opportunity creation. As a member of the BDR Team you will be joining a fast-paced close nit group that thrive in a competitive environment. You will partner with AE’s across the organization to create new selling opportunities in key targeted accounts across multiple industry verticals.
 In this role, you will be provided the guidance and training needed to become a technology sales expert while mastering the art of the cold call and the finesse of targeted email campaigns. You will actively collaborate with marketing and sales executives to develop the best ways to grow the AE’s Pipeline. If you are looking to master your sales skills, grow as a sales professional and launch your sales career, this is the Opportunity for you.
 This role reports to the VP of Inside Sales.
 What You Will Do:

75+ daily sales calls
10+ First Meetings per month
Daily email outreach thru Salesloft, Outlook and Marketing
Daily use of Salesforce, PowerPoint, Microsoft Office, Zoom Info and LinkedIn Sales Navigator
Weekly Team meetings with Sales & Marketing
Partner with AE’s to create plan’s for managing a sales territory and how to consistently exceed quota
Assist in creating sales opportunities and scheduling meetings with key executives
Continuous effort to drive the business forward
Skills gained on the job: Best practices to create interest from top executives in targeted accounts
Confidence on the phone and thru Email
Exposure to working with Seasoned/Veteran Account Executives
Learn best practices in delivering presentations in a sales process

What You Will Need:
 Basics:

Bachelor’s Degree (Business, Sales or Marketing major preferred)
Organizational skills to properly plan your day and manage Salesforce.com for tracking your work
Ability to effectively communicate Altair’s Data Intelligence Software value
Excellent presentation and listening skills
Strong writing/verbal skills for effective day to day communication
Willingness to work PST hours 2 days a week
A strong desire and passion to be in sales
Creative, smart and ambitious
Work hard and Competitive mindset is a must



 How You Will Be Successful:

Envision the Future
Communicate Honestly and Broadly
Seek Technology and Business “Firsts”
Embrace Diversity and Take Risks



 What We Offer: 

Competitive Salary
Comprehensive Benefit Package
Outstanding Work/Life Balance
Flex Time
Employee Stock Purchase Program
401(k) with matching contributions
Unlimited vacation and Unlimited sick days
Paid holidays
Paid Time Off for Community Service
Collaborative environment
Charitable Matching Program
Employee Stock Purchase Program



 Why Work with Us: 
Altair is a global technology company providing software and cloud solutions in the areas of product development, high-performance computing (HPC) and artificial intelligence (AI). Altair enables organizations in nearly every industry to compete more effectively in a connected world, while creating a more sustainable future. With more than 3,000 engineers, scientists, and creative thinkers in 25 countries, we help solve our customer’s toughest challenges and deliver unparalleled service, helping the innovators innovate, drive better decisions, and turn today’s problems into tomorrow’s opportunities.


 Our vision is to transform customer decision making with data analytics, simulation, and high-performance computing and artificial intelligence (AI).


 For more than 30 years, we have been helping our customers integrate electronics and controls with mechanical design to expand product value, develop AI, simulation, and data-driven digital twins to drive better decisions, and deliver advanced HPC and cloud solutions to support unlimited idea exploration. To learn more, please visit altair.com.


 Ready to go? #ONLYFORWARD
  At our core we are explorers; adventurers; pioneers. We are the brains behind some of the world’s most revolutionary innovations and are not only comfortable in new and uncharted waters, we dive in headfirst. We are the original trailblazers that make the impossible possible, discovering new solutions to our customer’s toughest challenges.


 Altair is an equal opportunity employer. Our backgrounds are diverse, and every member of our global team is critical to our success. Altair's history demonstrates a belief that empowering each individual authentic voice reinforces a culture that thrives because of the uniqueness among our team."
