job_title,company,job_location,post_date,salary,job_url,job_description
Data Scientist,onsemi,"Scottsdale, AZ",PostedToday,,https://www.indeed.com/rc/clk?jk=7fc59df05c201dd4&fccid=d4119f39a40c1a12&vjs=3,"onsemi (Nasdaq: ON) is driving disruptive innovations to help build a better future. With a focus on automotive and industrial end-markets, the company is accelerating change in megatrends such as vehicle electrification and safety, sustainable energy grids, industrial automation, and 5G and cloud infrastructure. With a highly differentiated and innovative product portfolio, onsemi creates intelligent power and sensing technologies that solve the world’s most complex challenges and leads the way in creating a safer, cleaner, and smarter world.
 We are looking for a Data Scientist to help grow onsemi’s Advanced Analytics capabilities. This is an opportunity to impact a growing, $8B+ enterprise that recognizes the need to leverage modern data technologies and methods to help solve critical business problems. You will join a team responsible for advanced analytics and data science across all business functions in the company including Sales, Marketing, Pricing, Supply Chain, Manufacturing and Product Lines.
 You will work with other Data Scientists and Analysts through all phases of the Data Science life cycle: problem definition, exploratory analysis, model creation, validation, deployment, monitoring and performance measurement.
 Duties and Responsibilities:

Execute all aspects of the Data Science process using Python and various services available in Microsoft Azure (Azure ML, Databricks) and Snowflake:

 o Query and clean datasets o Explore datasets and make observations o Feature engineering, model selection o Model tuning, model validation o Deployment using cloud services o Monitoring performance and drift

Improve risk analysis simulations using existing predictive models and Monte Carlo simulations.


Build dashboards in Tableau to help Data Scientists and Analysts solve problems in their areas.






 Qualifications


 Completed a degree in data science, business analytics, engineering, artificial intelligence, information systems, applied/traditional statistics, mathematics, computer science, computer engineering, information technology, or a related field.


Proven experience (3+ years) as a Data Scientist preferably in business operations areas like Sales, Marketing, Pricing, Supply Chain or Manufacturing.


Experience with data frames, pandas and data cleansing in Python or similar languages.


Experience with SQL queries to retrieve data from relational databases.


Experience with software development practices like unit tests, Git, CICD.


Familiarity with modeling techniques like logistic regression, decision trees, time-series forecasting, deep-learning, and computer vision.


Familiarity with probability distributions and risk analysis simulation techniques like Monte Carlo.


Familiarity with Language Models (LLMs), prompt engineering, search indexes and chatbots.



 #LI-MY1
 #LI-Onsite





 Equal Employment Opportunity


 onsemi is an Equal Opportunity and Affirmative Action employer. The Company maintains policies and practices that are designed to prevent discrimination or harassment against any qualified applicant or employee to the extent prohibited by federal, state and local laws and regulations. By way of example, discrimination on the basis of race (actual or perceived), ethnicity, color, religion, ancestry, national origin, citizenship, sex, age, marital status, sexual orientation, physical or mental disability, medical condition, genetic information, military or veteran status, gender identity, gender expression, or any other characteristic protected by applicable law is prohibited. 
  
If you are an individual with a disability and require a reasonable accommodation to complete any part of the application process, or are limited in the ability or unable to access or use this online application process and need an alternative method for applying, you may contact US.HR@onsemi.com for assistance.





 Primary Location
: United States-AZ-Scottsdale
 

 Job
: Engineering
 

 Travel
: No
 

 Job Posting
: Jul 19, 2023, 12:59:38 PM"
Data Scientist I,Freeport McMoRan,"Remote in Phoenix, AZ 85004",Posted 14 days ago,,https://www.indeed.com/rc/clk?jk=7443aab258590c77&fccid=2e1d4d51c6f0e2bb&vjs=3,"Freeport-McMoRan is a leading international mining company with headquarters in Phoenix, Arizona. We operate large, long-lived, geographically diverse assets with significant proven and probable reserves of copper, gold, and molybdenum. The company has a dynamic portfolio of operating, expansion and growth projects in the copper industry. Freeport-McMoRan is one of the world’s largest publicly traded copper producers, the world’s largest producer of molybdenum and a significant gold producer. We have a long and successful history of conducting our business in a safe, highly efficient and socially-responsible manner.
 We have the assets, the talent, the drive and the financial strength to provide attractive and rewarding careers of our employees. We encourage you to take the time to explore the opportunity to advance your career at Freeport-McMoRan.
 Please note: This position has the possibility to work remotely up to 100% of the time. The position will require occasional travel to the Phoenix corporate offices and/or site locations . This position may be performed anywhere in the U.S. except California, Connecticut, New Hampshire, Massachusetts, Michigan, Illinois, Kentucky and New York. Additional states may be excluded from remote work based on business factors. Should the positions shift to in-office work in the future, the company will offer relocation benefits at that time should the position meet the established eligibility for these benefits.



 Description


 You will be a data science project leader within a fast-growing Data Science team pursuing a vision of analytics-driven mining at Freeport. You will work in close collaboration with global mining operations, subject matter experts, data scientists, data engineers, and software engineers to develop novel approaches to complex problems. As a project leader you will plan and manage all aspects of data science project execution while also utilizing your expertise to coach jr team members and independently develop solutions. Your data analysis, modeling, and project management skills will be an invaluable part of innovation at Freeport.

 Collaborate with technical and business experts to understand business requirements and develop an end-to-end plan for data science deliverables
 Plan, Create, and Implement complex models and algorithms independently while also coaching jr. team members and participating in R&D initiatives.
 Utilize modern cloud technologies and employ best practices from DevOps/MLOps to produce enterprise quality production Python and SQL code with minimal errors. Identify and direct the implementation code optimization opportunities and proactively pull in external experts as needed.
 Provide thought leadership in problem solving to enrich possible solutions and flexibly seek out new work or training opportunities to broaden experience
 Collaborate with a wide range of technical and business experts to communicate project deliverables in the context of business outcomes





 Qualifications


 Minimum Requirements:

 Bachelor’s degree in a technical engineering or analytical field (Statistics, Mathematics, etc.) or related discipline and five (5) years of relevant work experience, OR
 Master’s degree in a technical engineering or analytical field (Statistics, Mathematics, etc.) or related discipline and three (3) years of relevant work experience OR
 Ph.D. in a technical engineering or analytical field (Statistics, Mathematics, etc.) or related discipline and one (1) year of relevant work experience
 Python and SQL Programming Experience
 Knowledgeable Practitioner of at least three of the following analytical areas and the ability to articulate theoretical concepts from at least three
      
 Statistics & Statistical Modeling, including Time-Series Modeling
 Simulation Techniques, including MCMC or an equivalent
 Neural Networks / Deep Learning
 Tree Based Machine Learning Algorithms
 Unsupervised Learning
 Classification techniques, including Support Vector Machines or an equivalent
 Optimization Heuristics
 Text Analytics

 Ability to visualize data utilizing programmatic techniques
 Expert at executing the Data Science development workflow including data manipulation and cleaning, feature engineering, model selection, model training, modeling validation, model deployment


 Preferred Qualifications:

 Working knowledge of MLOps/DevOps concepts (Version Control, CI/CD, Trunk Based Development/PR Based Development/GIT, Test driven development)
 Working knowledge of Azure Machine Learning Environment
 Working knowledge of Software Engineering and Object Orient Programming Principles
 Working knowledge of Distributed Parallel Processing Environments such as Spark or Snowflake
 Working knowledge of Edge Analytics, embedded systems, or computer vision.
 Working knowledge of Data Architecture, engineering, and ETL teams
 Working knowledge of problem solving/root cause analysis on Production workloads
 Working knowledge of Agile, Scrum, and Kanban
 Experience as a positive mentor/coach to junior employees
 Experience influencing and building mindshare convincingly within a project team. Confident and experienced in public speaking to large audiences and storytelling with data.
 Strong verbal and written skills in English language.


 Criteria/Conditions:

 Position is in busy, non-smoking office located in downtown Phoenix, AZ
 Location requires mobility in an office environment; each floor is accessible by elevator. Occasionally work will be performed in a mine, outdoor or manufacturing plant setting.
 Must be able to frequently sit, stand and walk.
 Must be able to frequently lift and carry up to 10 pounds.
 Must be able to work in a potentially stressful environment.
 Personal protective equipment is required when performing work in a mine, outdoor, manufacturing or plant environment, including hard hat, hearing protection, safety glasses, safety footwear, and as needed, respirator, rubber steel-toe boots, protective clothing, gloves and any other protective equipment as required.
 Freeport-McMoRan promotes a drug/alcohol-free work environment through the use of mandatory pre-employment drug testing and on-going random drug testing as allowed by applicable state laws




 At Freeport, we are committed to providing an employment package that recognizes excellence, rewards value and impact, and encourages safe production. Benefits and compensation are foundational elements of this package, along with career development opportunities, job progression and a culture supported by our core values, among others. Learn more at: FCX Jobs - Working Here

 Benefits:
 We provide an industry-leading benefits package with some of the lowest cost to employees – offering health, wellness, life insurance, paid time off, retirement savings and more. These benefits are available to you and your dependents starting day one. Our comprehensive benefits program is important to how we support the health and wellness of employees and their families. For further benefits information please click here: Benefits Details

 Compensation:
 The estimated annual pay range for this role is currently $108,000-$152,000. This range reflects base salary only and does not include bonus payments, benefits or retirement contributions. Actual base pay is determined by experience, qualifications, skills and other job-related factors. This role is eligible for additional incentive compensation considerations based on company and individual performance. More details will be shared during the hiring process.

 Safety / Work Conditions:
 Candidates will be required to participate in a post-offer, pre-employment medical examination for the following positions which may have essential job duties that can impact both their own safety and the safety of others: 

Site-based positions, or positions which require unescorted access to site-based operational areas, which are held by employees who are required to receive MSHA, OSHA, DOT, HAZWOPER and/or Hazard Recognition Training; or
 Positions which are held by employees who operate equipment, machinery or motor vehicles in furtherance of performing the essential functions of their job duties, including operating motor vehicles while on Company business or travel (for this purpose “motor vehicles” includes Company owned or leased motor vehicles and personal motor vehicles used by employees in furtherance of Company business or while on Company travel).


 Equal Opportunity Employer"
Analyst - Analytics and Data Science,Blue Cross Blue Shield of Arizona,"Hybrid remote in Phoenix, AZ 85021",Posted 8 days ago,"From $70,000 a year",https://www.indeed.com/rc/clk?jk=3cc05ca011c612b6&fccid=4fe54963af81755f&vjs=3,"Awarded a Healthiest Employer, Blue Cross Blue Shield of Arizona aims to fulfill its mission to inspire health and make it easy. BCBSAZ offers a variety of health insurance products and services to meet the diverse needs of individuals, families, and small and large businesses as well as providing information and tools to help individuals make better health decisions.
 



    Blue Cross Blue Shield of Arizona (BCBSAZ) is urgently hiring entry, mid, and senior-level Analytics and Data Science Analysts to provide strategic analysis that impacts business decisions, improves efficiency, and drives innovation.
  




 In this role, you will perform data extraction, healthcare cost analysis, analytical model development, as well as production of various reports to support corporate strategies and initiatives.
  




 What to Expect
  




 Pay starting at $70,000 + depending on experience.
  




 As you work to help us improve the quality of life for Arizonans, expect to thrive in an energetic, diverse environment, championed by an organization consistently named a Best Places to Work and Most Admired Company in Arizona.
  




 This full-time remote work opportunity requires Arizona residency and work to be performed within the State of Arizona.
  




 Inspiring Health in Arizona Starts with You
  




 Our benefits support work-life balance and the flexibility you need to be your best.
  




 They include:
  







 Remote, in-office, and hybrid work options within the state of Arizona
     


       Eleven (11) paid holidays, including two floating holidays you can use any time you wish
     


       Accrued paid time off (up to 16 days per calendar year)
     


       Comprehensive medical, dental, and vision coverage
     


       401(k) up to 5% dollar-per-dollar match, 2% non-elective employer contribution
     








       Up to 12% annual bonus based on corporate goals and individual performance
     


       Eight (8) paid volunteer hours to support our mission of inspiring health
     


       Tuition reimbursement for you; scholarship opportunities for your children
     


       Employee discounts, gym reimbursement, and wellness programs
     


       Treadmill desks, full-service fitness center, onsite cafeterias
     








       Ongoing training for employees who wish to grow in their careers, acquire skills, and become managers
     





 To thrive in this job, you must be able to:
   






 Provide accurate, timely and reliable delivery of data, metrics, reporting and analysis in support of multiple strategic goals, mandates, and legislation.
     








       Develop processes, write programs and/or create databases using analytic tools to produce accurate and timely completion of analytic solutions.
     


       Identify, analyze, interpret, and validate healthcare data metrics, trends, and patterns.
     


       Develop and analyze business performance reports (e.g. for claims data, provider data, utilization data) and provide notations of performance deviations and anomalies.
     


       Model financial impact analyses for a variety of business initiatives.
     


       Interpret, communicate, and present results to all levels of management in consistent and easy-to-understand formats to facilitate fact-based decision-making.
     







 Mid-Level






       Serve as an internal analytics consultant to define business questions and transform data and analysis into meaningful and actionable information for a variety of business areas.
     


       Perform complex analyses and interpret complex calculations to recommend actions and solutions.
     


       Develop financial models needed to accomplish analytic goals.
     








       Design and deliver self-service business intelligence tools to internal customers.
     


       Deliver business intelligence to clients by applying and demonstrating expertise in the areas of advanced analytics, forecasting, data extrapolation, and predictive modeling.
     


       Train and mentor other analysts.
     





 Senior-Level








       Drive and implement complex and critical analytic initiatives with minimal oversight.
     


       Represent the department when meeting/strategizing with leadership of other areas, practicing situational awareness and balancing the business needs with prioritization of analytics resources.
     


       Review results post-implementation to ensure projections are realized and recommend modifications as applicable.
     


       Incorporate strategic planning in all areas of responsibility, collaborating with internal business partners to define and execute strategy or direction.
     


       Participate in leading overall strategic direction and execution of data, analytical and reporting capabilities, tools, outputs, insights and business/clinical interpretation and advisory services.
     







 We are looking for someone with:
   





       Intermediate PC proficiency, including spreadsheet, database, flow charting, networking, and word processing software
     


       Advanced skills in mathematics and statistics
     


       Intermediate skill with SAS/SQL programming
     








       Advanced understanding of data management principles (mid/senior level)
     


       Proficiency in SAS Enterprise Business Intelligence software (mid/senior level)
     


       Intermediate skill with data visualization tools, such as Tableau (mid/senior level)
     







 Qualifications
   





       Bachelor's Degree in mathematics, statistics, business, or related field of study
     


       1-3 years of experience in data analysis using analytic tools and processes
     


       For mid- and senior-level roles: 3-5 years of experience working for a healthcare organization/health insurer in data analysis using analytic tools, processes, and advanced SAS procedures and/or data mining
     






 Why Join Blue Cross Blue Shield of Arizona?
  




 At BCBSAZ, your pursuit of balance, happiness, and fulfillment is supported through our Workability model. Workability is our future hybrid workforce strategy and defines where and how we do our jobs: 100% remote, 100% in the office or somewhere in-between.
  




 No matter where you choose to work, we want you to be well. Our award-winning healthy campus in Phoenix is always available to you. Access telehealth services at our BlueCare Anywhere kiosk, fuel up with healthy meals and snacks at our cafeterias and Work Perks Café, and make the most of our onsite fitness center by taking advantage of personal trainers, a nutritionist, Health Support programs, and daily group fitness classes, including spin, yoga, and Zumba.
  



   Our Commitment
 


   BCBSAZ does not discriminate in hiring or employment on the basis of race, ethnicity, color, religion, sex, sexual orientation, gender identity, national origin, age, disability, protected veteran status or any other protected group.
 


   Thank you for your interest in Blue Cross Blue Shield of Arizona. For more information on our company, see azblue.com. If interested in this position, please apply."
