job_title,company,job_location,post_date,salary,job_url,job_description
Clinical Data Analyst,USC,"San Diego, CA",Posted 9 days ago,$27.04 - $35.38 an hour,https://www.indeed.com/rc/clk?jk=de1c75741ccfc061&fccid=7455773bace145da&vjs=3,"The USC Keck School of Medicine - Alzheimer Therapeutic Research Institute (ATRI), located in San Diego, California is an academic institute comprised of an expert panel of scientific collaborators committed to advancing the development of new treatments for Alzheimer’s Disease (AD) through innovative clinical trials. Throughout our Institute the study teams are highly collaborative and are comprised of the lead scientist, ATRI faculty, biostatisticians, data managers, project managers, regulatory, system developers, and industry partners. 


The Clinical Data Analyst is a data driven position. 


The successful candidate will have at least 1.5 years of experience in clinical trials at a pharmaceutical, biotechnology, or academic clinical research institute: as well as a good understanding of databases 



Key Responsibilities: 




Collaborates with the lead Data Manager and Data analysts to perform User Acceptance Testing (UAT) on the Data Management System as per the Edit Check Specifications. 
Perform data review, data cleaning, query generation in the data management systems and follow-up until queries are properly closed. 
Performs external lab and Imaging data reconciliations. 
Contributes to the development of study documentation development such as the User Acceptance Plan, Data Entry Manual, Data Management Plan, Post Entry Check specification and other study document as required. 
Maintains complete and auditable documentation of all Post Entry Checks activities 






Performs eTMF review and loading of study documentations in the eTMFs. 
Identifies eCRFs and lab query trends and propose solutions to minimize the issues. 
Liaison with the clinical team such as the CRAs, Project manager and clinical sites. 
May partake in site training and onboarding process. 
Contribute to the database launch, maintenance, and database lock under the direction of the Lead Data Manager. 






Contribute to continuous process improvement and process optimization initiatives. 




Location: San Diego, CA 



REQUIREMENTS: 



Preferred - Bachelor’s Degree 






Minimum of (1.5) years of on hands Clinical Data Management experience preferred 
R experience preferred but not required 
Excellent analytical and problem-solving skills 
Experience with Electronic Data Capture (EDC) systems 
Proficiency in MS Office, including Word, Excel, and PowerPoint, required 






Strong interpersonal and communication 
Outstanding organizational and time-management skills with the ability to prioritize tasks 




The hourly rate range for this position is $27.04 - $35.38. When extending an offer of employment, the University of Southern California considers factors such as (but not limited to) the scope and responsibilities of the position, the candidate’s work experience, education/training, key skills, internal peer equity, federal, state, and local laws, contractual stipulations, grant funding, as well as external market and organizational considerations. 



Minimum Education: Associate's degree, Combined experience/education as substitute for minimum education Minimum Experience: 6 months Minimum Field of Expertise: Requires good attention to detail with prior data entry experience. Some knowledge of medical terminology."
Data Analyst,"Midland Credit Management, Inc.","San Diego, CA 92108 (Mission Valley East area)",Posted 30+ days ago,"$69,800 - $90,700 a year",https://www.indeed.com/rc/clk?jk=67d1a77423e23ae2&fccid=9ff926b033a6c08c&vjs=3,"Starting Compensation Annual Salary: $69,800.00 - $90,700.00 (Amount based on office location, relevant experience, skills, and competencies)
 
 If you are wondering why you should work for us, here is something to help you decide:

 Pay and Bonuses: Earn a competitive salary. All employees are eligible for uncapped commission or annual bonus incentives.
 Career Progression: Grow at MCM with paid training and development programs – including our very own MCM Academy – as well as a promote-from-within philosophy.
 Reward and Recognition: We are committed to honoring great results – ranging from informal accolades to formal company-wide awards and prizes like all-inclusive vacations.
 Tuition Assistance: Pursue a degree or coursework related to your current role, or the role you are striving for.
 Healthcare Insurance: Take advantage of comprehensive healthcare plans and options to ensure your continued health, plus fitness membership reimbursements, weight watchers, our wellness rewards Program and more.
 Volunteering Opportunities: Enjoy up to eight hours of paid time off each year to volunteer. We also offer volunteer grants and matching financial donations, up to US$ 2,500 per employee annually.
 Retirement Savings: Build a strong financial foundation and reach your goals for the future. With all the effort you invest in us, we’re proud to invest in you.
 New Family Support: Celebrate your new arrival with company paid leave, new parent flex time, and child back-up care options.
 Team-building: Enjoy experiences that inspire bonds with your colleagues through a wide range of company-sponsored team-building events, such as holiday celebrations and department outings.
 Work-Life Balance: Enjoy paid and floating holidays, as well as generous paid-time-off.


 Our compensation and benefits programs were created with an 'Employee-First Approach' focused on supporting, developing, and recognizing YOU. We offer a wide array of wellness and mental health initiatives, support volunteerism, and environmental efforts, encourage employee education through leadership training, skill-building, and tuition reimbursements, and always strive to provide promotion opportunities from within.

 The Data Analyst is primarily responsible for utilizing tools such as Power BI, Salesforce, Excel, and SQL to perform in-depth analysis on market intelligence data. The analyst will produce market intelligence materials required by the business (i.e. slides, charts, decks, etc.), and use various business intelligence and analytical tools to conduct analyses to support budgeting and forecasting exercises as required. By orchestrating innovative projects, the analyst will optimize existing or develop new processes that drive business objectives and increase operational efficiencies. The analyst will work closely with the Business Development Relationship Managers to conduct regular input, review, and reconciliation of gathered market intelligence data.

 About the Job

 Verify, extract, transform, append, and standardize data from disparate data types and sources to meet system/business requirements
 Execute established processes independently, accurately, and timely with the ability to solve for nuances using technical and analytical skills
 Perform ad-hoc analysis to preserve data quality, identify critical issues, mitigate risk, and reveal data trends (e.g. profitability, performance, and variance analysis)
 Serve as a key member to solve data issues by working closely with internal and external stakeholders
 Make recommendations to improve business processes
 Design, develop, implement, and maintain technical solutions to increase operational efficiencies and deliver on strategic initiatives
 Support data warehousing architecture by gathering requirements, defining user acceptance testing, documenting changes, and monitoring results


 Required

 Bachelor; Quantitative field
 0 - 2 years of experience in an analytical / quantitative role, or equivalent education


 Preferred

 Technical — Proficient with MS Office; ability to write, analyze, and develop SQL code (Optional: Power Bi, Azure Synapse, R, Python)
 Experience working with large relational databases is a plus
 Critical thinking – must be able to derive insights and identify trends from a given data set
 Communication – Data analysts collaborate with a variety of audiences. Must be able to effectively communicate using different mediums (oral and written)
 Agile – Data analysts must understand the requirements and be flexible and dynamic in their approach


 About Us 
We are more than a specialty finance company providing debt recovery solutions for consumers. We are a global team of over 4,000 employees whose daily mission is to empower consumers to begin their path towards financial recovery and build a better life for themselves and their families. We know that the only way to support this mission is by hiring exceptional people who bring a diversity of ideas, a collaborative spirit, and a passion for attaining breakthrough results. If you are results-driven, have a passion for helping others, and thrive in an innovative environment, this might be the right place for you!

 Encore Capital Group and all of its subsidiaries are proud to be an equal opportunity employer and value diversity at our company. Qualified applicants will receive consideration for employment without regard to race, color, religion, sex, sexual orientation, gender perception or identity, national origin, age, marital status, protected veteran status, or disability status. We will ensure that individuals with disabilities are provided reasonable accommodation to participate in the job application and/or interview process, to perform essential job functions, and to receive other benefits and privileges of employment. Please contact us to request accommodation at Talent@mcmcg.com."
Research Data Analyst - Hybrid/Remote,UC San Diego Health,"Hybrid remote in San Diego, CA 92093",Posted 1 day ago,"$63,400 - $83,750 a year",https://www.indeed.com/rc/clk?jk=bcb7b8c5b962b60e&fccid=a2505069255a6e6f&vjs=3,"Payroll Title:
        RSCH DATA ANL 3 
       
        Department:
        CENTERS FOR INTEGRATIVE HEALTH 
       
        Hiring Pay Scale
        $63,400 - 83,750/year 
       
        Worksite:
        La Jolla 
       
        Appointment Type:
        Career 
       
        Appointment Percent:
        100% 
       
        Union:
        Uncovered 
       
        Total Openings:
        1 
       
        Work Schedule:
        Days, 8 hrs/day, Monday - Friday 
      




#121365 Research Data Analyst - Hybrid/Remote
Extended Deadline: Mon 7/31/2023






UC San Diego values equity, diversity, and inclusion. If you are interested in being part of our team, possess the needed licensure and certifications, and feel that you have most of the qualifications and/or transferable skills for a job opening, we strongly encourage you to apply.


For the safety and well-being of the entire university community, the University of California requires, with few exceptions, that all students, faculty and staff be vaccinated against the COVID-19 virus and influenza before they will be allowed on campus or in a facility or office. For more information visit: 
Flu Vaccine Mandate
 / 
COVID Vaccine Policy




UCSD Layoff from Career Appointment: Apply by 02/06/2023 for consideration with preference for rehire. All layoff applicants should contact their Employment Advisor.
Special Selection Applicants: Apply by 02/16/2023. Eligible Special Selection clients should contact their Disability Counselor for assistance.


Placement within the salary range is determined by internal equity, relevant qualifications, and collective bargaining agreements (when applicable).

 This position will work a hybrid schedule which includes a combination of working both onsite at La Jolla and remote.
 DESCRIPTION
 This position will initially be focused on coordinating program evaluations and research on feasibility and outcomes of new integrative wellness programs with law enforcement agencies and police officers in the state of California. This is a partnership between the CA Commission for Peace Officer Standards and Training and the UC San Diego Centers for Integrative Health. 
The position designs and conducts research including selecting data samples, developing research instruments, analyzing collected information according to established statistical methods, and developing recommendations based on research findings, and prepares reports, charts, tables, and other visual aids to interpret and communicate data and results.
 Uses skills as a seasoned, experienced research professional with a full understanding of in-depth statistical analyses and / or research software programming techniques. Demonstrates good judgment in selecting methods and techniques for obtaining solutions. Has strong project management skills to carry research projects from start to finish.
 Established in 2011, the UC San Diego Centers for Integrative Health provides whole-person health care guided by the mind- body-spirit connection. Our Centers foster innovative research, education and clinical programs that have inspired an inside-out transformation of health care.
 The Centers for Integrative Health articulate with every department and division across UC San Diego, with a physical presence at more than a dozen locations across San Diego and an international reach.
 The five Centers for Integrative Health include:

 The Center for Integrative Medicine provides integrative physician consults, osteopathic manual medicine, acupuncture/Chinese medicine, massage, jin shin jyutsu, integrative nutrition, integrative shared medical visits, and mindful health coaching at more than 15,000 patient visits per year across more than a dozen clinical locations.
 The Center for Mindfulness was among the first university-based centers around the world devoted solely to the teaching and study of mindfulness. The Center has more than 20 instructors teaching courses to more than 500 participants per year. It also participates in and conducts numerous research projects and publications.
 The Krupp Center for Integrative Research is one of the most robust integrative health research programs in the U.S. thanks to a generous gift from Richard N. Krupp (1930-2015). It supports and administers various independent research projects as well as practice-based research in the areas of integrative nutrition, natural medicine, lifestyle medicine, and integrative public health.
 The Center for Integrative Nutrition houses state-of-the-art professional training, clinical care, and rigorous research in integrative nutrition and natural medicine. Services include personal healing through the use of food-as-medicine, targeted natural therapeutics, and the creation and management of dietary interventions for many high-profile research projects.
 The Center for Integrative Education oversees educational programs for medical students, residents and the community, continuing education for health professionals, and numerous outreach activities.

 MINIMUM QUALIFICATIONS

 Seven (7) years of relevant experience or a Bachelor's degree in related area and / or equivalent experience / training plus three (3) years of relevant experience. 
Thorough knowledge of research functions including study, design, development, implementation, and analysis/reporting.
 Thorough skills associated with statistical analysis and systems programming.
 Thorough skills in analysis and consultation.
 Skills to communicate complex information in a clear and concise manner both verbally and in writing.
 Skills in project management.
 Research skills at a level to evaluate alternate solutions and develop recommendations.

 SPECIAL CONDITIONS

 Employment is subject to a criminal background check.


 Pay Transparency Act
 Annual Full Pay Range: $63,400 - $142,800 (will be prorated if the appointment percentage is less than 100%) 
Hourly Equivalent: $30.36 - $68.39 
Factors in determining the appropriate compensation for a role include experience, skills, knowledge, abilities, education, licensure and certifications, and other business and organizational needs. The Hiring Pay Scale referenced in the job posting is the budgeted salary or hourly range that the University reasonably expects to pay for this position. The Annual Full Pay Range may be broader than what the University anticipates to pay for this position, based on internal equity, budget, and collective bargaining agreements (when applicable).









Job offer is contingent on successful engagement in the UC COVID-19 Vaccination program (fully vaccinated with documented proof or approved exception/deferral).  If applicable, life-support certifications (BLS, NRP, ACLS, etc.) must include hands-on practice and in-person skills assessment; online-only certification is not acceptable.

UC San Diego Health Sciences is comprised of our School of Medicine, Skaggs School of Pharmacy and Pharmaceutical Sciences, The Herbert Wertheim School of Public Health and Human Longevity Science, and our Student Health and Well-Being Department. We have long been at the forefront of translational - or ""bench-to-bedside"" - research, transforming patient care through discovery and innovation leading to new drugs and technologies. Translational research is carried out every day in the hundreds of clinical trials of promising new therapies offered through UC San Diego Health, and in the drive of our researchers and clinician-scientists who are committed to having a significant impact on patient care. We invite you to join our team!

Applications/Resumes are accepted for current job openings only. For full consideration on any job, applications must be received prior to the initial closing date. If a job has an extended deadline, applications/resumes will be considered during the extension period; however, a job may be filled before the extended date is reached.

To foster the best possible working and learning environment, UC San Diego strives to cultivate a rich and diverse environment, inclusive and supportive of all students, faculty, staff and visitors. For more information, please visit UC San Diego Principles of Community.
 
UC San Diego Health is an Equal Opportunity/Affirmative Action Employer. All qualified applicants will receive consideration for employment without regard to race, color, religion, sex, national origin, disability, age, protected veteran status, gender identity or sexual orientation. For the complete University of California nondiscrimination and affirmative action policy see: http://www-hr.ucsd.edu/saa/nondiscr.html 
UC San Diego is a smoke and tobacco free environment. Please visit smokefree.ucsd.edu for more information.
UC San Diego Health maintains a marijuana and drug free environment. Employees may be subject to drug screening."
Data Analyst Level 1,Tactical Engineering & Analysis Inc,"San Diego, CA 92152 (Wooded Area area)",Posted 30+ days ago,"$70,000 - $95,000 a year",https://www.indeed.com/rc/clk?jk=cdfa92b41662c782&fccid=ffeb108f6f540ace&vjs=3,"Overview: 
 
   We are currently seeking a Data Analyst Level 1 to support the Naval Information Warfare Center Pacific (NIWC-PAC) Joint Test and Evaluation (JT&E) Programs.
 
 Responsibilities: 
 
 Essential Functions/Job Duties:


 Works under close supervision to:
   
 Utilize common Tactical Data Link (TDL) data analysis tools to support the validation of system requirements, root-cause and trouble shooting of complex issues observed or documented during testing.
 Utilize system specifications and requirement documentations to support analysis.
 Research technical documentation and requirements to support analysis findings.
 Decompose test requirements from various TDL systems and interface specifications to test specific capabilities of a system.
 Contribute to requirement results and test requirement traceability.
 Support in the planning and development approach of new systems, new capabilities and functionality of the system.
 Contribute to investigations regarding new technical concepts and capabilities to support development of new analysis methods and metrics.
 Generate and/or contribute to required test reports, which include Test Observation Report forms, Final Test Reports and Test Plans.
 Periodically stand-in as a Test Engineer to support during testing efforts.



 Equipment Used:


 Generic PC Workstation.


 Typical Working Conditions:


 General office environment
 Computer/Equipment lab.


 Essential Physical Tasks:


 Potential to travel domestically 5-15% of the time.  
Ability to lift 10 lbs on an occasional basis.  
Ability to use a computer and mouse on a consistent basis.


 Written Communications:


 Operates standard computer based business tools (including but not limited to Microsoft Word and Excel) effectively.
 Independently generates documentation that presents ideas and/or information in a logical manner. 
Able to organize the information and use the best methods and/or formats for its delivery.


 Verbal Communications:


 Demonstrates clear and concise written and verbal communication skills in the English language.
 Active communicator – giving full attention to what other people are saying, taking time to understand the points being made, asking questions as appropriate.
 Qualifications: 
 
 Skills/Qualifications:


 Two (2) years of experience operating various Navy Command, Control, Communications, Computers, and Intelligence (C4I) systems, U.S. Military Communication Systems and associated interfaces and computer control equipment.
 Desire experience with Navy Command and Control (C2) operational concepts and environments; Navy C2 architectures, participants and operations involved.


 Customer Interface Activities:


 Interfaces with customer and other contractor/civilian/military representatives utilizing clear and effective written and oral communication skills.
 Supports the briefing of Information Technology strategies, concepts, approaches, training, and status material in various settings.


 Project Management / Staff Supervision Tasks:


 Follows Government, company, or project processes and approval methods. Ability to follow clear established process and team priorities.


 Work Schedule: 


9/80 
Must have ability to work within company and customer schedule requirements which may vary depending on criticality and necessity of a given task.
 The ability to work non-standard work hours and schedules in support of project requirements.


 Minimum Education Requirements:


 Bachelors Degree in a STEM field preferred
 High School Diploma with 4 years of relevant experience may be considered in lieu of degree


 Pay Range: $70,000.00 to $95,000.00 Full-Time
 


 U.S. Citizenship is required



 Security Clearance:



 Candidates must have an active clearance OR the ability to obtain a US Government security clearance, and will be subject to a US security background investigation (i.e. favorable background investigation / credit score). Additional eligibility requirements for access to various levels of classified information may also be required. An active security clearance is highly desirable.
 


 Tactical Engineering & Analysis, Inc. is an Equal Employment Opportunity/Affirmative Action/Minority/Female/Disability/Protected Veteran Employer"
