job_title,company,job_location,post_date,salary,job_url,job_description
Senior BI Analyst,"Vuori, Inc","Carlsbad, CA 92008 (North Beach area)",Posted 30+ days ago,"$135,000 - $160,000 a year",https://www.indeed.com/rc/clk?jk=71108934fb2c7f88&fccid=81dccc698d0374b6&vjs=3,"Company Description
  Vuori is re-defining what athletic apparel looks like: built to move and sweat in but designed with a casual aesthetic to transition into everyday life. We draw inspiration from an active coastal California lifestyle; an integration of fitness, creative expression and life. Our high energy fast paced office environment is reflected in the clothes we make. We aim to inspire others to take on all aspects of their lives with clarity, enthusiasm and purpose…while having a lot of fun along the way. We are proud to be an outlet for opportunity and for personal growth and success.



 Job Description
  The Senior BI Analyst will provide timely and professional onsite and remote support to Vuori Staff and partners in both a growing office and retail brick ‘n’ mortar Omni-Channel eco-system.
 Primary duties include working with key department stakeholders on validating source and end point data views, defining report/analytics requirements and specifications, teaming up with the tech Product Managers and business users, building workflow and data profiling exercises to ensure full transparency of data integrity, definitions, cadence, and exceptions. This position will be the hub for analytic/reports requirements as well as backend data requirements/needs. They are responsible for answering queries and addressing data and analytic/reports issues in a timely and professional manner.
 Responsibilities include, but are not limited to:

 Working alongside the Product Manager, develop report specific details and specifications from high level scope at the reporting level, adjusting course as necessary and communicating changes to requisite audiences.
 Build reports in PowerBI, DOMO(visualization tool) and other analyst/reporting tools, using the requirements and specifications derived from the requirements gathering exercises.
 With a high level of communicative expertise, represent and translate the “story of the numbers” via visualizations, graphs, dashboards, commentary, etc., appropriate to the audience and nature of the request.
 Working with systems and data engineers, source existing data to develop reports, or, in the event of nonexistent data, identify root source systems in which necessary data resides.
 Work with Data Governance manager to maintain knowledge base/foundation of KPI/Metric/Report definitions, intentions, and access.
 Manage relationships and time between projects and product owners while effectively communicating progress, obstacles, change of course, etc., as dictated by reporting dependencies and needs of business.
 Oversee and administer BI & Analytics tool/platform capabilities.
 Make technological adjustments to BI & Analytics tool/platforms to improve their performance.
 Develop algorithms and models to mine large data sets.
 Use statistical analysis to identify patterns, correlations, and actionable results.




 Qualifications
 

 A four-year technical degree or equivalent work experience is preferred.
 7 or more years building and maintaining dashboards, analyses, reports, etc.
 High degree of proficiency with Power BI, including administration.
 Background with other BI tools and systems such as DOMO, Tableau, and Looker.
 Fundamental understanding of systems and data architecture.
 Strong SQL programming skills, including the use of SQL analytic functions and stored procedure development and maintenance.
 Strong excel experience (sumif, offset, vlookup, pivot tables).
 Exposure to analytics tools (Alteryx, SAS, etc.).
 Love for data and data storytelling.
 Proficient and knowledgeable on the systems and processes required to achieve consistently high customer satisfaction.
 Comfortable working in a matrixed organization involving cross-functional projects; strong communication and collaboration skills.
 Excellent organizational skills to manage priorities.
 Well organized, adaptable, and a clear thinker.

 Additional Information
  Pay Range: From $135,000 - $160,000 annually
 Benefits:

 Health Insurance
 Paid Time Off
 Employee Discount
 401(k)

 All your information will be kept confidential according to EEO guidelines."
Call Center Analyst Intermediate - Temporary,Kaiser Permanente,"San Diego, CA",Posted 13 days ago,,https://www.indeed.com/rc/clk?jk=64aea624782d590c&fccid=48ecd526e3aa3225&vjs=3,"Provides operational support and report writing services in a multi-platform environment for the call center. Functions as a member of the Operations Team for the call center. Analyzes contact center trends, including call volume, call patterns, staff productivity, attrition rates, and resource allocation. Conducts call pattern forecasting and schedule planning activities to help meet business unit objectives. Monitors and/or develops the application of scheduling systems, including policy and procedures, operating structure, and information flow. May recommend operational improvements.


 Essential Functions:


Develops hourly, daily, weekly and monthly historical reports from the automated call distribution and PC based contact management systems.
Presents trend reports to management to assist in organizational development.
Designs and utilizes survey/reports to monitor and assess service center performance.
Develops and maintains user profiles/I.D.s. for the customer service representatives in the ACD and Contact Management systems (for skill based routing and scheduling purposes).
Administrator of the Workforce Management System to forecast and produce schedules and show adherence for Customer Service Representatives for the Call Center.
Provides training to Customer Service Reps./Management on software and statistical data.
Works with outside telecommunications companies/vendors to assist Senior Data Analyst with Adds/Moves Changes as needed.
Identifies changes in operations, budgets, quality of services or practices.
Defines problems/issues; proposes and discusses solutions with appropriate parties.
Determines need for automated data analysis and/or research project to assess current systems/procedures and develops new tools for data collection.



 Basic Qualifications:
 Experience
  

Minimum three (3) years of call center/Health Plan experience.
 Education
  

Associate's degree in related field, OR two (2) years of experience in a directly related field.
High School Diploma or General Education Development (GED) required.
 License, Certification, Registration
  

N/A


Additional Requirements:


Related call center experience.
Has substantial understanding of the job, and applies knowledge and skills to complete a wide range of tasks.
Must be able to work in a Labor/Management Partnership environment.



 Preferred Qualifications:


N/A



 Notes:

 Will support the whole Operations/Workforce Support department.
 Temporary 90 day position.
 This is a temporary position for approximately 3 months.

 PrimaryLocation : California,San Diego,California Service Center
  HoursPerWeek : 40
  Shift : Day
  Workdays : Mon, Tue, Wed, Thu, Fri
  WorkingHoursStart : 08:00 AM
  WorkingHoursEnd : 04:30 PM
  Job Schedule : Full-time
  Job Type : Standard
  Employee Status : Temporary
  Employee Group/Union Affiliation : NUE-SCAL-01|NUE|Non Union Employee
  Job Level : Entry Level
  Job Category : Customer Services
  Department : California Service Center No.1 - Generl Admin-Regional - 0801
  Travel : No
  Kaiser Permanente is an equal opportunity employer committed to a diverse and inclusive workforce. Applicants will receive consideration for employment without regard to race, color, religion, sex (including pregnancy), age, sexual orientation, national origin, marital status, parental status, ancestry, disability, gender identity, veteran status, genetic information, other distinguishing characteristics of diversity and inclusion, or any other protected status."
Student Information Systems Business Analyst,California State University,"San Diego, CA",Posted 30+ days ago,"$8,334 a month",https://www.indeed.com/rc/clk?jk=51cba6591997770a&fccid=938c68fc89db4b9d&vjs=3,"Campus:
 San Diego 
   




Job ID: 529318 
   




Job Title:
 Student Information Systems Business Analyst (Analyst/Programmer- Career) 
   




Appointment Type:
 Probationary 
   




Time Base:
 Full-Time 
   




Date Posted:
 June 22, 2023 
   

Closing Date:
 Open until filled
   










Description:








Position Summary
 Under the direction of the Associate Vice President, Enrollment Services, the Student Information Systems Business Analyst will work with end users in scoping projects, providing detailed business analysis, outlining business rules, and providing documents for processes handled by PeopleSoft Campus Solutions in support of Enrollment Services functions and operations.
 The Business Analyst will lead the design, planning, and implementation of complex projects, and work collaboratively with campus partners. They will provide consultation and facilitate the analysis and definition of business rules, service levels, and user requirements, and work cross-functionally to solve problems, improve processes, and implement changes. The Business Analyst will be responsible for the following:

Provide lead work direction to a team of analysts by providing training, assigning tasks, and prioritizing projects daily
Lead the analysis, configuration, and development of software applications for PeopleSoft Campus Solutions (my.SDSU) in support of Enrollment Services functions and operations.
Independently create written specifications, analyze, and recommend improvements and upgrades to configurations within the Student Information Management System and related systems, including the OnBase imaging/workflow system and Slate CRM
Test and debug software, ensure appropriate exception processing and error reporting, and translate data requirements into database designs.
Maintain PeopleSoft Campus Solutions training documentation for Enrollment Services functions.
Support annual updates to the Cal State Apply application database, including edits to Quadrant 4 custom questions.
Work with IT staff to test, configure and monitor the daily import of application data from Cal State Apply to my.SDSU.
Troubleshoot application download errors and oversee data cleanup efforts when necessary.
Develop queries for admissions units to help facilitate the application evaluation process
Support admissions-related modules within the SIS, including auto-review jobs and applicant checklists
Lead in the design, planning, and implementation of complex projects.

This is a full-time (1.0 time-base), benefits eligible, permanent/probationary position. This position is designated exempt under FLSA and is not eligible for overtime compensation. Standard SDSU work hours are Monday – Friday, 8:00 a.m. to 4:30 p.m., but may vary based on operational needs.
 This position is approved for partial telecommuting with onsite work in San Diego. This position is scheduled to work three days on campus and two days from the telecommuting site. However, the schedule may vary based on operational needs.





Department Summary
 Enrollment Services comprises Undergraduate and Graduate Admissions, Evaluations, Office of the Registrar, Prospective Student Services, and Enrollment Communications. Enrollment Services implements SDSU enrollment management policies and provides services to students from their initial point of interest in SDSU to their graduation.






Education and Experience
 To enter this classification, a basic foundation of knowledge and skills in applications programming and systems analysis and related programming support functions is a prerequisite. This foundation would normally be obtained through a bachelor’s degree, preferably in computer science or business, or equivalent training and applied experience. Foundation knowledge and skills for the Analyst/Programmer, depending on the position assignment, may include working knowledge of a specific industry standard applications programming language and knowledge of standard systems analysis techniques.





Key Qualifications

Demonstrated experience working with Student Information Systems, PeopleSoft Campus Solutions preferred
Bachelor’s degree or equivalent experience
Minimum of Four years of complex system analysis and hands-on project management experience, preferably in a highly regulated environment (education, healthcare, military, etc.)
Experience providing lead work direction
Project management experience in software development and system integration
Experience in the business analysis of application development and project management
General knowledge of SQL, object-oriented programming concepts, and relational database design
Working experience with Linux/Unix operating system environments is a plus







Compensation and Benefits
 Starting salary upon appointment is not expected to exceed $8,334 per month.
 Salary placement is determined by the education, experience, and qualifications the candidate brings to the position, internal equity, and the hiring department’s fiscal resources.
 San Diego State University offers a rich benefits package that constitutes a major portion of total compensation. For more information regarding SDSU benefits, please click here.
 CSU Classification Salary Range: $4,678 - $11,547 per month.





Diversity and Community at SDSU
 At SDSU, our diversity gives us power and benefits every single member of our community.


 Principles of Community
 At San Diego State University, we are a community of diverse individuals who have and represent many perspectives, beliefs, and identities. This diversity lends our community strength, and we commit to creating and sustaining an inclusive and intellectually vibrant environment that benefits all members of our university.
 SDSU’s Principles of Community is an aspirational statement that is intended to evolve over time. The statement reflects the ideals we are encouraged to uphold in our interactions with one another.





Supplemental Information
 Initial review of the required application materials, including cover letters and resumes, will begin on July 7, 2023. To receive full consideration, apply by July 6, 2023. The position will remain open until filled.
 The person holding this position is considered a ‘mandated reporter’ under the California Child Abuse and Neglect Reporting Act and is required to comply with the requirements set forth in CSU Executive Order 1083 as a condition of employment.
 San Diego State University is not a sponsoring agency for staff or management positions (e.g., H-1B visa). Applicants must currently be authorized to work in the United States on a full-time basis. Offers of employment are contingent upon the presentation of documents that demonstrate a person's identity and authorization to work in the United States, which are consistent with the provisions of the Immigration Reform and Control Act.
 A background check (including a criminal records check) must be completed satisfactorily and is required for employment. SDSU will make a conditional offer of employment, which may be rescinded if the background check reveals disqualifying information, and/or it is discovered that the candidate knowingly withheld or falsified information. Failure to satisfactorily complete the background check may affect the continued employment of a current SDSU employee who was conditionally offered the position.


 SDSU is an Equal Opportunity Employer that considers all qualified candidates for employment and does not discriminate on the basis of race, religion, color, ancestry, age, disability, genetic information, gender, gender identity, gender expression, marital status, medical condition, national origin, sex, sexual orientation, covered military and veteran status, or any other protected characteristic or status. Reasonable accommodations will be provided for qualified applicants with disabilities who request an accommodation by contacting Taylor Jaress at tjaress@sdsu.edu."
Clinical Quality Data Analyst - Quality Management,Rady Children's Hospital-San Diego,"San Diego, CA",Posted 30+ days ago,$35.84 - $49.28 an hour,https://www.indeed.com/rc/clk?jk=3d25888c941e4255&fccid=943df4dfeeeb9fc4&vjs=3,"This position is on the clinical data analyst team within the Sadler Center for Quality. 

 Responsible for utilizing quality improvement science methodologies to develop and track key clinical quality and administrative indicators. Provides support to the development and production of operational clinical reports. Participates in continuous improvement through the measurement and monitoring of desired outcomes. Supports clinical data analysis and production for various quality projects. 


JOB SUMMARY:
 Applies a thorough, advanced level knowledge of clinical and financial analysis and knowledge of systems technology to identify and design solutions within the decision support, research and/or quality systems. Requires an understanding of database functionality and reporting tools, the ability to creatively apply these concepts to a complex and changing environment and the ability to articulate underlying system processes and their affect on data and reports. Responsible for the development of Service Line analyses and the monitoring of Service Line trends. Serves as a resource to department managers and facilitates their use of corporate data. Works across departments to provide supportive information for various initiatives including productivity, business planning, volume trend analysis, case mix index, reimbursement and costing. Manages the integration and comparison of internal data with various benchmarks (e.g., NACHRI, OSHPD, Thomson Reuters, and PHIS). 


MINIMUM QUALIFICATIONS:
 Bachelor's Degree 

 3 years of experience 

 Ability to prepare complex written and graphic reports that explain and interpret data trends 

 Ability to develop a query and return accurate data files to serve as the foundation of the analysis 

 Basic hospital financial reporting and experience with both financial and clinical analyses in a healthcare setting 

 Ability to perform complex analysis using modeling, forecasting and statistical analysis methodologies 

 Knowledge of healthcare terminology, coding practices, and KPI definitions 

 Ability to work effectively in a multi-faceted, time-critical work environment 

 Ability to manage and manipulate files maintaining content integrity 

 Ability to work with decision-makers to define the parameters of an analysis data set 

 Knowledge of effective organizational and management principles 

 Knowledge of Service Line management and accountability practices 


PREFERRED QUALIFICATIONS:
 Master's Degree 

 5 years of experience 

 The expected hiring range for this position is $35.84 to $49.28 
Rady Children’s Hospital is committed to compensation that is externally competitive and internally equitable. We demonstrate this commitment by conducting regular market reviews to remain competitive with organizations of similar size in the nonprofit, healthcare sector. The range listed above does not represent the full salary range for the position but is the expected hiring range for qualified candidates. Compensation decisions consider a variety of factors including experience, education, licensure, unique skillsets, organizational need, and internal equity."
Senior Data Analyst,Sayres & Associates,"San Diego, CA 92101",PostedJust posted,"$105,000 - $120,000 a year",https://www.indeed.com/rc/clk?jk=e1246cc678728c33&fccid=3a001817603dd4c4&vjs=3,"Sayres is a leader in defense support services to the DOD. Our 300+ program support experts empower our customers' senior leadership with long term planning and analytics, insightful decision making, and day-to-day operations. Headquartered in Washington, DC, Sayres has offices in California, Maine, and Alabama. Sayres and Associates has been providing excellence in service to the Federal Government since 2001. 
Sayres is seeking Senior Data Analyst with Secret Clearance in San Diego, CA.
 Qualifications and Education

 Ten (10) years of direct work experience with designing and maintaining data models and structures along with data extraction and preparation processes.
 Six (6) years working with similar data structures/ environments as identified in the Statement of Work (SOW)to include: Validating data, Data Team collaboration, usage of database applications & analytical tools, data query & collection processes providing accurate and appropriate interpretation of data.
 Extensive shipboard experience, preferably including service as a Surface Warfare Officer (SWO) Junior Officer (JO).
 Strong background in data analytics, including experience with statistical analysis, data visualization, and advanced analytic techniques.
 Proficiency in leveraging data to support decision-making processes and drive operational improvements.
 Excellent communication skills, with the ability to effectively convey complex data insights to senior Navy leaders.
 Familiarity with data sources and systems commonly used in the naval environment.
 BS degree in Data Science, or Computer Science; Information Systems, or Information Technology; Electrical, Software, or Systems Engineering
 Active DoD Secret Clearance or higher.

 Salary:

 The salary for this position is likely $105,000 - $120,000. Salary ranges are not, however, a guarantee of compensation or salary; rather, salary will be set based on experience, geographic location and possibly contractual requirements and could fall outside of this range.

 The position description is only meant to be a representative summary of the major responsibilities and accountabilities performed by the incumbents of this position. The incumbents may be requested to perform position-related tasks other than those stated in this description. All qualified applicants will receive consideration for employment without regard to race, color, religion, gender, sexual orientation, national origin, age, gender identity, disability, or veteran status.
 At Sayres, our employees enjoy an atmosphere conducive to realizing their potential through personal and professional development while simultaneously exceeding customers' expectations.
 We offer a broad spectrum of technical, engineering, and administrative services including acquisition, financial and program management; fleet synthetic training; logistics; ship construction engineering; systems engineering and integration; wargaming; test and evaluation; security, counterintelligence and policy analysis.
 Sayres is headquartered in Washington, DC with offices throughout the United States and has a presence abroad.
 #CJ"
