job_title,company,job_location,post_date,salary,job_url,job_description
Director of Yield Analysis and Data Science,INTEL,"Hybrid remote in Phoenix, AZ",Posted 30+ days ago,,https://www.indeed.com/rc/clk?jk=8e0117868f9f41a8&fccid=936367796261bd6e&vjs=3,"Job Description

 Fab Sort Manufacturing (FSM) is responsible for the production of all Intel silicon using some of the world's most advanced manufacturing processes in fabs in Arizona, Ireland, Israel, Oregon and 2 new greenfield sites in Ohio and Germany. As part of Intel's IDM2.0 strategy, FSM is rapidly expanding its operation to deliver output for both internal and foundry customers with state-of-the-art technologies arriving in high-volume manufacturing at a 2-year cadence going forward. Intel recently created HVM Global Yield organization in FSM to strengthen its yield operation and enable fast-paced yield ramp-up in early HVM phases for each technology in collaboration with Technology Development team and FSM fab managers.
   This job requisition is to seek a director level leader in FSM HVM Global Yield organization, reporting directly to VP of HVM Global Yield. The selected candidate will build and lead a team in HVM Global Yield organization and work with other leaders in the org, fab module/yield managers and TD leaders to support yield ramp-up and process optimization in early production stage, supporting internal and external customers.
  
 Director of Yield Analysis and Data Science
   Responsibilities:
  

Build and lead Yield analysis and Data Science team with machine learning and modeling experts in FSM HVM Global Yield organization to execute HVM yield roadmap.
Collaborate with Technology Development, Process Integration, Device Integration and Defect teams to identify yield detractors and yield enhancement opportunities and support fast paced yield ramp-up in high-volume manufacturing phases.
Identify root cause of systematic yield issues and propose mitigation plan in defined timeline to meet committed production yield targets.
Develop a model to predict production line yield accurately in early stage of Si progression and deliver proposals to benefit production yield.
Develop a new yield analysis methods and algorithms to deliver world class yield analytics and machine-learning solutions as part of the technical experts' team the candidate leads.
Formulate yield problems mathematically, identify solutions, and remove technical and non-technical barriers by influencing stakeholders to achieve successful solutions.
Lead technical interactions with internal and external customers.


 Qualifications
 Minimum qualifications are required to be initially considered for this position. Preferred qualifications are in addition to the minimum requirements and are considered a plus factor in identifying top candidates.


   Minimum Qualifications:
  

Bachelor's or Master's. in science or engineering area.
10+ years of experience in advanced node semiconductor industry in yield analysis and data science.
5+ years of leadership experience to manage and direct an organization of 20+ data analysis engineers in fast-paced high-volume semiconductor manufacturing environment to drive yield, technology, quality output and cost.
Strong expertise in python and other program languages to develop a new analysis method and algorithms using large amount of fab data. Expertise in big data analysis and machine-learning.
Working knowledge in module processes including lithography, dry etch, wet etch, CMP, diffusion, implant, thin films and metrology.
Working knowledge in Device Physics, including FinFET devices.
Problem-solving and project/program management experience with strong self-initiative and self-learning capabilities.
Demonstrated interpersonal skills to perform at leadership role including influencing, engaging, and motivating.
Proven track record of working across organization through matrix structures in order to accomplish strategic objectives with conflicting priorities.
Must demonstrate strong communication skills.

 Preferred Qualifications
  

Ph.D. in science or engineering area.
Experience in new semiconductor technology development

 Requirements listed would be obtained through a combination of industry relevant job experience, internship experiences and or schoolwork/classes/research.
 
 Inside this Business Group
 As the world's largest chip manufacturer, Intel strives to make every facet of semiconductor manufacturing state-of-the-art - from semiconductor process development and manufacturing, through yield improvement to packaging, final test and optimization, and world class Supply Chain and facilities support. Employees in the Technology Development and Manufacturing Group are part of a worldwide network of design, development, manufacturing, and assembly/test facilities, all focused on utilizing the power of Moore’s Law to bring smart, connected devices to every person on Earth.
 
 Covid Statement
 Intel strongly encourages employees to be vaccinated against COVID-19. Intel aligns to federal, state, and local laws and as a contractor to the U.S. Government is subject to government mandates that may be issued. Intel policies for COVID-19 including guidance about testing and vaccination are subject to change over time.
 
 Posting Statement
 All qualified applicants will receive consideration for employment without regard to race, color, religion, religious creed, sex, national origin, ancestry, age, physical or mental disability, medical condition, genetic information, military and veteran status, marital status, pregnancy, gender, gender expression, gender identity, sexual orientation, or any other characteristic protected by local law, regulation, or ordinance.
 
 Benefits
 We offer a total compensation package that ranks among the best in the industry. It consists of competitive pay, stock, bonuses, as well as, benefit programs which include health, retirement, and vacation. Find more information about all of our Amazing Benefits here: https://www.intel.com/content/www/us/en/jobs/benefits.html
 
 Working Model
 This role will be eligible for our hybrid work model which allows employees to split their time between working on-site at their assigned Intel site and off-site. 
 In certain circumstances the work model may change to accommodate business needs.


Position of Trust
 This role is a Position of Trust. Should you accept this position, you must consent to and pass an extended Background Investigation, which includes (subject to country law), extended education, SEC sanctions, and additional criminal and civil checks. For internals, this investigation may or may not be completed prior to starting the position. For additional questions, please contact your Recruiter.
  JobType 
Hybrid"
Staff Engineer - Data Engineering,Early Warning Services,"Scottsdale, AZ 85260 (North Scottsdale area)",Posted 28 days ago,,https://www.indeed.com/rc/clk?jk=1ba37845ac8e6c4f&fccid=094bfee9de38aca9&vjs=3,"Come build the next-gen fintech at Early Warning, network operator of Zelle®, where we’re relentlessly focused on empowering prosperity in all its forms.
 


   From fast money movement for over 100 million people who can access Zelle® directly through their banking app to new account opening and beyond – we make a difference in the lives of consumers and businesses every day and enable them to live their best financial lives. And we’re only getting started.
 


   With new state-of the-art offices in Scottsdale, AZ (Headquarters) and Chicago, IL – plus a growing presence in San Francisco – we’re entering our next big chapter.
 

   People matter to us, so we think our best work is done when we’re together, in-person. From informal interactions, to sharing ideas, to mentoring and beyond. We also believe in workplace flexibility and empowering teams to determine the rhythm of work to create an inclusive culture. Through the power of innovative collaboration, we offer hybrid and (when necessary) virtual (“remote”) workplace models.
 


   We focus all hiring efforts in a few states and within driving distance of an office location to enable in-person collaboration when and where possible. Priority hiring locations are Scottsdale, AZ, Illinois, NY tri-state metro area (New Jersey, New York and Connecticut) and San Francisco, CA. On exception we will hire in secondary locations such as District of Columbia, Florida, Georgia, Maryland, Nevada, North Carolina, South Carolina, Texas and Virginia. We are not actively recruiting in Colorado, Rhode Island or Washington.
 


   Join us and make your mark on what’s next in fintech.
 


Applicants must be authorized to work for any employer in the United States. We are unable to sponsor an employment Visa for this position.




    Overall Purpose
  


    This position is a key role in the development, test, and deployment of complex solutions.
  


    Essential Functions
  



      Build data strategy for broad or complex requirements with insightful and forward-looking approaches that go beyond the direct team and solve large open-ended problems.
    


      Participate in the strategic development of methods, techniques, and evaluation criteria for projects and programs.
    


      Drive all aspects of technical and data architecture, design, prototyping and implementation in support of both product needs as well as overall technology data strategy.
    


      Provide leadership and technical expertise in support of building a technical plan and backlog of stories, and then follow through on execution of design and build process through to production delivery.
    


      Guide a broad functional area and lead efforts through the functional team members along with the team’s overall planning.
    


      Represent engineering in cross-functional team sessions and able to present sound and thoughtful arguments to persuade others. Adapts to the situation and can draw from a range of strategies to influence people in a way that results in agreement or behavior change.
    


      Collaborate and partner with product managers, designers, and other engineering groups to conceptualize and build new features and create product descriptions.
    


      Actively own features or systems and define their long-term health, while also improving the health of surrounding systems.
    


      Assist Support and Operations teams in identifying and quickly resolving production issues.
    


      Develop and implement tests for ensuring the quality, performance, and scalability of our application.
    


      Actively seek out ways to improve engineering and data standards, tooling, and processes.
    


      Supporting the company’s commitment to risk management and protecting the integrity and confidentiality of systems and data.
    



    Minimum Qualifications
  



      Education and/or experience typically obtained through a Bachelor’s degree in computer science or related technical field.
    


      Ten or more years of relevant related experience
    


      Seven or more years of experience in the development of complex data platform, distributed systems, SaaS, cloud solutions, micro services.
    


      Six or more years of experience in the development of Data Warehouse, Big Data – structured & unstructured platforms, real-time & batch processing, data standards.
    


      Four or more years of experience in development of Business Intelligent Solutions
    


      Two or more years of experience in development / operationalization of Artificial Intelligence / Machine Learning Models / Model development life cycle activities (implementing feature engineering, data pipelines, model operationalization, model monitoring).
    


      Demonstrated experience in delivering business-critical systems to the market.
    


      Ability to influence and work in a collaborative team environment.
    


      Experience designing/developing scalable systems.
    


      Extensive experience implementing Data Warehouse (Star / Snow flake schemas) using SQL Server or equivalent, Big Data – HDFS, Elastic Search, ETL process development using IBM Infosphere or equivalent, Reusable Frameworks
    


      Experience with implementing data science solutions using Python, Spark, PySpark, R, Data Robot.
    


      Experience with event-driven architecture and messaging frameworks (Pub/Sub, Kafka, RabbitMQ, etc).
    


      Working experience with cloud infrastructure (Google Cloud Platform, AWS, Azure, etc).
    


      Knowledge of mature engineering practices (CI/CD, testing, secure coding, etc).
    


      Knowledge of Software Development Lifecycle (SDLC) best practices, software development methodologies (Agile, Scrum, LEAN etc) and DevOps practices.
    


      Background and drug screen.
    



    Preferred Qualifications
  

 MS or PHD
 Big Data Platforms (Cloudera, S3)
 Database platforms (Oracle, SQL Server) with experience around performance aspects and replication
 Knowledge of Aerospike, Scality S3, Elastic Search
 Monitoring and Alerting systems experience (AppDynamics) or other observability measures
 Knowledge of ACH/EFT
 Knowledge of real time payment networks (RTP, FedNow)
 FinTech experience
 Kubernetes experience
 Attention to detail: we are a regulated company and our work is precise. We need people to read the fine print. “I” dotting and “T” crossing is not nice to have but necessary. In your submission, please call out your specific experience creating analytics data from operational systems-of-record (SORs) as well as your favorite movie (we like to have fun too!)



    Physical Requirements
  


    Working conditions consist of a normal office environment. Work is primarily sedentary and requires extensive use of a computer and involves sitting for periods of approximately four hours. Work may require occasional standing, walking, kneeling and reaching. Must be able to lift 10 pounds occasionally and/or negligible amount of force frequently. Requires visual acuity and dexterity to view, prepare, and manipulate documents and office equipment including personal computers. Requires the ability to communicate with internal and/or external customers.
  


    Employee must be able to perform essential functions and physical requirements of position with or without reasonable accommodation.
  


    The above job description is not intended to be an all-inclusive list of duties and standards of the position.
  


 Early Warning Services is an affirmative action and equal opportunity employer.




   The pay scale for this position in CA/NY in USD per year is:
 

   a minimum of $145,000;
 

   a maximum of $180,000
 


   This pay scale is subject to change and is not necessarily reflective of actual compensation that may be earned, nor a promise of any specific pay for any specific employee, which is always dependent on legitimate factors considered at the time of job offer.
 


   Early Warning Services takes into consideration a variety of legitimate factors when determining a competitive salary offer, including, but not limited to, the job scope, market rates and geographic location of a position, candidate’s education, experience, training, and specialized skills or certification(s) in relation to the job requirements and compared with internal equity (peers). The business actively supports and reviews wage equity to ensure that pay decisions are not based on gender, race, national origin, or any other protected classes.
 


   Some of the Ways We Prioritize Your Health and Happiness
 


 Healthcare Coverage – Competitive medical (PPO/HDHP), dental, and vision plans as well as company contributions to your Health Savings Account (HSA) or pre-tax savings through flexible spending accounts (FSA) for commuting, health & dependent care expenses.
 401(k) Retirement Plan – Featuring a 100% Company Safe Harbor Match on your first 6% deferral immediately upon eligibility.
 Paid Time Off – Unlimited Time Off for Exempt (salaried) employees, as well as generous PTO for Non-Exempt (hourly) employees, plus 11 paid company holidays and a paid volunteer day.
 12 weeks of Paid Parental Leave
 Maven Family Planning – provides support through your Parenting journey including egg freezing, fertility, adoption, surrogacy, pregnancy, postpartum, early pediatrics, and returning to work.



 And SO much more! We continue to enhance our program, so be sure to 
  
   check our Benefits page here
   for the latest. Our team can share more during the interview process!
 


   Pursuant to the San Francisco Fair Chance Ordinance, we will consider for employment qualified applicants with arrest and conviction records.
 


 Early Warning Services, LLC (“Early Warning”) considers for employment, hires, retains and promotes qualified candidates on the basis of ability, potential, and valid qualifications without regard to race, religious creed, religion, color, sex, sexual orientation, genetic information, gender, gender identity, gender expression, age, national origin, ancestry, citizenship, protected veteran or disability status or any factor prohibited by law, and as such affirms in policy and practice to support and promote equal employment opportunity and affirmative action, in accordance with all applicable federal, state, and municipal laws. The company also prohibits discrimination on other bases such as medical condition, marital status or any other factor that is irrelevant to the performance of our employees."
RESEARCH FELLOW-- Artificial Intelligence,Mayo Clinic,"Phoenix, AZ 85054 (Desert View area)",Posted 30+ days ago,,https://www.indeed.com/rc/clk?jk=1c5982f364b0c3bf&fccid=26877094797beef3&vjs=3,"Why Mayo Clinic


 Mayo Clinic has been ranked the #1 hospital in the nation by U.S. News & World Report, as well as #1 in more specialties than any other care provider. As we work together to put the needs of the patient first, we are also dedicated to our employees, investing in competitive compensation and comprehensive benefit plans – to take care of you and your family, now and in the future. And with continuing education and advancement opportunities at every turn, you can build a long, successful career with Mayo Clinic. You’ll thrive in an environment that supports innovation, is committed to ending racism and supporting diversity, equity and inclusion, and provides the resources you need to succeed.
  



Responsibilities

 The Machine Intelligence in Medicine and Imaging Lab at Mayo Clinic, Arizona is searching for several postdoctoral research scholars. The lab is led by Dr. Bhavik Patel, who is also affiliated with the Ira A. Fulton Schools of Engineering, Arizona State University. The Machine Intelligence in Medicine and Imaging Lab focuses on cutting‐edge research at the intersection of imaging science and biomedical informatics, developing and applying AI methods to large amounts of medical data for biomedical discovery, precision medicine, and precision health (early detection and prediction of future disease).  Research Fellows for this position will: 

Develop foundational AI methods for analyzing and extracting information from clinical texts and imaging.
Assist in advancing clinical prediction models using multi-modal and longitudinal electronic medical records (EMR) and radiological scan data. The scholar will deploy and evaluate these methods as clinical applications to transform medical care.
Participate in multidisciplinary teams to design, develop, implement, and validate pioneering AI based approaches to solve complex data problems in medical imaging.
Apply for, and obtain, extramural funding to support projects focusing on AI applications in medical imaging.


To be successful, the candidate should have:


Imaging science experience with knowledge of Matlab, Python and C++.
Excellent communication skills both verbally and written.
First authored and/or co-authored publications from graduate or postgraduate training.
A background in biomedical informatics and/or data science will be beneficial.

A Research Fellow in Engineering (ENG) is based on role and responsibilities requiring Engineering skills regardless of Ph.D. background. Main skills used in this track may include setting up mechanical research equipment, developing experimental protocols, biomechanics development in orthopedics, implementing protocols, and/or providing engineering technical expertise and analysis. Responsibilities (depending upon area of research) may also involve use of x-ray computed tomography (CT), radiation dosimetry, x-ray physics, and proficiency in Matlab and/or C++ programs. May work in a special engineering group, process and test algorithms, informatics, data for computer programming, and implement algorithms to apply to concepts, research, and clinical applications and devices.  A Research Fellow at Mayo Clinic is a temporary position intended to provide training and education in research. Individuals will train in the research program of a Mayo Clinic principal investigator. Qualified individuals will demonstrate the potential for research as evidenced by their training and peer-reviewed publications and should become competitive for national research grants. Proof of English proficiency is required for J-1 Short-Term Scholars, Research Scholars, Professors, Specialists, and Student Interns sponsored by Mayo Clinic.
 Qualifications

 Must have a Ph.D., M.D., or equivalent doctoral degree in a field deemed relevant by the program.
Additional Qualifications:

Post-graduate degree (PhD or MD, completed or near completion) in biomedical data science, informatics, computer science, engineering, statistics, computational biology, or a related field, with a background or interest in imaging
Experience in machine learning and AI, particularly in computer vision and NLP
Strong record of distinguished scholarly achievement
Outstanding communication and presentation skills with fluency in spoken and written English
Established record of distinguished scholarly achievement




Exemption Status

 Exempt
 

Benefits Eligible

 Yes
 

Schedule

 Full Time
 

Hours/Pay Period

 80
 

International Assignment

 No
 

Site Description


  Just as our reputation has spread beyond our Minnesota roots, so have our locations. Today, our employees are located at our three major campuses in Phoenix/Scottsdale, Arizona, Jacksonville, Florida, Rochester, Minnesota, and at Mayo Clinic Health System campuses throughout Midwestern communities, and at our international locations. Each Mayo Clinic location is a special place where our employees thrive in both their work and personal lives. Learn more about what each unique Mayo Clinic campus has to offer, and where your best fit is.
  




Affirmative Action and Equal Opportunity Employer


 As an Affirmative Action and Equal Opportunity Employer Mayo Clinic is committed to creating an inclusive environment that values the diversity of its employees and does not discriminate against any employee or candidate. Women, minorities, veterans, people from the LGBTQ communities and people with disabilities are strongly encouraged to apply to join our teams. Reasonable accommodations to access job openings or to apply for a job are available.
   




Recruiter

 Lei Feng
 

Department Title

 Research"
Machine Learning Engineer,Defendry,"Scottsdale, AZ",Posted 30+ days ago,,https://www.indeed.com/rc/clk?jk=81f2ae592bc4b943&fccid=65a9cb417dda7c21&vjs=3,"Do you want to make a difference and help save lives? We at Defendry are on a mission to address the current active shooter epidemic by doing what we do best — creating tech solutions. We’re searching for people who share our same passion.
 You will be joining a fast paced, dynamic environment and product team, working with top talent in the fields of Data Science / Machine Learning, Cloud Computing, App Development and Integration (IoT, Drones, Security Systems).
 The Machine Learning Engineer Will work with the Defendry Chief Science Officer to refine current computer vision models, as well as create new features and abilities with new models.
 Requirements:

Python fluency
Experience building new computer vision models with Tensorflow/PyTorch/Caffe.
Knowledge of the various classification/localization techniques (SSD, Yolo, FasterRCNN, etc.)
Some form of quantitative background

Nice to Have:

Experience creating new computer vision models from scratch."
