job_title,company,job_location,post_date,salary,job_url,job_description
Health Technology Data Sr. Analyst,Deloitte,"San Diego, CA",Posted 30+ days ago,,https://www.indeed.com/rc/clk?jk=97298ce5efe67ec3&fccid=9e215d88a6b33622&vjs=3,"Health Technology Sr. Data Analyst 

 Are you looking to make an immediate impact where you can help our clients solve their business challenges? Deloitte's Core Business Operations (CBO) portfolio operates at the center of our client's business. By joining our team, you could help C-suite and program leaders transform their organization and accelerate mission execution through emerging and disruptive technologies, innovative business models, retooled program operations, and industry-driven solutions.
 

Work you'll do 


Provide expertise on Medicare, Medicaid, and Healthcare Analytics
 Analyze, support, and develop data warehouse objects, data quality processes, design and develop fact and dimension tables, logical and physical database design, data modeling, reporting objects, and ETL processes
 Perform data analysis and profiling
 Interpret the rules for data integration and conversion
 Drive client conversations around technical and functional design and specifications
 Work in Cloud-based environment (AWS or Azure)
 Implement technology-enabled business solutions for clients as part of a high-talent team


 Required Qualifications:


 Bachelors degree from an accredited college or university
 5+ years of experience within a Consulting or Health Technology environment
 3+ years of healthcare data analytics experience
 Experience with one or more of the following: SQL/PLSQL, ETL, Cognos, R, Python, Tableau, QlikView, Power Bi, Business Objects 
Ability to travel between 25%-50%
 Must be legally authorized to work in the United States without the need for employer sponsorship, now or at any time in the future


 Desired Qualifications: 


Advanced experience with MMIS 
Advanced experience with Health Data standards 
Experience working in Cloud-based environment (AWS or Azure) 
Oral and written communication skills, including presentation skills (MS Visio, MS PowerPoint) 
The wage range for this role takes into account the wide range of factors that are considered in making compensation decisions including but not limited to skill sets; experience and training; licensure and certifications; and other business and organizational needs. The disclosed range estimate has not been adjusted for the applicable geographic differential associated with the location at which the position may be filled. At Deloitte, it is not typical for an individual to be hired at or near the top of the range for their role and compensation decisions are dependent on the facts and circumstances of each case. A reasonable estimate of the current range is $98,000 to $125,000. 
You may also be eligible to participate in a discretionary annual incentive program, subject to the rules governing the program, whereby an award, if any, depends on various factors, including, without limitation, individual and organizational performance. 


The team 

 Our Health Technology team implements repeatable solutions to solve our government clients' most critical health technology-related issues. We advise on, design, implement, and deploy solutions that are focused on government health agencies ""heart of the business"" issues including claims management, electronic health records, health information exchanges, health analytics, and health case management.
 
 Our clients seek a fresh perspective on how to leverage reusable, interoperable, and flexible solutions that will enable them to reduce costs, improve health outcomes, ad respond to public health crises. Professionals will use their deep health, government, and technology consulting experience to strategically help solve our client's technology challenges.
 

How you'll grow

 At Deloitte, our professional development plan focuses on helping people at every level of their career to identify and use their strengths to do their best work every day. From entry-level employees to senior leaders, we believe there's always room to learn. We offer opportunities to help sharpen skills in addition to hands-on experience in the global, fast-changing business world. From on-the-job learning experiences to formal development programs, our professionals have a variety of opportunities to continue to grow throughout their career."
Human Resources Analyst 1,Crinetics Pharmaceuticals,"Hybrid remote in San Diego, CA 92121",Posted 30+ days ago,,https://www.indeed.com/rc/clk?jk=d7534ea2a8821a8d&fccid=61ad85b378bba57d&vjs=3,"Crinetics is a pharmaceutical company based in San Diego, California that develops much-needed therapies for people with rare endocrine diseases. We were founded by a dedicated team of scientists with the simple belief that better therapies developed from rigorous innovation can lead to better lives. Our work continues to make a real difference in the lives of patients. We have a prolific discovery engine and robust pipeline across preclinical and clinical development. We are driven by science with a patient-centric and team-oriented culture. This is an exciting time to join Crinetics as we shape our organization into the world’s premier fully-integrated endocrine company from discovery to patients. Come join our team as we transform the lives of others.
 


Position Summary:


  The Human Resources Analyst 1 will report to the Senior Director, Talent Acquisition and New Employee Experience. The Human Resources Analyst 1 is the technical point of contact for assisting and supporting the HR team with analyzing, planning, developing, benchmarking, and executing cross-functional HR programs. This is a hybrid position located in San Diego, CA. Onsite presence is required 1-2 days a week. Relocation will not be provided.
 


Essential Job Functions and Responsibilities:
 These may include but are not limited to:
 

Generate and provide complex recurring and ad-hoc Human Resources and Talent Acquisition reports.
Analyze data to ensure integrity, accuracy, and completeness of HR data in all HRIS platforms and systems.
Support internal and external audit preparations.
Prepare, reconcile, and maintain reports including turnover, recruiting, headcount, and other HR data.
Collaborate with all HR functions such as Compensation, Talent Acquisition, Learning & Development, Benefits, and Human Resources Business Partners to align in the necessary reporting and supporting cross-functional needs.
Work with legal, finance, quality, procurement and other internal departments to ensure compliance.
Collect, validate, and analyze complex HR data sets using Excel (Pivot charts, VLOOKUP, etc.), visualization techniques (Power Bi, Tableau), or other methods.
Recommend business process or system enhancements to improve reporting quality.
Assist in the recruitment processes, including, but not limited to, calendaring interviews, assisting in development of job descriptions, and ordering background checks.
Complete E-Verify authorization for new-hires.
Maintain employee files and records in electronic and paper form with accuracy and attention to detail.
Assist with the new-hire onboarding process.
Assist with data entry into Paycor (HRIS) for new hire information, position changes, merit increases, and personal information updates.
Update various HR tracking systems/spreadsheets.
Participate in employee activities and team-building events.
Assist with annual and off-cycle audits.
Answer routine questions and explain current practices and guidelines.
Assist in keeping the company compliant with multi-state, federal and local regulations.
Assist the HR Department in various projects and programs.
Other duties as assigned.



Education and Experience:


Minimum BA/BS in Human Resources or Business with 3 years’ related experience (an equivalent combination of experience and education may be considered).
General knowledge of basic HR practices.
Excellent customer service and interpersonal skills.
Effective time management skills and a high degree of attention to detail.
Excellent research, analytical, and problem-solving skills.
Good strategic and critical thinking abilities.
Previous experience in managing HRIS systems.
Effective interpersonal skills to work effectively with internal and external stakeholders at all levels.
Ability to prioritize and deliver a high volume of work and deliverables across multiple projects and programs, demonstrating flexibility and resilience amid evolving priorities.
Eager to learn in a dynamic environment.
Ability to work independently and adapt to a growing organization’s needs.
Strong sense of good judgement and ability to maintain confidential information is critical.
Strong communication skills (oral/written) and good PC skills (MS Office, HRIS & Applicant Tracking).
High level of proficiency in Microsoft Office Suite, and Excel.
Strong organization skills and the ability to manage multiple tasks at once.
Must understand and respect company core values and possess the highest integrity.



Physical Demands and Work Environment:
 Physical Activities: On a continuous basis, sit at desk for a long period of time; intermittently answer telephone and write or use a keyboard to communicate through written means. Some walking and lifting up to 25 lbs. may be required. The noise level in the work environment is typically low to moderate. The physical demands described above are representative of those that must be met by an employee to successfully perform the essential functions and responsibilities of this job. Reasonable accommodations may be made to enable individuals with disabilities to perform the essential functions and responsibilities.
 


Travel:
 You may be required to travel for up to 5% of your time.
 


The Anticipated Base Salary Range: $70,000-$78,000
 In addition to your base pay, our total rewards program consists of a discretionary annual target bonus, stock options, ESPP, and 401k match. We also provide top-notch health insurance plans for employees (and their families) to include medical, dental, vision and basic life insurance, 20 days of PTO, 10 paid holidays, and a winter company shutdown. The final salary offered to a successful candidate will be dependent on several factors that may include but are not limited to the type and length of experience and education. Crinetics Pharmaceuticals is a multi-state employer, and this salary range may not reflect positions that work in other states. Your recruiter can share more about the specific salary range during the hiring process.
 


  The final offer to a successful candidate will be dependent on several factors that may include but are not limited to the type and length of experience and education. Crinetics Pharmaceuticals is a multi-state employer, and this salary range may not reflect positions that work in other states. Your recruiter can share more about the specific salary range during the hiring process.
 


Equal Opportunity Employer:
 Crinetics is proud to be an Equal Opportunity Employer. We provide equal employment opportunities to all employees and employment applicants without regard to unlawful considerations of sex, sexual orientation, gender (including gender identity and/or expression), pregnancy, race, color, creed, national or ethnic origin, citizenship status, religion or similar philosophical beliefs, disability, marital and civil union status, age, genetic information, veteran status or any personal attribute or characteristic that is protected by applicable local, state or federal laws
 


Vaccination requirement:
 Following extensive monitoring, research, consideration of business implications, and advice from internal and external experts, Crinetics requires that all employees and contractors be fully vaccinated and have received the COVID-19 vaccines as a condition of employment. “Full vaccination” is defined as two weeks after both doses of a two-dose vaccine or two weeks since a single-dose vaccine has been administered. Anyone unable to be vaccinated, either because of a sincerely held religious belief or a medical condition or disability that prevents them from being vaccinated, can request a reasonable accommodation."
Principal Business Intelligence Specialist (Hybrid,UC San Diego,"Hybrid remote in San Diego, CA",Posted 30+ days ago,"$71,000 - $115,500 a year",https://www.indeed.com/rc/clk?jk=0ee5ad3066fcaa99&fccid=10b5a4abcc6bf067&vjs=3,"Payroll Title:
        BUS INTEL SPEC 4 
       
        Department:
        BFS - Business Intelligence & 
       
        Hiring Pay Scale
        $71,000 - $115,500 / Year 
       
        Worksite:
        Torrey Pines Center South 
       
        Appointment Type:
        Contract 
       
        Appointment Percent:
        100% 
       
        Union:
        Uncovered 
       
        Total Openings:
        1 
       
        Work Schedule:
        8 hrs/day, Mon - Fri (Hybrid) 
      




#122375 Principal Business Intelligence Specialist (Hybrid
Extended Deadline: Thu 7/27/2023






UC San Diego values equity, diversity, and inclusion. If you are interested in being part of our team, possess the needed licensure and certifications, and feel that you have most of the qualifications and/or transferable skills for a job opening, we strongly encourage you to apply.


For the safety and well-being of the entire university community, the University of California requires, with few exceptions, that all students, faculty and staff be vaccinated against the COVID-19 virus and influenza before they will be allowed on campus or in a facility or office. For more information visit: 
Flu Vaccine Mandate
 / 
COVID Vaccine Policy




Job posting will remain open until a suitable candidate has been identified. First Review Date 4/14/23.


This is a 100% contract position through June 30, 2024, with the possibility of extension or conversion to career status, based on business needs and funding availability.



This position offers a hybrid work arrangement, which includes a combination of onsite and remote work.


DESCRIPTION
 POSITION OVERVIEW:
 Serving as Principal Business Intelligence Specialist in Business Intelligence & Financial Reporting, a division of Business and Financial Services (BFS). For UC San Diego, this position develops highly complex and high visibility Oracle dashboards and reports for BFS division and campus wide usage. Recommends best practices for report development, maintenance, access, and catalog infrastructure. Evaluates data sources for relevance, integrity and accuracy. Identifies issues and collaborates on solutions to data management challenges.
 Incumbent leads reporting subject matter expert workgroups to identify and understand reporting gaps. Gathers report development requirements from subject matters experts and proposes new report designs to best meet the needs of users. Assists with troubleshooting difficult report development issues and provides recommendations for improving report performance. While this position does not have direct supervisory duties, it does serve as an advisor and mentor to less experienced Oracle developers both on the BI & Financial Reporting team as well as on other BI teams across the university.
 To review the full job description for this position, please visit: https://drive.google.com/file/d/1w0V4L50yV5OCy5HFf3SpqjVSGvCfLHtz/view?usp=sharing
 THE ""WHY""
 This is an exceptional opportunity to do innovative work that means more to you and those we serve at UC San Diego. Recognized as one of the top 15 research universities worldwide, our culture of collaboration sparks discoveries that advance society and drive economic impact. Best practices and best people at the best place to work! Our candidates come from all walks of life and so do we. We hire great people from a wide variety of backgrounds, not just because it’s the right thing to do, but because it makes our organization thrive! 
Our organizational core values (People First, Innovation, Integrity, Excellence, Accountability) define the culture at Business & Financial Services and push us to be our best. We’re excited to grow our team and learn from people that want to make a difference. If you love what you do and comfortable with designing for the future, we encourage you to consider joining our progressive organization. We recognize that candidates come with a wealth of experience and talent beyond just the technical requirements of the job. Diversity of experience and skills combined with passion is the key to innovation and excellence. To do great, we have to be great. Our organization places particular emphasis on equity, diversity, and inclusion incorporating exit interview feedback to enhance retention efforts and advance issues affecting the overall staff experience. If you're a team player with bold ideas and execution, now is the right time to connect!
 QUALIFICATIONS

 Bachelor's degree in related area and / or equivalent experience / training.
 Proven experience in Oracle dashboard intelligence platforms (i.e., OTBI, BI Publisher, FRS), enterprise performance management software, and other analytical technologies.
 In-depth knowledge of business intelligence functions, advanced analytics, industry standards and best practices. 
Proven experience in information technologies, including high level of proficiency and understanding with data mapping, data mining and statistical software. 
Proven statistical and data analysis skills, including high proficiency and understanding with data mapping, data mining, and statistical software tools such as SPSS, SAS, R.
 Advanced knowledge and skill in internal databases, BI applications, tools, and systems. 
Extensive demonstrated experience mining data from multiple sources and databases using SQL, Access, pivot tables and other query tools.
 Advanced project management skills
 Excellent interpersonal, verbal and written communication skills.

 SPECIAL CONDITIONS

 Background check is required.


You are encouraged to review additional information about our organization: 
https://blink.ucsd.edu/finance/about-us/index.html
About UCSD: http://ucsd.edu/about/index.html 
Benefits: http://blink.ucsd.edu/HR/benefits/work-life/health.html
This position is also eligible for full:
1) Health/Dental/Vision Insurance 2) Vacation/Holidays 3) Life Insurance 4) UC Retirement Plan


 Pay Transparency Act
 Annual Full Pay Range: $71,000 - $160,000 (will be prorated if the appointment percentage is less than 100%) 
Hourly Equivalent: $34.00 - $76.63 
Factors in determining the appropriate compensation for a role include experience, skills, knowledge, abilities, education, licensure and certifications, and other business and organizational needs. The Hiring Pay Scale referenced in the job posting is the budgeted salary or hourly range that the University reasonably expects to pay for this position. The Annual Full Pay Range may be broader than what the University anticipates to pay for this position, based on internal equity, budget, and collective bargaining agreements (when applicable).









Job offer is contingent on successful engagement in the UC COVID-19 Vaccination program (fully vaccinated with documented proof or approved exception/deferral).
 To foster the best possible working and learning environment, UC San Diego strives to cultivate a rich and diverse environment, inclusive and supportive of all students, faculty, staff and visitors. For more information, please visit UC San Diego Principles of Community.
 
The University of California is an Equal Opportunity/Affirmative Action Employer. All qualified applicants will receive consideration for employment without regard to race, color, religion, sex, national origin, disability, age, protected veteran status, gender identity or sexual orientation. For the complete University of California nondiscrimination and affirmative action policy see: http://www-hr.ucsd.edu/saa/nondiscr.html 
UC San Diego is a smoke and tobacco free environment. Please visit smokefree.ucsd.edu for more information."
Business Analyst,The Marlin Alliance,"San Diego, CA 92110 (Old Town area)",Posted 7 days ago,,https://www.indeed.com/rc/clk?jk=7bd9883c12db659a&fccid=7e33e91cd0bb4175&vjs=3,"The Marlin Alliance, Inc. is seeking a Business Analyst to coordinate and coach our software development team in San Diego, CA. This position supports our Navy customer and requires a US Secret security clearance. We need a go-to person for applying scrum to produce high-quality work.  Established in 2002, The Marlin Alliance, Inc. – a woman-owned small business – provides business transformation consulting, professional services, and technical support to government, military, healthcare, telecommunications, and utility industry clients.
Essential Duties and Responsibilities

Help to achieve strategic business goals by using, improving or developing systems.
Identify opportunities for improving processes & procedures.
Utilize technology to eliminate problems and maximize efficiency.
Solid understanding of the Navy organization’s goals to support process improvements toward these goals.
Analyze the business processes for inefficiencies.
Make recommendations for solutions or improvements that can be accomplished through new technology or alternative uses of existing technology.
Act as liaison between business stakeholders, such as management, customers or end users, and the software development or information technology team.
Analyze and communicating stakeholder needs by translating business requirements into software requirements.
Document and evaluate required data and information.
Use modeling, testing and data models to improve the flow of information through the organization to enhance project success.
Develop and conduct presentations on a variety of project management, process improvement, LSS/CMMI, software and/or systems engineering topics.
Provide training and education in project management, process improvement and software and systems engineering, as well as LSS known methodology (LSS/CMMI).
Foster process improvement by assisting projects in defining, implementing and improving their engineering, management, and business processes.
Brief customers on best practices, process improvement and Security & Emergency Preparedness Office (SEPO) engineering topics.
Maintain and share best practices using online collaboration and content management tools.
Develop business, project management, LSS-type, software and/or systems engineering policies, standards, processes, and procedures.
Conduct and/or participate in CMMI based appraisals to determine the process maturity of a project or organization.
Presentation support and administrative support as required.

Requirements

Minimum 2 years’ experience and education in process improvement, project management, business analysis or business process analysis, systems or software engineering.
Excellent oral and written communications skills, organizational and workload management, interpersonal, and teambuilding skills.
Proven ability to work with a variety of systems and sources of data.
Ability to use standard MS office software and a working knowledge of Excel and PowerPoint
A Bachelor’s degree is highly desirable.
An active SECRET clearance or the ability to obtain a SECRET security clearance

Preferred Qualifications

Bachelor’s Degree.
DoD experience.
Lean Six Sigma, CMMI, or process improvement knowledge and certification.

Work Environment and Mental/Physical Demands
The physical demands described here are representative of those that must be met by an employee to successfully perform the essential functions of this position. Reasonable accommodations may be made to enable individuals with disabilities to perform the functions.

Typical office environment with no unusual hazards.
The noise level in the work environment is usually moderate.
Constant sitting while using the computer terminal.
Constant use of sight abilities while reviewing documents.
Constant use of speech/hearing abilities for communication.
Occasional reaching, stooping, kneeling, or crouching may be required.
Occasional lifting up to 20 pounds.
Constant use of mental alertness.
Frequent work under deadlines.

Job Classification:
Associate II
$85,000 - $140,000
Disclaimer:
This job description in no way states or implies that these are the only duties to be performed by the employee(s) incumbent in this position. Employees will be required to follow any other job-related instructions and to perform any other job-related duties requested by any person authorized to give instructions or assignments. All duties and responsibilities are essential functions and requirements and are subject to possible modification to reasonably accommodate individuals with disabilities.
To perform this job successfully, the incumbents will possess the skills, aptitudes, and abilities to perform each duty proficiently. Some requirements may exclude individuals who pose a direct threat or significant risk to the health or safety of themselves or others. The requirements listed in this document are the minimum levels of knowledge, skills, or abilities.
This document does not create an employment contract, implied or otherwise, other than an “at-will” relationship.
An Equal Opportunity Employer/Protected Veterans/Individuals with Disabilities."
