job_title,company,job_location,post_date,salary,job_url,job_description
Data Analyst,Mind Mint,"Scottsdale, AZ 85257 (South Scottsdale area)",Posted 5 days ago,"$90,000 - $110,000 a year",https://www.indeed.com/rc/clk?jk=2d4c6547292139e1&fccid=c7ce09e85e125cd3&vjs=3,"Mastermind.com, created in partnership by Dean Graziosi and Tony Robbins, is the #1 online platform for people who are looking to market and monetize their knowledge base.
 We are looking for a talented individual to join our team as a Financial Data Analyst. Join the largest brand disrupting the digital product space, backed by Dean Graziosi and Tony Robbins.


 This Data Analyst position is based in Phoenix, Arizona, and will require you to work from the Mastermind headquarters in Scottsdale, AZ.


 THE ROLE 
As a Financial Data Analyst at Mastermind.com, your passion lies in uncovering hidden patterns and extracting valuable information from large datasets. You will dive deep into the data we provide on customer churn/retention, financial metrics, user behavior on the Mastermind app, customer success, etc., uncovering valuable insights. You will need strong analytical intelligence and should be looking to grow and ready to own the reporting on this segment of our business.



Consolidating and analyzing financial and customer data
Preparing and presenting statistical and other financial data
Tracking data as well as manipulating data from various applications
Creating ad hoc financial reports and other types of financial analysis and report generation
Researching, solving problems, and supporting forecasting and budgeting tools/models as needed
Excellent compensation model based on experience ranging from $90k-110k.
Mastermind.com is a career-driven company where you will have the potential to help people improve themselves, get to the next level in their businesses, and get better business results



 RESPONSIBILITIES

Designs custom trending reports and data displays for projects and standard report formats for ongoing functions based on organizational needs for information
Participates in internal and external research projects by collecting, reviewing, and summarizing data
Use/develop sophisticated models to analyze financial and customer data, spot trends, and develop forecasts
Assess data-seeking opportunities to improve data or processes, including automation opportunities
Generates presentations, graphics, forms, and other documents to demonstrate information flow and project results
Collect, audit, and integrate data from a variety of sources for purposes of analyzing or inclusion into research or operating reports
Analyze data and make recommendations to department managers to improve financial operating results and/or improve the quality of outcomes
Take a lead role in the preparation of the annual budget
Reviews monthly operating statistics and data and prepares operating reports
Perform other duties as assigned



 REQUIREMENTS

Bachelor's degree in Statistics, Mathematics, Finance, or a related field
3+ years of experience in Financial Data Analysis and Excel Modeling
2 years of experience with SQL
Experience with business intelligence and data visualization
Working knowledge of financial strategies
Strong organizational and multitasking skills
Ability to communicate finance information orally/visually to a non-financial audience
Ability to work well under deadlines
Excellent communication, interpersonal, and presentation skills
Detail-oriented and can perform in a high-pressure environment



 PERKS & BENEFITS

Compensation is based on experience ranging from $90000 to $110000 per year
Excellent Medical benefits
401(k) administration and matching program
Incredible opportunities for growth and development
Amazing in-office culture at our HQ in Scottsdale
Become part of a mission team making a difference!



 COMPANY DESCRIPTION
 Mastermind.com, created in partnership by Dean Graziosi and Tony Robbins, is the #1 online platform for people who are looking to market and monetize their knowledge base.
 We are redefining what ""Self-Education"" means to the world. Mastermind is not just ""another software"" but an all-in-one platform for Education, Entertainment, Implementation & Community. Mastermind serves people worldwide who seek transformation, fulfillment, and success outside the traditional education path. The Mastermind software empowers and enables you to implement what you learn & actually get paid, in addition providing a community where you are surrounded by like-minded individuals cheering you on to YOUR NEXT LEVEL.
 From practicing a healthy work-life balance to great perks and benefits, Mastermind.com is all about supporting their employees' goals and HELPING CHANGE THE WORLD ONE STUDENT AT A TIME!"
Operations Data Analyst,Mesa Airlines,"Phoenix, AZ",EmployerActive 5 days ago,,https://www.indeed.com/rc/clk?jk=cad163b1801f4360&fccid=6fd6feefd431c6e4&vjs=3,"Essential Functions:

Maintain company's operational statistics databases to ensure accuracy and compliance with contractual requirements.
Generate Daily Report of various Operational Statistics to track company's performance and determine eligibility for operational incentives or penalties.
Conduct reconciliation for flight delays and cancelations by comparing data with partner databases.
Run monthly operational statistics reports used by Finance Department to determine statistic driven expenses and revenue.
Work directly with mainline flying partner to reconcile statistics used for billing purposes.
Work closely with members of SOC and IT Departments on daily and ad hoc basis.
Compile and submit various monthly, quarterly and annual reports to the Department of Transportation (DOT). Work with DOT to resolve any data submission issues.
Ad Hoc statistical analysis.
Assist VP Contract Revenue and Risk Management with assorted projects
Requirements: 
 
Knowledge/Skills/Education/Licenses:


Bachelor's Degree in Statistics, Mathematics, or other quantitative discipline
Basic or Advanced MS Excel knowledge
Familiar with basic SQL query
Familiar with data visualization tool like MS Power BI.
Willing to learn and pay attention to details
Ability to cooperate and to work individually



Working Conditions/Equipment/Safety:


  Normally works in a general office environment with the use of computer, printer, telephone, copier, fax, and calculator.
 


Conformance Statement:


  Employees are expected to comply with Mesa Airlines policies and procedures, and to conduct themselves in a professional manner at all times.
 

  The above statements are intended to describe the general nature and level of work being performed by individuals assigned to this position. They are not intended to be an exhaustive list of all duties, responsibilities and skills required of individuals so classified."
IT Business Analyst,"Envision, LLC","Phoenix, AZ 85004 (Central City area)",Posted 12 days ago,,https://www.indeed.com/pagead/clk?mo=r&ad=-6NYlbfkN0A13XXEAKoVsy1UjAxA2tJa37vkRdGHJdX4gYp8IY3tTrw_4gCp5Mih5CrFgTLdhqXIMlHNP-tMB6QmDjth9KIMkIlWgt9GXOgg1p24rNrAAjgi7Fot-qskovJPmcqREdwlxGeenWFab9P7UpP2g2zznhRDzVrQMY5lTWICadrpAwBQyqN6HUlaRM0ifItGVLmmv5S3TrgdIVNj_KfrU20v7iH4mG58mQU_ul-sZAk61NzvdQM1QlEkRb_qfjJzdtALelB9gMzMBUzhyzb1Q0kn2b4vHmmAKxIRB6daygY3hlM4bo4lRkR_ockhzy4W5-D5h-bj1qN_0GEhNqRmV-YPqXNoRdLZDcA3u1MOrnltic3bduaO-0d90EJpJxpaxQls4gUm1YreYI2v7NLUSnc0j-ev8Rzp9aRs6WwyuTrxxltdJ4BHMkNttiYK_ODs6NSglZJWf_Cf3eLJFDwNtP-UQoWtuJDC9UySVHaf6k3X9a4AxJbDgjj8aGsgM3ZZ-L5NVa2y3e-wo0l3kehLMkbbj8z2BsLtu8aJwHEH64VA8Iyr7slpUnyyETPLW0_3-DxXXZNVjpVueFRrz5mMNDg_izds5nYwF4YTIOGgP_mYiw==&xkcb=SoA_-_M3MBqCp_QgRR0FbzkdCdPP&p=14&fvj=0&vjs=3,"Envision is seeking multiple IT Business Systems Analyst for our long-term roles in Phoenix, AZ for the following areas: 



IT Infrastructure
Data Center migration
Software implementation for Asset Management Systems
Software implementation for Enterprise Applications
Cybersecurity implementation
 LOCAL CANDIDATES IN THE PHOENIX, AZ AREA REQUIRED 

 NO C2C OR THIRD PARTIES ALLOWED 

 Role 

 Lead Business Analyst primary is to assist the PMO with BA activities which includes conducting a full business case assessment for a new project request or supporting a PM team with project execution. All project initiatives managed under the PMO have high complexity and high visibility. Therefore, the individuals selected for these positions must have excellent communication skills, active listening skills and high emotional intelligence to manage multiple stakeholders. The desired candidates will have strong skills in gathering business and technical requirements, mapping business processes and data and system workflows, facilitating gap analyses, and contributing to other written business deliverables necessary to increase the business value and quality of services and solutions while bridging the communication gap between the business and technical staff. The LBSA will work independently, proactively communicate and collaborate with external and internal customers, and be able to juggle multiple initiatives simultaneously. Additionally, attention to detail, business writing and organization skills are a must. 

 Qualifications 



5 years of experience as a Lead Business Analysts conducting business cases, business and technical process mapping, requirements gathering, etc.
Will work with Project Manager, Stakeholders, and end users’ requirements and gap analysis working toward review and selection of asset management platform, so experience with RFI / RFP and vendor management will be helpful for this project.
Bachelor’s degree in business administration, management, information technology or related field
Strong analytical and business skills required, including a thorough understanding of how to interpret customer business needs and translate them into an application and operational requirements.
Conduct user acceptance testing, training support, and contribution to the creation of business deliverables.
Excellent verbal and written communication skills and the ability to interact professionally with a diverse group, executives, managers, and subject matter experts.
Exceptional attention to detail; documents must be professional and ready for Executive review.
Advanced proficiency with MS Word, OneNote, Excel, PowerPoint, Project/PWA, and Visio, wireframe
Procurement experience (RFP, RFI, RFQ, etc.)
Project implementation support experience (multi-year, large teams, phased rollouts, etc.)
 Preferred Experience and Training 



Certified Business Analysis Professional (CBAP) designation from the International Institute of Business Analysis (llBA)
Other certifications and skills such as Lean, Kaizen, Scrum / Agile Project management methodologies, ITIL Training and/or Certification
Critically evaluate information gathered from multiple sources, reconcile conflicts, decompose high-level information into details, abstract up from low-level information to a general understanding, and distinguish user requests from the underlying true needs.
Business Intelligence tools"
Data Analyst,Arizona Hispanic Chamber of Commerce,"Phoenix, AZ 85014 (Camelback East area)",Posted 4 days ago,Full-time,https://www.indeed.com/rc/clk?jk=5f80fcb18359d89e&fccid=4d45afdda78c3269&vjs=3,"Purpose of Position:
 Make-A-Wish Arizona has an exciting opportunity for a Data Analyst to join a growing, high-performing team that helps drive Make-A-Wish Arizona’s decision-making through data-driven practices, analyses, research projects, and systems support. This role will provide the opportunity to work on a variety of highly-visible, exciting, analytic projects while encouraging creativity and growth within the team. The role will work closely with Make-A-Wish America and other Make-A-Wish chapters on data quality/integrity gaps as well as solutions and enhancements to the Salesforce system we rely upon. It will also provide broad exposure to the nonprofit and social services sector in a dynamic, fast-paced, and rewarding environment.

 Who We Are:

     At Make-A-Wish® Arizona, we are more than a great place to work — our work is life- changing. Together, we create life-changing wishes for children with critical illnesses.
     More than 40 years ago the inspiration for Make-A-Wish began with one little boy's wish to be a police officer. Today, together with our volunteers, donors, staff and supporters,
     Make-A-Wish has granted more than 500,000 life-changing wishes and transformed countless lives.
   


 We at Make-A-Wish Arizona are extremely team-oriented. We are striving to create an inclusive and diverse office that incorporates teamwork, open communication, and strategic leadership. We are looking for passionate individuals who share the same passion for building trust, improving communication, and creating strategies for success.
   


 What we offer:


Competitive compensation with annual incentive potential up to 10% of salary
Comprehensive benefit package: Medical, Vision, Dental
Health Savings Accounts generously funded by the employer and Flexible Spending
 Account Options
   
Employer-paid Short Term Disability, Long Term Disability and Life Insurance
401(k) Retirement Savings Plan with a generous employer match
20 PTO days, 5 Sick Days, 14 Paid Holidays, and 1 Volunteer Day annually
Paid sabbatical after 5 years of service
A cohesive and welcoming culture
We close at noon every Friday!


 Essential Duties/Responsibilities:

 Data Analytics/Analysis:

 Building real-time dashboards that present essential wish granting, fundraising and financial data for agency stakeholders
 Finding areas and ways to automate/improve recurring business processes
 Managing and extracting data from a variety of sources
 Supporting adherence to data quality protocols and performing quality assurance testing
 Sharing data with stakeholders on fixed intervals (e.g., weekly, monthly and annual reporting)
 Serving as Subject Matter Expert on Salesforce
 Partnering with leadership to identify areas for growth and increased mission impact by analyzing data from across the organization
 Assisting the fundraising efforts of the Chapter’s Development Team through training, data support/analysis, data fidelity and development of tools to meet emerging fundraising opportunities
 Unearthing patterns in data that warrant further investigation and analysis
 Utilizing appropriate tests to draw conclusions yielding accurate, action-worthy insights
 Using Lean Methodology for process improvements (Six Sigma certification a plus)
 Effectively communicating sophisticated analyses outcomes to a broad audience, including executive leadership and department heads

 Systems Support:

 Helping to leverage the full potential of newly adapted data systems (e.g., Salesforce, Netsuite)
 Contributing to the vision for larger project builds (e.g., data warehouse)
 Providing ongoing support of existing systems and related processes
 Conducting small- to mid-scale research projects using administrative datasets with sources ranging from finance, mission, development, and donor care
 Supporting the development of survey instruments and implementation of survey instruments intended to improve the services provided to Make-A-Wish Arizona stakeholders
 Coordinating the collection and processing of survey data
 Applying appropriate research methodology and communicating findings to internal and external stakeholders

 Other Duties/Responsibilities:

 Other duties and special projects as assigned
 Assisting Program and/or Development Team with tasks during peak seasons (e.g. annual gala, Summer wish granting)


 Job Qualifications:
 Knowledge, Skill & Ability:

 Bachelor’s degree
 Minimum of two years professional, full-time experience in an applied analytical role
 Strong communicator, able to effectively partner with others (within and external to the organization)
 Ability to confidently multi-task as needed
 Experience with Salesforce in a data management capacity
 Experience with Netsuite or other financial software
 Advanced proficiency in Microsoft Excel (e.g. Pivot Tables, VBA, Macros)
 Demonstrated experience with dashboarding software (e. g. Python, Tableau, but preferably Power BI)
 Able to work independently
 Detail-oriented, organized, and effective problem solver
 Exemplary customer service skills
 Process-Improvement mindset
 Team player


 Diversity, Equity & Inclusion Vision:
 Make-A-Wish is committed to championing diversity, equity and inclusion, fostering an organization that is accessible and welcoming. In turn, we are uniting communities to help make more wishes possible.

 Our mission is most effectively fulfilled through a commitment to diversity, equity and inclusion as core values and practice.
 It is only through our mosaic of different cultures, perspectives and experiences that we can grant life-changing wishes to every eligible child.
 As the world’s largest wish-granting organization we stand against racism and intolerance and are committed to representation and acceptance, creating a sense of belonging, and practicing fairness in creating opportunities for our wish families, volunteers and staff.


 Note: Employees are held accountable for all duties of this job, though this job description is not intended to be an exhaustive list of all duties, responsibilities or qualifications associated with this job.

 How to Apply for this position:
 Submit your Resume and Cover letter to [email protected]



Gallery"
Data Analyst,Choice Fitness,"Phoenix, AZ",Posted 20 days ago,Full-time,https://www.indeed.com/rc/clk?jk=f5a2ff123ef88fa0&fccid=3d140420375054c4&vjs=3,"We are looking for a hard working and dedicated data analyst to join our team! Redvest is a mobile finance application that has ranked top #100 on the iOS app store. You will get to work with app store, android, and iOS analytics as well as usage event based data. An ideal candidate is someone who is eager to learn and get creative to find solutions and insights that will improve our users' experience. 

 Qualification 

 Google Analytics Experience 

 SQL 

 Data presentation tools 

 Python 

 Java Script, API knowledge is good to have 

 Mobile App experience is a plus 

 Data management, integration and manipulation 

 Experience with large datasets 

 Predictive modeling and optimization 

 Interest in mobile apps and stock market/finance is a must."
Sr. Data Analyst,BioCare,"Tempe, AZ",EmployerActive 2 days ago,"$100,000 - $130,000 a year",https://www.indeed.com/company/BioCare/jobs/Senior-Data-Analyst-08ac6c0c01a7c56a?fccid=71b2a7eacc0e3a8d&vjs=3,"If you want to be part of a growing company that’s making a difference in people’s lives, BioCare may be just the place for you! We are a distributor of specialty pharmaceuticals that treat rare diseases, such as hemophilia, immune system deficiency, and ALS. We are looking for a Sr. Data Analyst in the Tempe (Phoenix), AZ or Dallas, TX area to join our growing IT & Analytics team. Apply today to be part of the BioCare family and support our ability to get the right medication into the right hands, at the right time!
*** Please note: This is a remote position, but the person chosen for hire needs to live in the Tempe/Phoenix, AZ or Dallas, TX area for periodic in-person projects, touchpoints, and/or team building. ***
Why you should apply:

Low cost and flexible medical, dental & vision plans
17 days (136 hours) Paid Time Off accrued during your first 12 months
Up to 40 hours Paid Sick Time accrued annually
401k with 5% employer match
Company paid life and disability insurance
Competitive salary of $100 – 130k, depending on qualifications & experience

Typical duties:

Assess and complete new reporting requests and enhance existing reports
Follow SOPs to design and develop new reports and visualizations based upon defined requests
Lead and manage delivery of daily, weekly, and monthly sales, finance, and transactional reports, both manual and automated
Manage data modeling, visualizations, and analysis for existing and new reports
Develop data strategy for projects to onboard new trading partners and systems
Create and manage delivery of routine and ad hoc reports needed to support business and trading partner requests
Lead the development of report standards and best practices for repeatable tasks
Use structured and unstructured data from ERP and other systems to develop simple and meaningful data representations that support and fulfill the requests from business users
Support and implement continuous improvement processes across the reporting portfolio to incorporate automation
Mentor analytics team on various data projects, process improvements, and technical innovations
Extract data from identified databases (on premises and cloud), and select appropriate techniques to transform it to a structure that is relevant to the problem
Analyze complex data elements, extract, filter, and aggregate data through logical SQL queries and programming
May provide maintenance support, including enhancements and production support activities
Deliver quality customer service to all team members, customers, and stakeholders
Actively listen and collaborate with end users to design effective solutions that resolve issues

What we are looking for:

Bachelor’s degree in an IT or Computer Science discipline, or equivalent combination of education and experience
7+ years’ experience as a reports developer/analyst with the ability to read and write complex queries, create database objects (tables, views, stored procedures, user-defined functions), and create complex visualizations and dashboards
Expertise in Power BI from creating complex dashboards, visualizations, DAX queries to managing data security
Sound experience designing and developing reporting solutions with SSRS/PBRS and other MSDN tools
Experience with Azure Data Factory, Azure Data Warehouse is a plus
Expert in different SQL techniques for data transformation and data analysis
Experience in working source control tools such as SVN and GitHub
Certification in Power BI modeling, visualization and analyzing data is preferable
Quality and Improvement focus to ensure reliable, timely, and complete data
Ability to multitask and prioritize competing tasks
Possess an analytical mindset and problem-solving aptitude
Familiarity with working in Agile environment leveraging DevOps, change management process, and tools like Jira
Ability to work independently and in a fast-paced, high growth environment
Excellent organizational skills and focused attention to detail
Must be able to pass a drug test and background check aligned with company and accreditation standards

We are an equal opportunity employer, and all qualified applicants will receive consideration for employment without regard to race, color, religion, sex, age, gender, marital status, national origin, ancestry, disability, genetic information, medical condition, military/veteran status, sexual orientation, gender identity, gender expression, or any other characteristic protected by law.
Job Type: Full-time
Benefits:

401(k) 5% Match
AD&D insurance
Dental insurance
Dependent health insurance coverage
Disability insurance
Flexible spending account
Health insurance
Health savings account
Life insurance
Paid holidays
Paid sick time
Paid time off
Partner benefits
Prescription drug insurance
Tuition reimbursement
Vision insurance
Work from home

Compensation package:

Yearly bonus
Yearly pay

Experience level:

7 years

Schedule:

Monday to Friday

Work Location: In person"
