job_title,company,job_location,post_date,salary,job_url,job_description
Business Intelligence Data Analyst,Sunland Asphalt,"Phoenix, AZ 85020 (Camelback East area)",EmployerActive 2 days ago,Full-time,https://www.indeed.com/rc/clk?jk=244e15a533412285&fccid=981f604141ba034c&vjs=3,"PURPOSE
 The Data Analyst is responsible for developing reports, metrics, and analytics to gather and present data from various enterprise systems. The position will also work to ensure that data is accurate and complete.
 ESSENTIAL DUTIES AND RESPONSIBILITIES 

Employee shall perform all duties and responsibilities with Sunland's Core Values at the forefront.
 Must be an advocate of safety and follow safety policies and procedures.
 Design and create reports for internal departments.
 Maintain data integrity to ensure data is accurate and complete.
 Work with users and managers to identify missing or incorrect data and how to correct the data going forward.
 Work with users to understand and document data and interface requirements.
 Work as part of a reporting team to field various reporting needs.
 Learn and work with new reporting systems to fit business needs.
 Perform quality assurance on new reports and changes to reports.
 Update existing reports.
 To produce Ad-hoc reports when requested.
 Troubleshoot and debug applications.
 Test and maintain data software products to ensure strong functionality and optimization.
 Clearly and regularly communicate with management and technical support colleagues.
 Protects organization's value by keeping information confidential.
 Any, and all other duties assigned. Please note this job description is not designed to cover or contain a comprehensive listing of activities, duties or responsibilities that are required of the employee for this job. Duties, responsibilities, and activities may change at any time with or without notice.

 COMPETENCIES

 Collaboration Skills, Communication Proficiency and Customer/Client Focus.
 Leadership, Decision Making and Ethical Conduct.
 Problem Solving and Thoroughness.
 Project Management and Time Management.
 Data and Programming Logic.
 Strong knowledge of Excel.
 Must be a strong critical thinker.
 Great attention to detail.

 SAFETY 

This is considered a non-safety-sensitive position but is subject to the company's drug and alcohol policy, as well as all OHSA regulations.
 All employees must wear the appropriate personal protective equipment (PPE) when required.
 Serves as a safety ambassador by complying with federal, state, and local laws, as well as Company safety policy, enforces safe work practices, and proactively identifies and remedies worksite hazards.

 PHYSICAL DEMANDS AND WORK ENVIRONMENT

 This position operates in a professional office environment, and routinely uses standard office equipment; repetitive standing, walking, and sitting is required; frequent use of hands and fingers to handle or feel objects, tools or controls; reach with hands and arms and climb stairs; occasionally lift or move office products and supplies up to 20 pounds; stamina to maintain attention to detail despite interruptions; vision to read printed materials and a computer screen and hearing and speech to communicate in person and over the telephone.
 May be required to work on a project site and if so, would be exposed to all weather, including extreme hot and cold temperatures.
 Employee may be exposed to various chemicals, vapors, pollutants, virus or other air-borne pathogens, gases, uneven surfaces, loud noises, moving vehicles or machines and dust/debris.

 POSITION TYPE/EXPECTED HOURS OF WORK

 This is a full-time position. Occasional evening and weekend work may be required as job duties demand.

 TRAVEL

 Travel is primarily local during the business day, although some out-of-town and overnight travel may be required.

 MINIMUM QUALIFICATIONS
 Education and Work Experience

 Bachelor's degree in Computer Science or related field, and/or equivalent work experience and/or training; or equivalent combination of education and experience required.
 Experience with PowerBI.
 Knowledge of SQL and Query Design.
 Must be fluent in English, i.e., must be able to speak, read and write English.


 CERTIFICATIONS, LICENSES & REGISTRATIONS

 A valid driver's license and a clean motor-vehicle record preferred.
 Passing a pre-employment drug and alcohol screening and background check is required.

 AAP/EEO STATEMENT
 Sunland Asphalt is an equal employment opportunity employer and, as such, we consider individuals for employment according to their abilities and performance. Employment decisions are made without regard to age, race, religion, sex, national origin, physical or mental disability, genetic information or any other classification protected by law. All employment requirements mandated by state and federal regulations will be met. Discriminatory or harassing conduct in the workplace, whether committed by management or non-management employees or outside person (vendors, customer, etc.) is prohibited."
HR Content Business Analyst,INTEL,"Hybrid remote in Phoenix, AZ",Posted 30+ days ago,Full-time,https://www.indeed.com/rc/clk?jk=2984a448fb26a043&fccid=936367796261bd6e&vjs=3,"Job Description
 As a Human Resources Content Business Analyst, you will be responsible for:

 Creating and defining the business process(es) within a specific group or function.
 Developing Human Resources chatbot content and managing strong relationships with Human Resources business partners to understand business processes and drivers for content changes.
 Development, implementation, and maintenance of human resource information systems associated with the collection, retrieval, accessibility, and usage of employee information.
 Data testing and troubleshooting, performing testing and quality checks to ensure business and data quality requirements.
 Evaluating software and hardware needs, designing new or modifying existing processes and systems to meet changing demands, and ensuring communications internally and externally.

 Your day-to-day in this role might include:

 Creating, reviewing, and editing in-product content in Trello, wireframes and flows, and Excel.
 Writing Human Resources guidelines and UX copy (navigational, buttons, etc.).
 Researching Human Resources policies and programs, synthesizing and summarizing information from multiple systems.
 Working with Subject Matter Experts for verification and approval of content.
 Conducting analysis on areas of content performance, such as gap analysis or impact analysis.
 Optimizing content performance based on analysis in Power BI and Excel.
 Contributing to and supporting broad Human Resources programs with many cross-functional stakeholders.
 Reporting on content performance and providing feedback to teammates and cross-functional stakeholders on user pain points.

 Qualifications
 Minimum qualifications are required to be initially considered for this position. Preferred qualifications are in addition to the minimum requirements and are considered a plus factor in identifying top candidates.  Minimum Qualifications:

 The candidate must possess a Bachelor's degree in Communications, Journalism, Human Resources, Human Computer Interaction, Business Management Systems, or any other related field.
 1+ years of experience in the following:
   
 Working in Human Resources, Communications, or Change Management.
 Writing for business, editing against a style guide, and editorial processes.
 Simplifying technical, detailed topics into easily understood information.


 Preferred Qualifications:

 1+ years of experience working on a product development team or in a user experience role.
 Experience working with agile methodology and/or working on tight deadlines.
 Experience balancing user experience with business needs.
 Experience organizing content in a complex library or design system, using tags, metadata, and/or localization.


 This position is not eligible for Intel immigration sponsorship.
 Inside this Business Group
 Intel's Human Resources group is responsible for hiring, developing and retaining the best and brightest employees while continuing to strengthen the company's culture and values. Intel Human Resources provides first-rate, cost-effective services and support to employees worldwide and is dedicated to advancing Intel's business goals.
 
 Other Locations
 US, NM, Albuquerque; US, OR, Hillsboro
 
 Covid Statement
 Intel strongly encourages employees to be vaccinated against COVID-19. Intel aligns to federal, state, and local laws and as a contractor to the U.S. Government is subject to government mandates that may be issued. Intel policies for COVID-19 including guidance about testing and vaccination are subject to change over time.
 
 Posting Statement
 All qualified applicants will receive consideration for employment without regard to race, color, religion, religious creed, sex, national origin, ancestry, age, physical or mental disability, medical condition, genetic information, military and veteran status, marital status, pregnancy, gender, gender expression, gender identity, sexual orientation, or any other characteristic protected by local law, regulation, or ordinance.
 
 Benefits
 We offer a total compensation package that ranks among the best in the industry. It consists of competitive pay, stock, bonuses, as well as, benefit programs which include health, retirement, and vacation. Find more information about all of our Amazing Benefits here: https://www.intel.com/content/www/us/en/jobs/benefits.html
 
 Working Model
 This role will be eligible for our hybrid work model which allows employees to split their time between working on-site at their assigned Intel site and off-site. 
 In certain circumstances the work model may change to accommodate business needs.
 JobType 
Hybrid"
Data Analyst,OrthoArizona,"Phoenix, AZ 85018 (Camelback East area)",Posted 30+ days ago,,https://www.indeed.com/rc/clk?jk=1e08a957f7390893&fccid=462aecd81e7be6e4&vjs=3,"The Data analyst will be responsible for using their knowledge of data processing and business development strategies to partner with business executives on key decisions within OrthoArizona. This role will collaborate with other data professionals to extra data figures, create reports, and assist with new process improvements.
 


DUTIES AND RESPONSIBILITIES


Interpret data, analyze results using statistical techniques and provide ongoing reports for internal and/pr external clients
Develop, implement and maintain leading-edge analytics systems, taking complicated problems and building simple frameworks
Proactively analyze data to answer key questions for stakeholders or yourself, with an eye on what drives business performance, and investigate and communicate which areas need improvement in efficiency and productivity
Acquire data from primary and secondary data sources, maintain data systems, provide executive dashboards with data
Collaborate with team members to Identify, analyze, and interpret trends or patterns in complex data sets
Blend data from multiple systems to create reports, dashboards, and presentations based on recommendations and findings
Filter and clean data by reviewing reports, and performance indicators to locate and correct problems
Work with executives and other business leaders to identify and prioritize business and information needs
Locate and define new process improvement opportunities




QUALIFICATIONS



Must have a minimum of two (2) years of progressively responsible healthcare data management and analysis experience using revenue cycle and hospital financial software applications
3-5 years experience as a data analyst or business data analyst
Bachelors degree in Computer science, information management, or related field
Technical expertise regarding data models, database design development, data mining, and segmentation techniques
Experience with EMR Databases
Rev Cycle background a huge plus
SQL/Pivot table a must
Power BI or similar visualization experience
Experience with Microsoft Access, Excel, and other business intelligence tools to extract, analyze, and report data
Ability to querying SQL
General knowledge of the healthcare industry
Strong knowledge of and experience with reporting packages, databases, and programming
Knowledge of statistics and experience using statistical packages for analyzing data sheets"
Research Data Analyst,CBRE,"Phoenix, AZ 85016 (Camelback East area)",Posted 30+ days ago,Full-time,https://www.indeed.com/rc/clk?jk=94fc44a8ce7f2769&fccid=c9b9e477b3c84b4d&vjs=3,"Posted 
     

      22-Mar-2023 
     



      Role type 
     

      Full-time 
     









      Areas of Interest 
     

      Research 
     









      Location(s) 
     

      Phoenix - Arizona - United States of America 
     










       CBRE is using this platform to provide general information to individuals who want to learn more about a career at CBRE. If an opportunity opens that matches your qualifications, we will reach out to you at that time. We are growing a world-class organization with a world-class team and appreciate your interest in CBRE. We welcome you to explore our Careers page and apply directly to any positions that interest you. We will not consider the submission of resumes on this platform as an expression of interest in any posted position at CBRE.
      












Summary: Responsible for the management of EMEA property data sets as well as research and analysis for a variety of commercial real estate data projects and initiatives. The role will encompass certain regular tasks around the management and analysis of property data, as well as a range of activities that contribute to and support the team’s delivery of other projects.

 Hours: 6am–2pm or 7am–3pm Phoenix time. This is to ensure as many overlapping hours with the EMEA teams.

 Key Responsibilities

Analyze, enrich, and create property data with a focus on establishing a global property data platform that the business can trust as its primary source for market intelligence.
Engages and supports local market research teams within EMEA.
May assist with data intelligence research in a variety of support roles.
Other duties as assigned.
No formal supervisory responsibilities in this position. Provides informal assistance such as technical guidance, and/or training to coworkers. May lead project teams and/or plan, and supervise assignments of lower level employees.


Qualifications

Bachelor's degree (BA/BS) from four-year college or university, preferably in Real Estate, Economics, Finance, Business, and preferably at least one-year experience and/or training; or equivalent combination of education and experience.
Strong organizational and analytical skills. Strong written and verbal communication skills. Ability to provide efficient, timely, reliable, and courteous service to customers. Ability to effectively present information.
Project Management skills required as this role will be the key contact between the US team and EMEA teams.
Ability to comprehend, analyze, and interpret data sets. Ability to solve problems when presented. 
Intermediate knowledge of Microsoft Office required.
Ability to work with teams across multiple countries and communicate understanding of tasks and/or projects.
Requires basic knowledge of real estate and data terms and principles. 
Possess a positive work attitude and ability to work in a team environment.
Decisions made with thorough understanding of procedures, company policies, and business practices to achieve general results and deadlines. Responsible for setting work unit and/or project deadlines. Errors in judgment may cause short-term impact to department.














      CBRE is an equal opportunity employer that values diversity. We have a long-standing commitment to providing equal employment opportunity to all qualified applicants regardless of race, color, religion, national origin, sex, sexual orientation, gender identity, pregnancy, age, citizenship, marital status, disability, veteran status, political belief, or any other basis protected by applicable law. We also provide reasonable accommodations, as needed, throughout the job application process. If you have a disability that inhibits your ability to apply for a position through our online application process, you may contact us via email at [email protected] or via telephone at +1 866 225 3099 (U.S.) and +1 866 388 4346 (Canada). 
     



NOTE: Some, but not all, of our positions may have an additional requirement to comply with COVID-19 health and safety protocols, including COVID-19 vaccination proof and/or rigorous testing. If you have questions about the requirement(s) for this position, please inform your Recruiter."
Data Analyst,Stool Bus Septic Services,"Phoenix, AZ",Posted 1 day ago,$38.00 - $39.79 an hour,https://www.indeed.com/company/Stool-Bus-Septic-Services/jobs/Data-Analyst-25f23de69ef6a42f?fccid=59a80b4bec92de3d&vjs=3,"Responsibilities:- Collect, analyze, and interpret complex data sets to identify trends, patterns, and insights- Develop and maintain data models, databases, and systems for efficient data storage and retrieval- Create visualizations and reports using tools such as Visio and other analytics platforms- Collaborate with cross-functional teams to define data requirements and ensure data integrity- Identify opportunities for process improvement and provide recommendations based on data analysis
Experience:- Bachelor's degree in a relevant field such as Data Science, Statistics, or Computer Science- Proven experience in data analysis, preferably in a business or analytical role- Proficiency in data visualization tools such as Visio or similar software- Strong analytical skills with the ability to translate complex data into actionable insights- Familiarity with statistical analysis techniques and tools- Excellent problem-solving skills and attention to detail- Strong communication skills to effectively present findings to stakeholders
Note: Experience with vaticinate is a plus.
This role requires a highly analytical mindset and the ability to work with large datasets. The successful candidate will have a strong understanding of data analysis techniques and tools, as well as the ability to communicate complex findings to both technical and non-technical stakeholders. If you are passionate about uncovering insights from data and driving data-informed decision-making, we encourage you to apply.
Job Types: Full-time, Contract
Pay: $38.00 - $39.79 per hour
Benefits:

Dental insurance
Health insurance
Life insurance
Vision insurance

Compensation package:

Monthly bonus
Performance bonus
Quarterly bonus
Retention bonus
Signing bonus
Yearly bonus

Experience level:

4 years

Schedule:

8 hour shift
Day shift
Monday to Friday

Ability to commute/relocate:

Phoenix, AZ: Reliably commute or planning to relocate before starting work (Required)

Education:

Bachelor's (Required)

Experience:

R: 4 years (Required)
Python: 4 years (Required)
Data analytics: 4 years (Required)

Work Location: In person"
Data Analyst| Footprint Center,Oak View Group,"Phoenix, AZ 85004 (Central City area)",Posted 23 days ago,"$70,000 - $85,000 a year",https://www.indeed.com/rc/clk?jk=6a6f2d0ee785ad40&fccid=44aebefb9ffe0aca&vjs=3,"Overview: 
 
   Oak View Group is looking for a Data Analyst who can leverage OVG’s abundant data assets to help our business leaders solve their most complex problems. This new, in-venue position of Data Analyst will perform industry changing research and analysis for multiple areas for OVG Hospitality. The role is highly visible and supports venue types of all shapes and sizes with primary support over the Footprint Center, Arizona State University, and other venues in the southwest. This position is responsible for understanding our client’s F&B programs, reviewing and analyzing internal and external data, and making recommendations to improve OVG’s decision making in support of our clients goals.
 


 This role will pay a salary of $70,000 to $85,000.
 


 For FT roles: Benefits: Health, Dental and Vision insurance, 401(k) savings plan, 401(k) matching, and paid time off (vacation days, sick days, and 11 holidays).
 

 Responsibilities: 
 
Collects and provides analysis of relevant reports and insights concerning current and potential markets as well as performance and industry trends for the Food & Hospitality industry.


   Develop then pursue ongoing in-depth knowledge of the industry, sharing insights, trends, benchmarking and best practices 
 

Combines data as needed from disparate data sources to complete analysis and builds processes to automate this collection for future longitudinal studies.
Participates in strategic initiatives like business development or new lines of business.


   Pursues a variety of issues ranging from understanding our customers and vendors to ensure profitable product management.
 

With minimal oversight, effectively communicate analysis to senior leaders and clients across the enterprise using plain speak.
Effectively manage competing priorities both planned and ad-hoc.
Proficient knowledge of the Food Services & Hospitality Business or similar lines of business.
Acts as subject matter expert in one or more data subject areas.
Contributes at industry events or conventions to be an ambassador for SPAN-360.
Generate insights from large data sets that are actionable and add value to the business.


 Qualifications: 
 
In Depth understanding of Complex SQL and Statistical Methods.
Experience and comfort with multiple Business Intelligence tools.


   Moderate to Advance Microsoft Office knowledge, particularly in Excel.
 

A passion for finding creative & simple solutions for complex problems.
3-5 years work experience in Data Analysis, BI, Statistics.
Minimum: BS degree in Statistics, Data Analytics, Business, or similar.


 Vaccination Statement: 
 
   We are committed to ensuring all our buildings and office locations are the safest in the world for artists, teams, employees, and fans. Based on recent encouraging trends in the U.S. and Canada. We highly encourage our employees to continue to get vaccinate and boosted against COVID-19. Should circumstances change, we may need to reinstate vaccination requirements, in whole or in part, to safeguard the health of our employees, guests, performers, athletes, and partners."
